ticker,title,desc,date_raw,url,source
ACB,"Vốn hóa ACB ""bốc hơi"" 1.340 tỉ đồng sau tin thất thiệt - Laodong.vn","Vốn hóa ACB ""bốc hơi"" 1.340 tỉ đồng sau tin thất thiệt  Laodong.vn","Mon, 06 Jan 2025 08:00:00 GMT",https://news.google.com/rss/articles/CBMimAFBVV95cUxNUVlzZGVYRVdiTmNjbmpFS2lTLWZjTGQxdHFiZHFhLWtGV0FpTVAyTk1jeXI5MDNRTUNGLWxnTV9NeVMwbjBMWmpzVGFFQlFSWXhwQ0tKSkRXUjdKUlBVTlpsNUtFaDl5eEJ2eVl6S1dpMzFqRXBOY2ZCWm5BZENMSzdtTUh2WWc4N0w2UDh2NmloZ2cyaHNweA?oc=5&hl=en-US&gl=US&ceid=US:en,Laodong.vn
ACB,"ACB muốn chia cổ tức 25% bằng tiền mặt và cổ phiếu, mục tiêu lợi nhuận 23,000 tỷ đồng năm 2025 - Vietstock","ACB muốn chia cổ tức 25% bằng tiền mặt và cổ phiếu, mục tiêu lợi nhuận 23,000 tỷ đồng năm 2025  Vietstock","Sun, 23 Mar 2025 07:00:00 GMT",https://news.google.com/rss/articles/CBMi0gFBVV95cUxNUEVvcnZMRDlqUEN5U3pIcFJ4bHQwczVVSlRfRHA0OHd1dmV2NjJnaExzek5iZjNDcFhURm44RXRuUjA2Zjh0SGw2dlk1ZlpFRExGUGtvckRUaHFLVXJJNWpDTXFTdTE0NER2dVJUN25wZ2lqcWNlcmY5Sks0VmhmYTJ6WWFWRDhMVU5pX19XQjE1SUZ3dEpMd19NRU0waGpqa1ZYNi1FLTE1S01yb01YMDVMNllZS2NjOVo1M0VHNXY2NHFnNHRsRjVwOHVuMUNNa0E?oc=5&hl=en-US&gl=US&ceid=US:en,Vietstock
ACB,ACB chuẩn bị trả cổ tức bằng cổ phiếu tỷ lệ 25% - CafeF,ACB chuẩn bị trả cổ tức bằng cổ phiếu tỷ lệ 25%  CafeF,"Tue, 01 Jun 2021 07:00:00 GMT",https://news.google.com/rss/articles/CBMijgFBVV95cUxOTjk2aEVfakVoTUxVRVJjUnNMQjhzWU0ydFlWNXJpT1Jxd19aSGFXY1YwMndmd2djTVNoQXN1NzV5d20zMzBTaEVQMF81aTZQTXEtNmV5THEtQzhyamp6Y0pQZXVGNER2NlBBcDFnUHQ2VWxxQ2RRdVBjQlFpSXQzbllOYjRHcjNRV1E3RFNR?oc=5&hl=en-US&gl=US&ceid=US:en,CafeF
ACB,Cổ phiếu ACB - Có nên mua? - 24HMoney,Cổ phiếu ACB - Có nên mua?  24HMoney,"Wed, 03 Dec 2025 08:00:00 GMT",https://news.google.com/rss/articles/CBMic0FVX3lxTE1SVXNyWFlwWGdZQTZLYzFjMFkzNjUxQ0dUOG1iWkc0OF9HeW5jZDZxTmU4alk3UFNncnBLZ3AzS0hSY1JHNG92UVNKcjM0VnpfcXpIYlZwc3VYYndZQ2t6anJKWGJpaFdJVDV3SU92c0ZWcDg?oc=5&hl=en-US&gl=US&ceid=US:en,24HMoney
ACB,Lộ diện thêm nhóm cổ đông nắm giữ lượng lớn cổ phiếu ACB - CafeF,Lộ diện thêm nhóm cổ đông nắm giữ lượng lớn cổ phiếu ACB  CafeF,"Thu, 12 Sep 2024 07:00:00 GMT",https://news.google.com/rss/articles/CBMinAFBVV95cUxNLXpTeGJGQVpsdmd6LVo5eWNTeEhPTml6ZFlrN1M2YUR3TXdUMEV1X095X3hsVHQySkhEYlJiY2dzWVhuenIzMl90Qk9NaFByY2RzM2RzOWRCMDhzeU9LNlZfUmpNUi1VUXZhVWlqUmJiVE8wZDk5OUZ3LU5fcUxkbi1MNmR0MGd3dzBLVW5naW52cThZX2gzZnJwbks?oc=5&hl=en-US&gl=US&ceid=US:en,CafeF
ACB,"Một quỹ ngoại bán sạch cổ phiếu ACB sau 6 năm đầu tư, thu về gần 5.500 tỷ đồng - CafeF","Một quỹ ngoại bán sạch cổ phiếu ACB sau 6 năm đầu tư, thu về gần 5.500 tỷ đồng  CafeF","Mon, 01 Apr 2024 07:00:00 GMT",https://news.google.com/rss/articles/CBMitwFBVV95cUxNbEV2N1ltYk1aNERSeTdPUmUtN2tNNFRUbkJuamVIN2pWZnNzMTg0WVhteVBhLWlFSHdKMFlVUGhwbEJRNlBMYUFFd2FFa2JiMUFsMVgzcGRCcjh4TFZXZ0dpbVlsRDIzRVJMNmJlaUFramNVZl9IaTJXXzRzckF6MHZQaDFmcTF4RDlxTU1UbThGMjFGazJScDR2VVdKYS10Qmk5enlkOHl3WWoycGtZdmI1VzZ2c3c?oc=5&hl=en-US&gl=US&ceid=US:en,CafeF
ACB,Phân tích cổ phiếu ACB – ngân hàng TMCP Á Châu - 24HMoney,Phân tích cổ phiếu ACB – ngân hàng TMCP Á Châu  24HMoney,"Thu, 26 Jun 2025 07:00:00 GMT",https://news.google.com/rss/articles/CBMikAFBVV95cUxPT2VlZ1RQaXlhWHhoc2NfT2d5N2tCX01paUhrYmRnRGloQTdsVk5oOS1Bc0NTMTd5MDFDQVYxUGV5MjA0cWJXWnJpeDBvenlUMUk3Qm12OEU0WElKRU9LeF9PZ3hzQ3U1SklGQUs2eXdncFdhY3RSaWpmMXJ5LXhIV0dHTmx6QVBMbFdOcDBzLTY?oc=5&hl=en-US&gl=US&ceid=US:en,24HMoney
ACB,"Ngân hàng TMCP Á Châu (ACB): Người thân lãnh đạo muốn thoái bớt vốn, lợi nhuận năm 2025 giảm 7% - Báo Pháp luật Việt Nam","Ngân hàng TMCP Á Châu (ACB): Người thân lãnh đạo muốn thoái bớt vốn, lợi nhuận năm 2025 giảm 7%  Báo Pháp luật Việt Nam","Tue, 03 Feb 2026 08:00:00 GMT",https://news.google.com/rss/articles/CBMixwFBVV95cUxQV1dxQUxQSzJPanFkY2pFSEZUckpZYjdQcHRxekNnRmI5MkRSOHRaNjZCeU5mMkRrMlJld1VIU2F5SlQ3SExJOEphSE04UlJ4Wno2TkpaWmpHM25EZGVWM0xuS3ZxRGNQVGZsZnpSVE9wX0VsR0FqXzQ5WHFwTkhXZG1kVElBM0NpOTdkSnFDWm5vRDlpVFI5ZmlyVGExbGg0Y0k5WGxrczRsWDZ6UGtESHhvSXFpVmQxMXFmNG1CNzVoY1U5S1Y0?oc=5&hl=en-US&gl=US&ceid=US:en,Báo Pháp luật Việt Nam
ACB,Công ty vốn 5 tỷ đi vay nước ngoài 1.400 tỷ đồng với lãi suất 20%/năm để mua cổ phiếu ACB đã trả hết khoản nợ này sớm một năm - CafeF,Công ty vốn 5 tỷ đi vay nước ngoài 1.400 tỷ đồng với lãi suất 20%/năm để mua cổ phiếu ACB đã trả hết khoản nợ này sớm một năm  CafeF,"Tue, 29 Aug 2023 07:00:00 GMT",https://news.google.com/rss/articles/CBMi9gFBVV95cUxNX0xCdzBjdGFnVWpSaTAzalo5dVQ5b2pOYkFhX2ZqU3RFVFBFSDhFMV9rd1M1UVNPVEpKcG9SWXpuaDZ4c2VqQnMwMkgzUTl2Wl9sX3M1aUVzWGRCRkxoaWFvT2l5dUxpMnd3WE1uRUk5UEwxdTRmbEZnS2xxZFBpZjFLUl9xeExpOWxJd3pTdlpBNDRSQVNGR0ZKQXFGLV9FNkM5c3k3U2IwNFFESlIzRjNKTGJ2V1RsYUlONF9TTVExZ01Ma1VTYUI2empaZmJRZ2JSU0Q5UlJxOUMybTdORWFkb0ZrbHZSbHozTmpEd0ZSUXdzaFE?oc=5&hl=en-US&gl=US&ceid=US:en,CafeF
ACB,"ĐHCĐ ACB: Đặt mục tiêu lợi nhuận trên 22.300 tỷ đồng trong năm 2026, chia cổ tức cả tiền mặt lẫn cổ phiếu ngay trong quý II và tăng mạnh vốn điều lệ - CafeF","ĐHCĐ ACB: Đặt mục tiêu lợi nhuận trên 22.300 tỷ đồng trong năm 2026, chia cổ tức cả tiền mặt lẫn cổ phiếu ngay trong quý II và tăng mạnh vốn điều lệ  CafeF","Thu, 09 Apr 2026 03:39:00 GMT",https://news.google.com/rss/articles/CBMikwJBVV95cUxPNlNCcHI4Qzdua0hrWHJLeklOX1E0MlE2ZVg3cGZqMmI5elVMRS1ERU92Ums3X29DNG1tbTM4ZWVYSlZkODhfTlo3OHJ1NWpWV2N4NFlUamFhYUpQY0ZqZkFoV0Y2U2F4LTVsalN5ckNjTF90TGJtdmRXQkpjVUppa2QzcThlWjFqamZvOWZ6RHZEYlBZd3JWaUhrUlVTZ0N5b2NQUlBxVVZFQ0x3REZFcmlIdUdQWVRaS2dXczRkTktmbU5SWExLcUE5a1FQRzQ0ZmZWWHNDcmljYWY5dG1fcmdxX2lKVVZHYlpKazZMeG1RVklaR3pGYTI5bXpjeXh2M01wbWc4RHQ4UmdLOHQ4TnlyZw?oc=5&hl=en-US&gl=US&ceid=US:en,CafeF
ACB,ACB đang có vấn đề gì? khi “ngân hàng chuẩn mực” bất ngờ hụt hơi giữa lúc cả ngành tăng trưởng - 24HMoney,ACB đang có vấn đề gì? khi “ngân hàng chuẩn mực” bất ngờ hụt hơi giữa lúc cả ngành tăng trưởng  24HMoney,"Mon, 02 Feb 2026 08:00:00 GMT",https://news.google.com/rss/articles/CBMizgFBVV95cUxOT3lLd3ktR2xfMDlNZWx3eUZIVndueE1FMWlxb3I4V3N4akxxbU1kTGdYQndDRzh3UERwUlVpT3ZnMHdmREdSdDV3TDdtYXdWTHVUWmRFNFRCUzh6UmlyZFo3Z3c1VUtUTWM0RmVoZ2t0TVBscWFGOG1VYXlzdUZnd0hiV1U4b25rM0M0RXRBTGpUTTY3SlpXb1pGaVFyUmFoSmVHZmlmOU9remJuNDFWOXpQQWUtQUF4MXlXdkNWdEhqRFgxOEZkazhGdWV5QQ?oc=5&hl=en-US&gl=US&ceid=US:en,24HMoney
ACB,Phân tích cổ phiếu ACB - có nên mua ACB để tích sản? - 24HMoney,Phân tích cổ phiếu ACB - có nên mua ACB để tích sản?  24HMoney,"Thu, 08 Aug 2024 07:00:00 GMT",https://news.google.com/rss/articles/CBMilgFBVV95cUxPakxicWppS19xLXRWTjdLT0tCQ2lza1FDWkJVaWZGX3I0T3kta2lvSEo0emx6OTFrMEo3emg0UkkwN2gxUU9La1FKTktNRFRwdjdFV2JvZ2Y4Um9QTDlRM1lYLXlUR0dGTmFDSF9uS3pPTkpwTl9oVndTS2Vfa1NHOUxDdHJKRGg4VV8zNGxNM0pIbUp3SVE?oc=5&hl=en-US&gl=US&ceid=US:en,24HMoney
ACB,Chủ tịch Trần Hùng Huy sắp nhận hơn 150 tỷ đồng cổ tức từ ACB - Znews,Chủ tịch Trần Hùng Huy sắp nhận hơn 150 tỷ đồng cổ tức từ ACB  Znews,"Sat, 24 May 2025 07:00:00 GMT",https://news.google.com/rss/articles/CBMimwFBVV95cUxQckNWNVYyaFRWWGxGaVVhNWpMc19NSExVcURIdjVRYU8xbmVsZ2wwaDN5clZNUVpxZXY1THdpUjREWlBNY01pMllNd0E2dnRUOFRIeHhkTG9NbV9Ba0FLWmxFbUN5UXN6eEJWNWgyU05iSDFFSEJkcjhaLUxLckhkeV9DalVOWEhibDJOb0JYSXo3cE5ocW9qSTdzaw?oc=5&hl=en-US&gl=US&ceid=US:en,Znews
ACB,"Một số cổ phiếu đáng chú ý ngày 14/4: ACB, DCM, MBB - thuonghieucongluan.com.vn","Một số cổ phiếu đáng chú ý ngày 14/4: ACB, DCM, MBB  thuonghieucongluan.com.vn","Mon, 13 Apr 2026 22:53:00 GMT",https://news.google.com/rss/articles/CBMimwFBVV95cUxPZWJGd25HSjVyUDRfTzZNMi1weUFlV2w3LXBQU2xzay1hbDJ4TW1CQTdvNG5hY0dGU1N5Y1JZLWkwWXhTa2xVcDhWUks1bWw3TS05QzR3OXZIcnAyTUlWNGFscFExMzgtSDR1ZlNQNjRFSmVFNFhkWUNuZERMVUJ3WnktM3Z0MWVCOTVBTEpFUF9oMjl4QTVlaDNwVQ?oc=5&hl=en-US&gl=US&ceid=US:en,thuonghieucongluan.com.vn
ACB,Tiền đổ vào cổ phiếu sau màn nhảy dưới mưa của Chủ tịch ACB Trần Hùng Huy - Laodong.vn,Tiền đổ vào cổ phiếu sau màn nhảy dưới mưa của Chủ tịch ACB Trần Hùng Huy  Laodong.vn,"Wed, 07 Jun 2023 07:00:00 GMT",https://news.google.com/rss/articles/CBMitgFBVV95cUxNUmluZUJxdVBKQ0tsYS00YTBGOW9NLTMzS1FxR0w4N1YtTmEtQ05qRDkybGNUOGRsZnNaREJpUld4WTdFa2UwMFdqcGlpbTAzT3cyd013aWtObkk0anY1ZVVKOWE3SXFWTDZqVVliYXdhU0lIeEhQU1A4czc3WjVoSWZEWjhFNXFYV2s1QWRBeHVNclJiMmNLeDNVTGZBRlRHYnVvbEtYbFZkVVVMSkxGVF9XdktCdw?oc=5&hl=en-US&gl=US&ceid=US:en,Laodong.vn
ACB,ACB chốt quyền chia cổ tức bằng tiền và cổ phiếu - Tạp chí Tài chính Doanh nghiệp,ACB chốt quyền chia cổ tức bằng tiền và cổ phiếu  Tạp chí Tài chính Doanh nghiệp,"Thu, 15 May 2025 07:00:00 GMT",https://news.google.com/rss/articles/CBMimwFBVV95cUxNVFZUZm9wSzFOQWNoZ2I2bWxaZElMQVZFWnRXaC1TMjFjczdVOHJ1Y1MtV1pSTUsteUdlMXhtd1d6dXd2MjZ2djdzeHhpLTNFMHdSS1BMb01KWGNWcC1PWjVESk5tcHEyZEVoMURPLVFha2VwYlVIdS1Ub2h2Q243MEIzclk3T1MwbmlmYmE1WllZVFE2a2hEazZkVQ?oc=5&hl=en-US&gl=US&ceid=US:en,Tạp chí Tài chính Doanh nghiệp
ACB,"Chủ tịch Trần Hùng Huy có thêm 17,4 triệu cổ phiếu ACB và 116 tỷ đồng sau vũ đạo 'Cô đơn trên sofa' - CafeF","Chủ tịch Trần Hùng Huy có thêm 17,4 triệu cổ phiếu ACB và 116 tỷ đồng sau vũ đạo 'Cô đơn trên sofa'  CafeF","Sat, 10 Jun 2023 07:00:00 GMT",https://news.google.com/rss/articles/CBMi0gFBVV95cUxQbjNZZ0dZMGVrYUZOSDRDLXJVSjBQaE8wbXhnUTl2RVhXLXJ1NXFhdTVqTkhXMzZILXZXQUg4bXlYRjdpdUk4WEtYT20zajJrc281OW9jalgxVFlQc0RGNVZXWWNFdUZaOEEtMnhDUFNkVFJDVElkVWdPNWxfcFRhNEFreG5IbWdRcXBrR29JZ1gtbEl6VEtNd3I5VGlIQ181RGRTUlBzSGp5VXcxNGVwSDJQdTlsMjk1SjhlU0dRZHczcnVaeW1Rbi1iaDIzYnZyVkE?oc=5&hl=en-US&gl=US&ceid=US:en,CafeF
ACB,"Loạt ngân hàng ACB, MB... sử dụng cả ngàn tỉ tiền trái phiếu doanh nghiệp sai mục đích - Tuổi Trẻ","Loạt ngân hàng ACB, MB... sử dụng cả ngàn tỉ tiền trái phiếu doanh nghiệp sai mục đích  Tuổi Trẻ","Fri, 17 Oct 2025 07:00:00 GMT",https://news.google.com/rss/articles/CBMiwAFBVV95cUxNQWo0NVBvSjBQRUp3ZUI4eVlxczdVbXN1Q3dRTG5qbmJBWUtnX0h6d2pMWG9vZzNweWY2aHM1WnozTWVtRzl4NHJPSlVaZGhvLTFtN2RwYzRSdTdNUXRUMGNhcVZYU291bVdpOVZTM1A4Yk44enBUTTd2QmZ1Xy1uVzYzcHJ5NEc1UkNfU05QczdkTFo4elg4T1hGYWdKYlRidTNjOXgzU3dMc2VOclFtbUJLLVRKWUVtNVl6ZGlrOEE?oc=5&hl=en-US&gl=US&ceid=US:en,Tuổi Trẻ
ACB,"Em gái thành viên HĐQT ACB đăng ký bán 2,2 triệu cổ phiếu ngân hàng - Mekong ASEAN","Em gái thành viên HĐQT ACB đăng ký bán 2,2 triệu cổ phiếu ngân hàng  Mekong ASEAN","Sat, 31 Jan 2026 08:00:00 GMT",https://news.google.com/rss/articles/CBMiogFBVV95cUxQY3BIclVNd1JLelpiREdrQ2Y4RnZXWUhHVTNmTUQ0eFlCbDg4ZFBUUHFPb2N3WUF0cTR0d0FXVFgweFpMYlZkZzl6Y1J1Y3EwUXJWaGdWSlpsZ2N6UjdYY3pqNE12aE11MWFyMlNRYWE3TlFEY2xjUElBNzhSb083elFIX0lUcEx0YmhJV0FsVlBlMl84RVVPczN6dXJJWVlWS1E?oc=5&hl=en-US&gl=US&ceid=US:en,Mekong ASEAN
ACB,ACB được tăng vốn lên 51.367 tỷ đồng - Tin nhanh chứng khoán,ACB được tăng vốn lên 51.367 tỷ đồng  Tin nhanh chứng khoán,"Sun, 11 May 2025 07:00:00 GMT",https://news.google.com/rss/articles/CBMijgFBVV95cUxNbk9NcGlOc3Z2OF8tc1owWGVxNlZRbldqOTRabFZ5NmRuU1JLNjlRMmlfSW1SNTFBRWRaQ1U1TmZqdXlFUmNFNE9ESmFsUC1TNGRkRmVKTnNHalNRLTFuMVVnNXo2V0tXRVNQVjRXMzIteDRERUhENnZ6ZnpFNllSMWhIS1A4ZnJ5M1dYaDRn0gGKAUFVX3lxTE9KMWFyVm9ub2hNX2drX1VBcjRNNkt3US1VMG8tMVlhN08xYlY5M1lLN1U1RkVHNzNxbXRJV0hfVWpUTXdncnVfdmZ5MFctaUhYWUlwV3d5aDZ2YUg2ejNpcnB1V09oYm91NER3cElLWFpKal9KdmkwTzNQRndGX05YdTRSQllRNW5WUQ?oc=5&hl=en-US&gl=US&ceid=US:en,Tin nhanh chứng khoán
ACB,Cổ phiếu cần quan tâm ngày 2/2 - Tin nhanh chứng khoán,Cổ phiếu cần quan tâm ngày 2/2  Tin nhanh chứng khoán,"Sun, 01 Feb 2026 08:00:00 GMT",https://news.google.com/rss/articles/CBMihgFBVV95cUxObXNxNHllMFc2aUZwWWVZeWRUcVZUcmdZNDM1YjNHdzN0MUpseDhfR2lrSFJKbjVqTG04MDE3bzlOMUtsNjlvUmlGRXBSbkRCQkdaeUJzSnNGTFNiZGFLZTd6aW1rZndqemVDYVVXVk1yLWF5bzFieHJTeEo4MWRMVXBIUFF5Z9IBggFBVV95cUxOUVNjU2NnbDRkLW5pV3lnUHZhQXQxUW1QRld1QmJkRldEQXB6azE4QmI3QTZ1X2R1RlNXa2dwcTcxYm5fWFNPUmROUVFfYmRQZDlTazE0UVBzdkJpTHpsNjdBV1VWZHNSUjVoY1FSSlo2VVhQdGlhYV9uS3dselpUeXl3?oc=5&hl=en-US&gl=US&ceid=US:en,Tin nhanh chứng khoán
ACB,Cổ phiếu cần quan tâm ngày 2/10 - Tin nhanh chứng khoán,Cổ phiếu cần quan tâm ngày 2/10  Tin nhanh chứng khoán,"Wed, 01 Oct 2025 07:00:00 GMT",https://news.google.com/rss/articles/CBMihwFBVV95cUxQQVZoQm9paTZKeWZ2UGZjSE1vRGUyNHgtRFJMWG9yWk45S1poUk5LSFhOR2lBcldiUk1NMnFlOHNHbEV6N2NCSDVWQ25lTWs3VTdPRWt0elNaZEJneDFPSnFkYkRvc3dmWHdBTzlnb1VOOXBoTTdiaHFiTmVqYjR0dTNCd2hFbm_SAYMBQVVfeXFMT2xoWXRqeEdHY09pbXVaYkFWRllCbWZpeHdKN1FKNUJDQ01RdUIwTnlXM21pNlJCcWZheUlsblFMYVdHb0lsYmZrRmZ3MDFTaDc4REZiYWVEUEhZTm83RTItdVptU1dGNFE2RWJvYWlxRHZkb2FCVGtfZk8zV09zRTUxcjg?oc=5&hl=en-US&gl=US&ceid=US:en,Tin nhanh chứng khoán
ACB,ACB muốn phát hành 20.000 tỷ đồng trái phiếu - CafeF,ACB muốn phát hành 20.000 tỷ đồng trái phiếu  CafeF,"Tue, 18 Mar 2025 07:00:00 GMT",https://news.google.com/rss/articles/CBMiigFBVV95cUxOTXV5WFpybDRXQUd2Y0lhV3ZrZjBLM0RlaGhnN2c5TlB0UFlic25fMGxvNElGcjIyWHppWERwR3QxUFNMUlg0YnktUEh6OEFvWVgwbHBJVmJreGtlS3QtcGV5Qk9Da0pJb25SOXc0SnVETUtTNUFydFh3UDhJVWQtRVZ1WDUyd2FkWkE?oc=5&hl=en-US&gl=US&ceid=US:en,CafeF
ACB,"Ngân hàng ACB được chấp thuận nâng lên gần 3,9 tỷ cổ phiếu - Thời báo Tài chính Việt Nam","Ngân hàng ACB được chấp thuận nâng lên gần 3,9 tỷ cổ phiếu  Thời báo Tài chính Việt Nam","Wed, 05 Jul 2023 07:00:00 GMT",https://news.google.com/rss/articles/CBMipgFBVV95cUxPMGJsaFdWc0I3ZDFFd21aYmkzcHJucGFISFRMa0JjbGtVZnVyb0ZmR1VFWE1Ld3NQRTQ3ZjhLVzkyM3JiWng3S1dSdkhKbktiOFdEYW8yVEJpTnBOYWJTUHRLbzlzN1pOaXNHUlB0bm1pR3JwWFBwZFNCUDR5emdOZC1JUjhRdng3OVBrSkJXLUtVN2R2bnhkQlZ0WEpkVTZxSk81QUFR?oc=5&hl=en-US&gl=US&ceid=US:en,Thời báo Tài chính Việt Nam
ACB,Cổ phiếu cần quan tâm ngày 30/10 - Tin nhanh chứng khoán,Cổ phiếu cần quan tâm ngày 30/10  Tin nhanh chứng khoán,"Wed, 29 Oct 2025 07:00:00 GMT",https://news.google.com/rss/articles/CBMiiAFBVV95cUxOX0hNcXhrMHl3QWJFaGphbTR5U0hHcURNRXhyd2NSaXZCdk03TDBxX1pLdDh2RU1RZ1BmTm1hOFhtZFRJMDdkMnJVV0FzM0Qwa212eVZNZkhyU3cxRFp1NXdueFhNU0ZuV3VVX1AycHpJZm5VTmV4aG14LXp0emNjRXJza0oyd1dN0gGEAUFVX3lxTE1kdEJuSDA3YlZXQ1RnLTZEdGpUYTlCVEVaTmxTQVFjZVMyX3lnR0p0Qmw5Z0l6X1BQZEkyTXE5LXk0Qmc5VjVuWWJLcVFKY3BRYUYzMUVBMnRwdS11RmhyQjVtemc1LXpFYm5HMlBEbllrN083SU5QLXNNb3B2enMyM0tOYQ?oc=5&hl=en-US&gl=US&ceid=US:en,Tin nhanh chứng khoán
ACB,Cổ phiếu ACB hưởng lợi khi room tín dụng nới 20% - diendandoanhnghiep.vn,Cổ phiếu ACB hưởng lợi khi room tín dụng nới 20%  diendandoanhnghiep.vn,"Mon, 09 Dec 2024 08:00:00 GMT",https://news.google.com/rss/articles/CBMilgFBVV95cUxNY3VqUGY2ZW1MMHJzNm8wZzZOMVEwMXVNSWRxXzJIYXNPblpGMXJzUWROMVlSOFVXQzQ3bDl0NWNCQUNXN0lNcWFqeW1XTzhCSzV5RmpiSEZxQ29URW5iTEh6bHRocklpT2djOXlBa2d2aGJIRlByWnhsUkFQQkxkN1o4a01oNGZEQmN6VlJJclhuRnc2R3c?oc=5&hl=en-US&gl=US&ceid=US:en,diendandoanhnghiep.vn
ACB,"ACB chốt quyền tham dự ĐHĐCĐ 2026, dự trình phương án tăng vốn điều lệ - Vietstock","ACB chốt quyền tham dự ĐHĐCĐ 2026, dự trình phương án tăng vốn điều lệ  Vietstock","Fri, 13 Feb 2026 08:00:00 GMT",https://news.google.com/rss/articles/CBMitAFBVV95cUxOTzVYT09neXZSMHFBc3l3dFdJajhlZ0V1WThxVGcxX0JVOWtfamVJc1JJd3BCVjQ3czlNMWctbEppTEJyZkVYaDMxcm9ZRi1xeWNTLTdNVHRUWjc5Mm9Sa1BDcGVmVkc2djdzYmFFV215c2FEc2N1YlhmWlBEQUE4SERYRU1CUFBUYzF2S1R2UDFfWlg2TnlIeUJ5MXdHUWJrWkRMeHFvTGZhOWRudFNvWjgwUU0?oc=5&hl=en-US&gl=US&ceid=US:en,Vietstock
ACB,"Cổ phiếu đáng chú ý ngày 31/10: ACB, HHV, FRT - nguoiquansat.vn","Cổ phiếu đáng chú ý ngày 31/10: ACB, HHV, FRT  nguoiquansat.vn","Thu, 30 Oct 2025 07:00:00 GMT",https://news.google.com/rss/articles/CBMihAFBVV95cUxPY2pta0NrNWtDTnZxVWNscnpmc21nUnlDSXREVmxMaGozOGtzV1BVaV9iREhGNkJLRldVaDNvVms3RUt2d2tjdTF4WXdxLXdOTktlaV80ZFFrWVY4OHNtSTNGSFZzaVJ3SlpLbkdzMGxBZk1yWUJQaXA5QWEwdzY3VUVjSm8?oc=5&hl=en-US&gl=US&ceid=US:en,nguoiquansat.vn
ACB,"Chủ tịch ACB vừa bị tin đồn: Nắm khối cổ phiếu nghìn tỷ, thù lao 700 triệu đồng/tháng - VIETTIMES","Chủ tịch ACB vừa bị tin đồn: Nắm khối cổ phiếu nghìn tỷ, thù lao 700 triệu đồng/tháng  VIETTIMES","Sun, 05 Jan 2025 08:00:00 GMT",https://news.google.com/rss/articles/CBMiuwFBVV95cUxNSmE4RkZiajdJRGhOQmNPT2RvMkJWTnBqc2ljckdDLVVwRzgwVy1ucVJ6UnlXelVuRUp4M3F6NEdmaHFYSkFsSjZ5azAzOUkwNkF3MWdhRFBLZkxkejNhTmVUOWxTQ2cyWjdqNmdiRlc1NmtSMDhYa1pOT19BWTV2ZzBjd2NjdmJocXBiVFlvblRoM0dCZkJOY2gxSG1ycHh4X2hCUFg3b1NEMUt5MWowaHg1b1Z3dFB4WEhB?oc=5&hl=en-US&gl=US&ceid=US:en,VIETTIMES
ACB,"Tài sản Chủ tịch ACB sắp tăng mạnh, bầu Kiên nhận ""lộc""? - Báo Dân trí","Tài sản Chủ tịch ACB sắp tăng mạnh, bầu Kiên nhận ""lộc""?  Báo Dân trí","Fri, 09 Jun 2023 07:00:00 GMT",https://news.google.com/rss/articles/CBMiqwFBVV95cUxNNmVDVUl6Um10UmRrNDlHbEpMQXBwd1ZWYmc1RzBTSG41OWY5bE15T29SMnZhdnFyNDJpcnc1ZDFFLTc5VHZmNE40VTc1R29DY2N3M3hWQ2Q4MHZjSkY1VUl2WldQZFZmX1d2MlpWbnU4TkVJRlJZeTFiSTVnTkRrQWJDeEZxa3psSGszQUNraUxOUkJ1WXVJU2VONGh3MDBTMmoxZ2F4RGhSZHM?oc=5&hl=en-US&gl=US&ceid=US:en,Báo Dân trí
ACB,Cổ phiếu ngân hàng đã về vùng hấp dẫn? - thitruongtaichinhtiente.vn,Cổ phiếu ngân hàng đã về vùng hấp dẫn?  thitruongtaichinhtiente.vn,"Fri, 21 Nov 2025 08:00:00 GMT",https://news.google.com/rss/articles/CBMiiwFBVV95cUxOMHlMc1hmcUgyM1JTRWRVUUJiQl8xOUJXbUdQcGpCcmFqS0h3bnoxbEphaGxyZmlyVW1pRUxuTjBrWXVDN0ladWtNU29iZzA5QzEzUjNaMEFaVEhTZXF5OExCT1BLajVKSGI3SFFkcVpMakVoWGNOai1fcC1UeEh1dW5kQW8tVE5aelpz?oc=5&hl=en-US&gl=US&ceid=US:en,thitruongtaichinhtiente.vn
ACB,Nhóm Âu Lạc nắm hơn 4.000 tỷ đồng cổ phiếu ACB - Nhadautu.vn,Nhóm Âu Lạc nắm hơn 4.000 tỷ đồng cổ phiếu ACB  Nhadautu.vn,"Wed, 18 Sep 2024 07:00:00 GMT",https://news.google.com/rss/articles/CBMigwFBVV95cUxPTmUwOWRTUmpvRGtPLUl4Y1hGMWg3M1ZzRVU1ZEZsUS00ZUQ3SWpHQTFOb0sxZF9uUV9GdnFqcjA1R3piUDhsODE5QTNjX1B3b0NJMWhmTy11TTdkdkNjLXBfOTRHZVlVbzFQai1FR0NrcEJ1c3BwNFQ5VHBkQXEzX0RHWQ?oc=5&hl=en-US&gl=US&ceid=US:en,Nhadautu.vn
ACB,Ngân hàng ACB công bố lợi nhuận năm 2025 - Nhadautu.vn,Ngân hàng ACB công bố lợi nhuận năm 2025  Nhadautu.vn,"Wed, 28 Jan 2026 08:00:00 GMT",https://news.google.com/rss/articles/CBMihAFBVV95cUxOTF9JZU9JVlVwdW8teFVNTlM3YmxqQmZneWJ1V04tLVdkMVR0NWotSG05cUNzQ0V4QnAzTG00QjBISUIzWUtQbzcxZlI3bV8zemQxMUhuWkVrTnV3YnRUSXB1aHk1OTVwaS0wb2kyaWlTZWVwM1U5ellhaEZsbzJ2SmpNanc?oc=5&hl=en-US&gl=US&ceid=US:en,Nhadautu.vn
ACB,Lộ diện hệ sinh thái nắm lượng cổ phần trị giá hơn 4.200 tỷ đồng tại Ngân hàng ACB - Tạp chí Công Thương,Lộ diện hệ sinh thái nắm lượng cổ phần trị giá hơn 4.200 tỷ đồng tại Ngân hàng ACB  Tạp chí Công Thương,"Sun, 22 Sep 2024 07:00:00 GMT",https://news.google.com/rss/articles/CBMivgFBVV95cUxOUHlUMzlmazJfX3M2UEJjb3Ffb3o1X196NDJFVXJVYzJmN1FoR2hKM0xMTG93bTBUaDZkRDc3b3V4SE1KRklQMThZMlVTdkQ4MU1teDFFbTVTbFNTaVpiUkowUThVU29MZ0NncEU1V1djWXVSRHc2Y2w5UFIzcUczR2hETG1RUlhCNHgwQUlpcnl2QWFhSlA2c3VESzQxWVlHLU9HZWpOMTdGaHlhVnVyY2tXM3lOa3g4WlNLZldR?oc=5&hl=en-US&gl=US&ceid=US:en,Tạp chí Công Thương
ACB,Gần 583 triệu cổ phiếu ACB sắp về tài khoản nhà đầu tư - Chứng khoán DNSE,Gần 583 triệu cổ phiếu ACB sắp về tài khoản nhà đầu tư  Chứng khoán DNSE,"Fri, 07 Jun 2024 07:00:00 GMT",https://news.google.com/rss/articles/CBMipAFBVV95cUxQSkFRdWhDTkE4M3MxZ3FKWjhwTV9Fb1d5Yll6ZkltdnBBcEU3cy02cFRta2RnaEF3Mm9ObzVsUHhudzdaamJNc0lwdThIRFZSSEYtMlhEdVpsTGpqUGg4VTJoNDFUZGNpc1lsNXc1RFQtTXVlNmV0SVdJUTBudzNMa2pQSFNjbkZObXJUM3dNTWVQZDZLbDFmcENhOS05OFEtdzBQaQ?oc=5&hl=en-US&gl=US&ceid=US:en,Chứng khoán DNSE
ACB,Cập nhật cổ phiếu ACB – Triển vọng tươi sáng hơn trong năm 2022 - dautucophieu.net,Cập nhật cổ phiếu ACB – Triển vọng tươi sáng hơn trong năm 2022  dautucophieu.net,"Mon, 15 Nov 2021 08:00:00 GMT",https://news.google.com/rss/articles/CBMikAFBVV95cUxOdkMyT3JTa3dvMy00X0hwMXd0MzN2UzlXeVpZUkgwZkFMbm5FMllnN3c4ZV9scXJGSmtsZzJYQURVYTNqMTR6Z0J3VWFsZjl0RlVkdERzd0k1bFJSaDhCc1JUc1pqYnZUWnRFQ0ItckZ5c1dNZFVIM1dvbjhNbm51U0pfcEVJRmRubDJvMDlvcnI?oc=5&hl=en-US&gl=US&ceid=US:en,dautucophieu.net
ACB,"Tiền bắt đáy ồ ạt đổ vào, loạt cổ phiếu ngân hàng bật tăng mạnh: STB và MBB tím trần, ACB, CTG, VCB hồi phục ấn tượng - CafeF","Tiền bắt đáy ồ ạt đổ vào, loạt cổ phiếu ngân hàng bật tăng mạnh: STB và MBB tím trần, ACB, CTG, VCB hồi phục ấn tượng  CafeF","Tue, 10 Mar 2026 07:00:00 GMT",https://news.google.com/rss/articles/CBMi5wFBVV95cUxPR1hxVl9rZXo5d3o4djBZUDdkQUE2SGFaUVk1a3Bzdmc0ZWdqY3RwVkJ4N1c1SG9SU2k1SVhFSEFpa1VDQ0l3MjFJNEg3X1o5UDZhTW9QZXJUMkZHaWgwVk5jeWJvMGpMdWRZR21UY0kzNnhYN2NLdzJUMDNXWFc0b2MyclBLY0hfOFRDVGU5bGVHaWhrcUk1WC1BcWF1UlM0d0xodWxUeUo1U3FXaFBoY1EzeXoyWUFTX0NBUFVoV0hjNGFkTXRwbHdHTllhejMzZ1Y5QVVSbUNhM0JFU0NBMXhWRUZSWDQ?oc=5&hl=en-US&gl=US&ceid=US:en,CafeF
ACB,"ACB sắp chia cổ tức khủng, Chủ tịch Trần Hùng Huy dự thu trăm tỷ đồng tiền mặt - cafeland.vn","ACB sắp chia cổ tức khủng, Chủ tịch Trần Hùng Huy dự thu trăm tỷ đồng tiền mặt  cafeland.vn","Mon, 26 May 2025 07:00:00 GMT",https://news.google.com/rss/articles/CBMiuAFBVV95cUxNa3dnZ2JoZzBUeGRORTNDQTFzRUJmcEdyZWVDaWY4a3dzS2RkSmR1aFZxbGVDSHlaVjlVbzN0MkZwRjBYaHUzcEpKV0ZZOWZEVzlCeHp5S2VRSHNlMEpZQmI3SmpPYkh2OGVZWHd0LVVnRUVETER6THFZUjJmdVVYVWgtckxtZEhtWHhSUjh5LUJ4UXhJQmR4TWNNVVFJRGNCOEhISnZjaTEzbDdzOThtOGVVbVFvMldo?oc=5&hl=en-US&gl=US&ceid=US:en,cafeland.vn
ACB,"Ngân hàng ACB trình kế hoạch lãi 23.000 tỷ đồng, chia cổ tức tỷ lệ 25% - Báo Dân Việt","Ngân hàng ACB trình kế hoạch lãi 23.000 tỷ đồng, chia cổ tức tỷ lệ 25%  Báo Dân Việt","Mon, 24 Mar 2025 07:00:00 GMT",https://news.google.com/rss/articles/CBMiqAFBVV95cUxQUWtMTUJsMW1xSVR6aEh5aDRmUy1PWXY5NC1OOHJsYUtaYkl6ZWZSaWpuYUpOR3E1cldGcFZlNjJtMmlNR3dhd1hpVnRPdExUZHc0Tjdpd21CQzBwNXJRcmRqNEUzbkJtSmpnVDhPM0EwUVpvY0ZxWjUtb3dQeTRfZVJJbUlaVGpxZGNNb3ZqU2ZtQ3VaWFVmRzdmV1VoYnJ3VE1sSmd2UWg?oc=5&hl=en-US&gl=US&ceid=US:en,Báo Dân Việt
ACB,"'Bộ ba' cổ phiếu ngân hàng được khuyến nghị MUA, kỳ vọng sinh lời tới 18% - Chứng khoán DNSE","'Bộ ba' cổ phiếu ngân hàng được khuyến nghị MUA, kỳ vọng sinh lời tới 18%  Chứng khoán DNSE","Tue, 14 Oct 2025 07:00:00 GMT",https://news.google.com/rss/articles/CBMitwFBVV95cUxQRDN6LWx2UXc0S09UY3FnbnBxQUVOZ0UyeHdiUVlueVFHSmF6MXNmemNBTS11dzU4MWs3d2wwM0xhN0g2akNrSWc2RUVSbFkxZHVCQWJyMXp5QUYxWTFIdktXbGhxX0xPZXJyclpXOU1hWXhlVTB0a01GMTcwV2NNSEJGaWtCb0lPZmtLSGs0RGJrS3l1MzNUSDd1LUR5VS1XT1dBWW9KaWowVER1S2E0bVlrNERfeG8?oc=5&hl=en-US&gl=US&ceid=US:en,Chứng khoán DNSE
ACB,"Ngân hàng ACB: Kiên định với nhóm khách hàng doanh nghiệp, cân nhắc tài trợ dự án bất động sản - Tạp chí Công Thương","Ngân hàng ACB: Kiên định với nhóm khách hàng doanh nghiệp, cân nhắc tài trợ dự án bất động sản  Tạp chí Công Thương","Thu, 19 Jun 2025 07:00:00 GMT",https://news.google.com/rss/articles/CBMizgFBVV95cUxNWEdhRzhXdGpKa2RETmVpWW5nQnlib2szLXFtbUR4SGg1eFlvbnFVZEFVM0dobWMxZ2U2YThvWlBfcXBkZTlqdy03bTlUeEdza3VCN0xFa1FhVEJ5aEQ3VFNkWng0T012dlNRdFY0dXlPSWFGT1owcEFha1BoQXEyTm1mekFYQkZfbjVXY0lGMVh0VnMtMXpucDI4bWJUUTR0RlpTSHFMaW9BMWF5QVh6MnppZkY4V2hhQVNUaG15TzBmWW9mSm5UbW1LS2VZZw?oc=5&hl=en-US&gl=US&ceid=US:en,Tạp chí Công Thương
ACB,"Cổ phiếu ngân hàng đồng loạt dậy sóng, ba mã tăng kịch trần sáng 14/8 - CafeF","Cổ phiếu ngân hàng đồng loạt dậy sóng, ba mã tăng kịch trần sáng 14/8  CafeF","Thu, 14 Aug 2025 07:00:00 GMT",https://news.google.com/rss/articles/CBMirAFBVV95cUxOY2xyS0plT1N3UWF6NlBBdGNhR0ZlU2dJdkxIYnBJaklGZGtXazZsSTFrUE9sT0lLUkVBcHRYUk9iUGRIZlF5cTNtQjZib3hDbEdLaEktNmVwa29uR2lKdFgzeWxMTHZkRlEzYldMTGtZYy1GWUpPSTRzdU5QNkxxVVBrRHlva054RWo3OC1vUnpRVkR3a1V3dDFtQk9hb3dhNi1EczlsSE1LSDk3?oc=5&hl=en-US&gl=US&ceid=US:en,CafeF
ACB,Hai mã cổ phiếu ngân hàng được khuyến nghị MUA với tiềm năng tăng giá lên đến 34% - cafeland.vn,Hai mã cổ phiếu ngân hàng được khuyến nghị MUA với tiềm năng tăng giá lên đến 34%  cafeland.vn,"Sat, 22 Feb 2025 08:00:00 GMT",https://news.google.com/rss/articles/CBMivAFBVV95cUxNUmwxYkZ6OE1xeG5VbXA1MjN6X1FVSERZVWhuRW9mbnBXM3NGVHBWaXlZWVoyZzVza3ctUGZRUjZHdnJWYVBaX2g4MENQMHdNN0JmWTZONkk0d1g1dzlvSmF5VTM1ZTkxNWtKNGhENktMUlBJb2Q3M0ZTRUxpbW8zUF9TbDl3OU9Sb3ltNGtmTUtvck4yTVgxeHk3TFJrbjNQRnhtWlZJZFQtOWRKR1dHT3ViSW1CU0RMeWxmLQ?oc=5&hl=en-US&gl=US&ceid=US:en,cafeland.vn
ACB,"Cổ phiếu ACB bất ngờ xuất hiện loạt thoả thuận “khủng”, 4.000 tỷ được sang tay giữa các NĐT nước ngoài - CafeF","Cổ phiếu ACB bất ngờ xuất hiện loạt thoả thuận “khủng”, 4.000 tỷ được sang tay giữa các NĐT nước ngoài  CafeF","Fri, 22 Mar 2024 07:00:00 GMT",https://news.google.com/rss/articles/CBMi0wFBVV95cUxOMDcwdERpUXRtZkE3NW1nQWp3SkxKTEJhclJ2S2NBRlkyd1d3V0Ztdk4zLUg1d2FUMTBkUmlLNTJRQkNIR1N5VUVrZUdJZjhFbHdlMEgtX0Nrdk13QzZJXzg4bmM1MW5VWUFZandlV1hSZUJtRW5pR1E4OTFld0NscGp5aVY0VlZDLVk1eDBuX1R6Z0JNQlVCV3doV21VZmpKMmR2d0l3Wml6eDJOV2N6X3BWVk1yVjdId1J5NmhkSXRtSzFud05ZT0I2Z1pjeC1wR3gw?oc=5&hl=en-US&gl=US&ceid=US:en,CafeF
