ticker,title,desc,date_raw,url,source
ACB,"ACB tăng vốn điều lệ lên 44.667 tỷ đồng, vượt một ngân hàng nhóm Big 4 - Mekong ASEAN","ACB tăng vốn điều lệ lên 44.667 tỷ đồng, vượt một ngân hàng nhóm Big 4  Mekong ASEAN","Fri, 07 Jun 2024 07:00:00 GMT",https://news.google.com/rss/articles/CBMipAFBVV95cUxOOTRzMU9aUm15VU1LVm5VZF9iOWMza0d2bVQ3Znk1YUZ4dUNKa25pM3FCT0hxWElpeGNHNnV6U2ppYnhiODl0UHkwTVlkRy1DYTFhWGJqUHp1Qm5jYnEzdVBxcHlsdEFZNklSOE1JMkNwNG16bmUtdVpOS0o5U3B4TVlYYWp0SDk2aXktVUhwNEcwXy16eGlYZU92blFka3I3R1REVw?oc=5&hl=en-US&gl=US&ceid=US:en,Mekong ASEAN
ACB,So sánh cổ phiếu ACB và MBB - 24HMoney,So sánh cổ phiếu ACB và MBB  24HMoney,"Wed, 25 Sep 2024 07:00:00 GMT",https://news.google.com/rss/articles/CBMieEFVX3lxTE1qVDVlcVFJbDZLbGF1UWRVb19DNnR5OXRBVFRiaEwzc3lTbUtvQkowbVJ4ZE5wME9TTkJQQ2pocTVUdnJpRFFubVlacmd5NHZqR0xDeVR0ZFVrd2s3VHNERFR6OGVFOEZ1R21oVG5BU1VSUERncklsYw?oc=5&hl=en-US&gl=US&ceid=US:en,24HMoney
ACB,ACB muốn tăng vốn điều lệ - CafeF,ACB muốn tăng vốn điều lệ  CafeF,"Sat, 14 Feb 2026 08:00:00 GMT",https://news.google.com/rss/articles/CBMic0FVX3lxTE44N2gxeUY4LUZUcmt3NDBBMS1VZEU3OFFsd2Jya2tqWGRTVGwtRlM2Vmw3cVlna2hCQ2xQR2hMSzVad051RjNpMDRPaGl4NkZfdU0wcDNWQUJHekRLckdIemZUdlktbkg3UXNHcjIwaklEUTA?oc=5&hl=en-US&gl=US&ceid=US:en,CafeF
ACB,Hàng chục nghìn tỷ đồng cổ tức tiền mặt sắp về tài khoản cổ đông ngân hàng - Tin nhanh chứng khoán,Hàng chục nghìn tỷ đồng cổ tức tiền mặt sắp về tài khoản cổ đông ngân hàng  Tin nhanh chứng khoán,"Wed, 14 May 2025 07:00:00 GMT",https://news.google.com/rss/articles/CBMiwgFBVV95cUxPUjFndXZqczJYSndZRTJSYjBsZVoxRHR3VkFPNnB2VFgwQ2FVaV9QUHpiTlpaenNjdDV6ZnJTVHRLMDdsZUJtbmEwVHY5N25qbGFYSlR4c2ZWVEpCbTU2WjZmWVoyRlRkNDZuVjlIX0ZFanVreFRmRjVCYzVOQXN0U0tSR2FXTU83ZzFwNkpJY3g5QktWMjVrOTg1VzNBOG15Nldldm1BUlN6OF9US2ZLTjJaZi1WLTEwV1NZVDVna0t2QdIBvgFBVV95cUxNVzN6RWJ1bzRVYnowZjR0aGlSVmxXUmxPYWlwbkNrTGtBY2tnQmh0enh0R1pfbElNLXFoenlrRV8zNnV1dnJxbWhlNjFXSFp1aWxkWVpLS2VQZ1R3TzZkVWVSM2JtVnNqTVV0cWhzMmRLdFRZaDM4RHdXVUlhSTJVZW9HaGZJMndDWHhTcmZPZDRHbmh4UE1kTjZpSldxajRpV0dTd01uSTJfX3pibF9rcUVfWGhEX0VjYlpjb3BB?oc=5&hl=en-US&gl=US&ceid=US:en,Tin nhanh chứng khoán
ACB,Yếu tố nào giúp ACB giảm giá ít nhất ngành ngân hàng trong đợt điều chỉnh vừa qua? - CafeF,Yếu tố nào giúp ACB giảm giá ít nhất ngành ngân hàng trong đợt điều chỉnh vừa qua?  CafeF,"Sat, 11 Jun 2022 07:00:00 GMT",https://news.google.com/rss/articles/CBMivAFBVV95cUxOTXNYd0plaGExV2dPWTJVLWdTMUJZZmdaMThkLXJueGZFamFEQ2VMYVRGWERjREJSUEJiUzhtUXdmMzUzcXJpdHkyMTBLT0h3aEFJQll1S3BYZXdvX1pJX2Y3LXk4dGp1VnFQWlhkZHFMaE5tZWVrM2lzWm51a3ZGS1VFTnhEVkFxcTVxWlNDVHNjYllkcVdBWHMyNFpSMmVTZ1k5dHBtTmdCUlNTOTVseF9mVmJDVnJyZF9tUA?oc=5&hl=en-US&gl=US&ceid=US:en,CafeF
ACB,"Ngân hàng ACB: Đã hoàn thành 20% kế hoạch lãi cả năm, nợ xấu giảm mạnh - Tạp chí Công Thương","Ngân hàng ACB: Đã hoàn thành 20% kế hoạch lãi cả năm, nợ xấu giảm mạnh  Tạp chí Công Thương","Wed, 09 Apr 2025 07:00:00 GMT",https://news.google.com/rss/articles/CBMirgFBVV95cUxPZU02bzBVZVd6QjBQZ0liVFlkVlI1RnJvSDFzSW9vX1Zlcl9hcnU0cW9RUk5HcWRWck1hTUxveFh2ZVgyVUJnSWVPcUR0VmdrbWJUQU5KOTJEbEZhVUpUWFRpZVFld3dsNmlzX21Ub00wTDRYT1V6TU5TbVVFWjFtQ0pEQ2lOMVpvdUhiSUE3aHJ0ZEpmc2l4M2d6QWlscnBNaEhMMDlZMHdqRm5ITkE?oc=5&hl=en-US&gl=US&ceid=US:en,Tạp chí Công Thương
ACB,ACB phát hành lô trái phiếu đầu tiên trong năm 2025 - Chứng khoán DNSE,ACB phát hành lô trái phiếu đầu tiên trong năm 2025  Chứng khoán DNSE,"Thu, 03 Apr 2025 07:00:00 GMT",https://news.google.com/rss/articles/CBMinwFBVV95cUxNQTczR0cxcEJuNDA1V1gwX01FR1ZNV3hOd01lWHFxX1NFUE5jUFU3UVJkMUJobzJiTjl5OEhzTTh0RVZGcUNNWWoydm5mMVNZR1V4enpBTTB2TzExNHlVSXU4SktxTEpjSDY2czU3TjB5Xzd4dk1BeG1mNS0zOElCenFCM21UdVYtZVd1YWxmNXQyRHVnblFDUkh5eVZ6MDg?oc=5&hl=en-US&gl=US&ceid=US:en,Chứng khoán DNSE
ACB,CỔ PHIẾU ACB – VÌ SAO CÁC QUỸ ĐẦU TƯ ƯU TIÊN LỰA CHỌN? Bóc tách BCTC Q3/2025 - F247.COM,CỔ PHIẾU ACB – VÌ SAO CÁC QUỸ ĐẦU TƯ ƯU TIÊN LỰA CHỌN? Bóc tách BCTC Q3/2025  F247.COM,"Sun, 02 Nov 2025 07:00:00 GMT",https://news.google.com/rss/articles/CBMioAFBVV95cUxOT3p2Qjl3N0NPdmphQ0NDM1hSWmdWSTJuTGM4RXUzaURyWWd0Um1yRmR5RWxqbTZoNmw4NjVSNy1VSzktUEtVT3Fac2NPQkNqdkVoX1JXZkFWM2VWczExUERydDQtSGhHX29mYzM5bmxtSlVBNzRTU0Z1QkFkT2N2QnN0OUtvejdKV1JRMWpsNUJGa0hmQWJ0YXJMZkpxdFdT?oc=5&hl=en-US&gl=US&ceid=US:en,F247.COM
ACB,"ACB năm 2025: Điều chỉnh chiến lược, tập trung khách hàng doanh nghiệp - Mekong ASEAN","ACB năm 2025: Điều chỉnh chiến lược, tập trung khách hàng doanh nghiệp  Mekong ASEAN","Fri, 17 Oct 2025 07:00:00 GMT",https://news.google.com/rss/articles/CBMipAFBVV95cUxOb2VKREJBem1WbFVmRnZVY3hWaFBsekF0Sy1zdmFGcGlLUmZ3QmNHMGN1bEliMVdEQXcxRFhjUzBLSmtGbzF1QVByTk1oUlhLZDBFTXd6Vk45WWkxV0lCb2VXV0dhUVRIcUhGMkFqRm1pNzd6bFNWallBNDE3azNUeV92Mzk2SFJZR3VFQWhzT3c5S2xLSi0xX05iOXlJcmcxYkxFSg?oc=5&hl=en-US&gl=US&ceid=US:en,Mekong ASEAN
ACB,"5 cổ phiếu triển vọng nhất tháng 2, chuyên gia dự báo tăng hơn 30% - thuonghieucongluan.com.vn","5 cổ phiếu triển vọng nhất tháng 2, chuyên gia dự báo tăng hơn 30%  thuonghieucongluan.com.vn","Sun, 08 Feb 2026 08:00:00 GMT",https://news.google.com/rss/articles/CBMisAFBVV95cUxPRFNGMG9xZXhJMlVyM3B1VnN0SExNalIzdk1KdVNXb21yNlZQeVdBN3pTTTVzdDA5VGk1eklUcy1VakRwZzFLX29rUjMwUmtUdmNXZDZUc09NTTRTblIyelFhaWVzQ1RrclFlUWZJYTZQZ1hyUGhSMVVVRkJfVFJBS2Jva1FaaVFxVzJMbzZhY25CSmRKclpZaTdTbVZxWFktSzRLX25nMXpUX0J2UkhzRw?oc=5&hl=en-US&gl=US&ceid=US:en,thuonghieucongluan.com.vn
ACB,Hai con của Chủ tịch HĐQT Công ty Âu Lạc gom thêm cổ phiếu ACB - Tạp chí Nhịp sống thị trường,Hai con của Chủ tịch HĐQT Công ty Âu Lạc gom thêm cổ phiếu ACB  Tạp chí Nhịp sống thị trường,"Tue, 06 May 2025 07:00:00 GMT",https://news.google.com/rss/articles/CBMinAFBVV95cUxOb3dMeVlNczVTUHVwekM3aXRuUVFkcHJkNlRldnNyMVZBaWxST1dwNHJyb3JrcG1XbXBKd21WMG9xbGxQUl9TeVNGNjhTTzFabjBsMFdsU2R2TlkzLWZIU3d6ZjVjaWJrNXVLNnJXZDhLRG9QbGZJb19VRHhTR0thSDJuY2FwZVE3VkxBYUc3ck1KYkxUWjRPYXpCTmk?oc=5&hl=en-US&gl=US&ceid=US:en,Tạp chí Nhịp sống thị trường
ACB,Cổ đông lớn gia tăng sở hữu cổ phần tại ACB - Tin nhanh chứng khoán,Cổ đông lớn gia tăng sở hữu cổ phần tại ACB  Tin nhanh chứng khoán,"Wed, 21 May 2025 07:00:00 GMT",https://news.google.com/rss/articles/CBMimAFBVV95cUxQVjJFUDlXRnNadUFxYmlUODVXb1FnQzNsYmQtTHNHS01tQXY3RFo5aVYyR2xFVEpyVFkzeEtEOWJ5Wi10VFJwUEU5cDMzOUtOa0lLWmsyMUQ3WG1XMjZ2Y0toa0xBWkExVnpKdTZXa2tMLWtzb19oNW9odWpCVEkxZ1cycjMyelljcXRaUjBVaWRGY3ZpdnhTR9IBlAFBVV95cUxPbm9XMkVIR1VENkRTeGs5elhCWnVrSWt0RWZYTmhhczNmT3c4LXVyY1hIY0Y3SUw2Q2tTY3MxRTlKMlF6dnRvMl83WW5hTUVpa09fVVhhVURQNHBRcFhlemtSWXl4ME9xQ2hLR0hnWFF3MkxwZjItVEpyQzA0LTlXajNoOExpZWd4cGM0YkQ5Nmh3bmJT?oc=5&hl=en-US&gl=US&ceid=US:en,Tin nhanh chứng khoán
