ticker,title,desc,date_raw,url,source
STB,Cổ phiếu STB - Lý do tăng giá và sự kỳ vọng trong năm 2025? - 24HMoney,Cổ phiếu STB - Lý do tăng giá và sự kỳ vọng trong năm 2025?  24HMoney,"Mon, 26 May 2025 07:00:00 GMT",https://news.google.com/rss/articles/CBMinwFBVV95cUxQb3kwa3daUEJUQkxkZ0w1Z1pKTkRwekhMOUJ6ZjhSMlgtZGxQSV9WRlRPaDJqUUpBUnZoU0dpSFVpeDJvdWVadWpNVG9LbGc3YXhaNFljRFBjWGltU1R2amNuWHQzY2dxclJ4UUdkUm5OMDdLektaaGdheEpXd2lEb05TM29yWFJEdERKZHloQWdZdzNpQkJJWXNmNUdmOFU?oc=5&hl=en-US&gl=US&ceid=US:en,24HMoney
STB,Cổ phiếu STB - Có nên mua gom? Lợi nhuận tăng đột biến đến từ đâu trong năm 2025 & 2026? - 24HMoney,Cổ phiếu STB - Có nên mua gom? Lợi nhuận tăng đột biến đến từ đâu trong năm 2025 & 2026?  24HMoney,"Fri, 27 Jun 2025 07:00:00 GMT",https://news.google.com/rss/articles/CBMiwgFBVV95cUxPbnBlc0psOGVDdWpESlo5TTZZWWY0Z0Q0cjBXbTdTdHNTV0s4eThnWk4wVndSTjB5Q1JHMGY5dWswaHpkNUVCVmhBbjhXLU9GTVZzUjUyNGFiQzVrTmp6OUZRM252TFhGbmNWRE1xenVEeGt1a1dqWnhXS1NEZVNUSkFFdHByNVRZS25vQVdreWswUXdlQjhSbmZGRlljNGxKc0NyN1VLdVRWN05CTHEzQmNaYXZhbGVwOXRKaTJSYzZhdw?oc=5&hl=en-US&gl=US&ceid=US:en,24HMoney
STB,"Cập nhật cổ phiếu STB – Q2/2025: LNTT tăng 36%, sát với dự báo - dautucophieu.net","Cập nhật cổ phiếu STB – Q2/2025: LNTT tăng 36%, sát với dự báo  dautucophieu.net","Tue, 12 Aug 2025 07:00:00 GMT",https://news.google.com/rss/articles/CBMiiwFBVV95cUxQZk10bl96ZXRHajJObnBRVUtQWF9DOWNJTHl1UnkyVmhyVHVOTWl5YXktUHR3Y1NoUWhPckFaRU5jR0xDc0g4WTNkelNJQjM2bEE4TFU2ZjF0cmY1M2pudjF3aGZIejBBUC1OX0lRQldjSDFWYjNVZlNfX2F1SWhJY1dCMTR4ZG9zaVU0?oc=5&hl=en-US&gl=US&ceid=US:en,dautucophieu.net
STB,Chủ tịch Dương Công Minh và người liên quan nắm bao nhiêu cổ phiếu Sacombank? - CafeF,Chủ tịch Dương Công Minh và người liên quan nắm bao nhiêu cổ phiếu Sacombank?  CafeF,"Fri, 26 Dec 2025 08:00:00 GMT",https://news.google.com/rss/articles/CBMitgFBVV95cUxQaC1WNlJUZUFiYnBUMHJQODVTVlN6Z2cybUNsN0tmNVFDYU9JQ3BLU3N5UnROR3NvOE5FSEZId2FEWVByb20tVnFody1pVUdRV2p5YlI2TmNWQm9OVV9yUzJKX2d3Vlk0LVNRaXJ1MjBkdmpGSzEzZWdHSXhIM3lldlV6WVZsVDZGcE9oUWJyWnBXckduczhtbUU5TUF0RGtBbG44MjFZNktnTHBxenI0ZTJnNnk5UQ?oc=5&hl=en-US&gl=US&ceid=US:en,CafeF
STB,Cổ đông STB không thông qua việc thay đổi điều lệ về người đại diện theo pháp luật - VnEconomy,Cổ đông STB không thông qua việc thay đổi điều lệ về người đại diện theo pháp luật  VnEconomy,"Mon, 15 Sep 2025 07:00:00 GMT",https://news.google.com/rss/articles/CBMiqwFBVV95cUxQdjA5RTd1R0pveEFMZUtxNk5TTWRwY3o5Y3BpcldLSDJaejlQSld6VTFxaVU4c1pMNW9JVUtXTFNmZFdjandGVXZoTS1TTUt1YnZjY2hBZ2l3cy1JbEd4Wl9kWm5renJhUE9vc0tObXotX0lXMFFiRDJZYk5zZExnLWN4a1h6RUN3a1B2Y2w1RjRzLTNvS0ZJWnZldkNKMVBXUkF3RXItUmtmTGs?oc=5&hl=en-US&gl=US&ceid=US:en,VnEconomy
STB,"Tổng tài sản vượt 29 tỷ USD, Ngân hàng Sacombank (STB) ước lãi năm 2024 cao nhất lịch sử - Tạp chí Công Thương","Tổng tài sản vượt 29 tỷ USD, Ngân hàng Sacombank (STB) ước lãi năm 2024 cao nhất lịch sử  Tạp chí Công Thương","Mon, 23 Dec 2024 08:00:00 GMT",https://news.google.com/rss/articles/CBMixgFBVV95cUxQV1ZIdnBqS09BbzB3OGJfbnlTZGdobXNOZWNwM2x3ME4zc1pxbUlzQjN2WVhsSDJQaEJHVEx6anZOSzY5Z1VxTFpPX0hDUHo5ZjJZaTY0R2dsUUQ1c3c3OHNMMmpnMGxWREpJeXNfRHpOcmQ5Z25ISHV5WnZZRWZQekhncmVpYmRoZGEwSjBUU3VqekhvSjJ1WVlpLTA2bUNYX1NOVVFmUHI2Y05MZEk4RFRNQWlzSDBHSVlYalBnNlNwTUlsQXc?oc=5&hl=en-US&gl=US&ceid=US:en,Tạp chí Công Thương
STB,"Sacombank bất ngờ bổ sung tờ trình quan trọng trước thềm ĐHCĐ, cổ phiếu tăng vọt lập đỉnh mới - CafeF","Sacombank bất ngờ bổ sung tờ trình quan trọng trước thềm ĐHCĐ, cổ phiếu tăng vọt lập đỉnh mới  CafeF","Mon, 21 Apr 2025 07:00:00 GMT",https://news.google.com/rss/articles/CBMiygFBVV95cUxNM1hvaTN2b09wOWdqY1lwenRIbG0wNWdJcUZ5TGJaXzJIR1ZiLXpkYXAyY19ZeFFoVS1hQ3JyVHphYi1zUm9JOF9fREhxZml4dmNJZFhFRlg5OWh6V1hYUHVzNWpZSXVjdVFrbjRvQlVhUzRDZV9aalZ2OEliRC1WWG5vcWpFc1hCaDFHdmFCLUpNY09GeWpmRXBoRTRFSWFhcF9jWjNKTWJVMV81SzJpMXU2cTJhODZnWjg1ZnJpNU5Jc3J6QlY3YkNR?oc=5&hl=en-US&gl=US&ceid=US:en,CafeF
STB,Cập nhật cổ phiếu STB - Nâng dự báo LNTT và giá mục tiêu; duy trì khuyến nghị Tăng tỷ trọng - dautucophieu.net,Cập nhật cổ phiếu STB - Nâng dự báo LNTT và giá mục tiêu; duy trì khuyến nghị Tăng tỷ trọng  dautucophieu.net,"Thu, 09 Oct 2025 07:00:00 GMT",https://news.google.com/rss/articles/CBMitAFBVV95cUxNWm5pS3E4ZlJtdDFHc3ppZ1RNME5ZenQ0VEJmRkZ6WVA4aklYbEZpdGppamRMLUZBUWNTR2dxSE9FZnp6d2FaekhBM0NxeGcxYlVweGdxby1teEZKRWlNeGVTZnRJM0ZWMWszekZzWm9sZFYwa1I1QWhZZFVqTWRaajdzMk5QcWVrV0VHNmlTMUE2QmdhUDBkbGY3QVhfWjlwUG1PWGktMWJGazFoYmJOVDZLMlU?oc=5&hl=en-US&gl=US&ceid=US:en,dautucophieu.net
STB,"Một số cổ phiếu đáng chú ý ngày 22/1: STB, TCB, PVS - hangthat.thuonghieucongluan.com.vn","Một số cổ phiếu đáng chú ý ngày 22/1: STB, TCB, PVS  hangthat.thuonghieucongluan.com.vn","Thu, 22 Jan 2026 08:00:00 GMT",https://news.google.com/rss/articles/CBMipwFBVV95cUxQc0doWnRhcHhvUUVQSTdZaV9zZjB3S2tpSjhLaE9lb21yd096WlJWemxmclVWOVNZZllBVEJRS0tSejNqQ25vTTRWSlg3R2VqVU1FdWRHQmtNT2V4WHkxVGlWSTJzWXh0OWxjWmVwQW1Kai1saVZTSnRRaWNTcnVXb3o4Unp6M0Z6TXN4U2otU3JGRXg5TDREYXVaRUQtaHFSeVJUMWNJRQ?oc=5&hl=en-US&gl=US&ceid=US:en,hangthat.thuonghieucongluan.com.vn
STB,"Sacombank (STB): Bổ nhiệm ông Nguyễn Đức Thụy làm Quyền Tổng Giám đốc, cổ phiếu lập đỉnh mới - Báo Pháp luật Việt Nam","Sacombank (STB): Bổ nhiệm ông Nguyễn Đức Thụy làm Quyền Tổng Giám đốc, cổ phiếu lập đỉnh mới  Báo Pháp luật Việt Nam","Tue, 23 Dec 2025 08:00:00 GMT",https://news.google.com/rss/articles/CBMizAFBVV95cUxPWHFtTkVWQ0pjek9KV2lkSGQ5NnM4NEhIYmw4M1pxQ2RhOEJ1QWpxX05ldU9VRjhBVHl5cV9mMHdvd0NGc2JCWHhheUtpSjVxaVg2UnlJNHJqdXhCa29WSndzbkVPXzFaNVhuZEZNNEVkbVVmcXF2NmJzejVwS0h3d25rRHVVRDdNUDJvd1pJRGs5aV9Ccy1XWmtheEFRWVFZTUo4c216U0Z5SHJlSXdEeWltTkRQVTdIRURmck1RNWxwMEJ6c19SRWVxTVI?oc=5&hl=en-US&gl=US&ceid=US:en,Báo Pháp luật Việt Nam
STB,"CEO Nguyễn Đức Thạch Diễm từ nhiệm, cổ phiếu Sacombank bất ngờ tăng trần - Laodong.vn","CEO Nguyễn Đức Thạch Diễm từ nhiệm, cổ phiếu Sacombank bất ngờ tăng trần  Laodong.vn","Wed, 21 May 2025 07:00:00 GMT",https://news.google.com/rss/articles/CBMiswFBVV95cUxQUlJNeFBQQ0JwamlKOERta2VLU3RRd1ctYnRIYzB4a0JsYWZGSGVuQVl6Q0hBMElnTDBhQVluLXFnWWpleUdEdXhhUUNhSGVJMC1hbzJQUlNiRmdYdlNnUFpJUTNzOGhZU3hBSTVRT3FpTGpBNnN2eXcyQ3FtTmItMmZuNnBZSE1SekRJMk5zOEZoYVBudUJYN3ljY2xXanBaWFJEVGpScHJKT0hocTg2NUhrNA?oc=5&hl=en-US&gl=US&ceid=US:en,Laodong.vn
STB,Quỹ ngoại “hô” VN-Index lên 3.200 điểm có cổ phiếu top 1 danh mục vừa tăng trần - CafeF,Quỹ ngoại “hô” VN-Index lên 3.200 điểm có cổ phiếu top 1 danh mục vừa tăng trần  CafeF,"Mon, 22 Dec 2025 08:00:00 GMT",https://news.google.com/rss/articles/CBMitwFBVV95cUxOQk9fdThBTnVRLVJzamFLdWVSWTFubU1vUGJySUs2a0dCbHVNVmlxNE1NU2hNaU9QbFhMQVMwWUNEcGl6MHM3dFRyeDVJS29WMDdwZVlaeWZwQWVTaVVLWExDVDVJSU15OWJaRU9WcjNha3poY2hEN2FDR0dfeTVQZU5YWEFQQ21za040MFhFRlhMdC1PTFg4ZXRKUUxycW9xa3FMRzhuaEtHU2p5NmlBd0xtdlJhc28?oc=5&hl=en-US&gl=US&ceid=US:en,CafeF
STB,STB: Dấu ấn lợi nhuận đằng sau mức đỉnh của cổ phiếu Sacombank (STB) trong quý I/2025 - Chi tiết bài viết - Vietcap Trading,STB: Dấu ấn lợi nhuận đằng sau mức đỉnh của cổ phiếu Sacombank (STB) trong quý I/2025 - Chi tiết bài viết  Vietcap Trading,"Wed, 26 Mar 2025 07:00:00 GMT",https://news.google.com/rss/articles/CBMizgFBVV95cUxQcHYtSWZBRmVIS1JlTWZKV1RRbEI1QkRVNDZmaGpjUnN0UVBsb0Rid1A0a3ZnRWJGU3JDeWVpbVo4Q3drcEhaLW1vVlNTZTJ3cmtQNzFVb3k5YmFMS05FUUw4T3R0UmZnOHVsRTgzbXlWTkV1M1hPd1oySzRBa0ExcHJkdDdRX3lRZENqdnF1XzIxMC1YeUp6eTFqUmV1NGJsVFN6eEREV3E5aUpwN0RBRkRXLURhMTVsSThCbHpvWkdMa1o5M201ck45Ni1Hdw?oc=5&hl=en-US&gl=US&ceid=US:en,Vietcap Trading
STB,Lợi nhuận Sacombank 'bốc hơi' 40% vì đâu? - Tuổi Trẻ,Lợi nhuận Sacombank 'bốc hơi' 40% vì đâu?  Tuổi Trẻ,"Wed, 07 Jan 2026 08:00:00 GMT",https://news.google.com/rss/articles/CBMihAFBVV95cUxOZXV5UkNGdFdhZG9EWEFwQWNiVVg1aFNiYnMwbUw5a3R2MVM4SzkyRFpkN19HNE9YSlFDMjBiU25GM3E0amluMEdXNkRtM3o1SG4wY0VaVkxyV3VadmREUDI4TTJ3bldiMG9PVm54dXVTVjNLV1Jfcl9qNGM4YXF0SFJJdUI?oc=5&hl=en-US&gl=US&ceid=US:en,Tuổi Trẻ
STB,"Cổ phiếu Sacombank (STB) khớp lệnh kỷ lục, hơn 5% vốn ngân hàng đổi chủ - CafeF","Cổ phiếu Sacombank (STB) khớp lệnh kỷ lục, hơn 5% vốn ngân hàng đổi chủ  CafeF","Tue, 02 Apr 2024 07:00:00 GMT",https://news.google.com/rss/articles/CBMiqwFBVV95cUxOaG1OOWhwc3cyLVpvelgzaFA4UmJxaHV0XzA4S014b0Ric3pscEd3UU1lTVYzMTlYS3pUSm9oNmFMY1hBb3Y3aUEtNXZNUjE3VWN0NUR2QXc1OWN0WGRsR2JNV2NfQ3VQMkUtaHZRRWNScHpEZWo4U0JMYTZSSzZUTHE4NVFhR3lGNnZuMmdjaUJpWVFWUllGYm9DNVdKelI2WHk0M3RwMXFacXM?oc=5&hl=en-US&gl=US&ceid=US:en,CafeF
STB,Cập nhật cổ phiếu STB – Trích lập dự phòng mạnh mẽ làm giảm lợi nhuận Q4/2025 - dautucophieu.net,Cập nhật cổ phiếu STB – Trích lập dự phòng mạnh mẽ làm giảm lợi nhuận Q4/2025  dautucophieu.net,"Tue, 13 Jan 2026 08:00:00 GMT",https://news.google.com/rss/articles/CBMiowFBVV95cUxPMjk4ODBteU01VWdCZE04YWhDamxTdDhmZlU5SVVJOTR0WDJPWnFLWUhaTGhJNDdOZzdzMDVqdmVUZ25IUXlwNXJmdFFnUTMzWHl5dW9oa1FQRW4ydnM4TVBVVmdGWmVaOWN1UGJGdXZDN2YxLUY4Z1RwQmRKMXd0RERNc0ZUV2NVYjBvWUMzd3NKSDNHYkZCNHhKRUZvazNNZU1B?oc=5&hl=en-US&gl=US&ceid=US:en,dautucophieu.net
STB,Chia cổ tức – Chương dài nhất trong lịch sử 35 năm của Sacombank (STB) - Chứng khoán DNSE,Chia cổ tức – Chương dài nhất trong lịch sử 35 năm của Sacombank (STB)  Chứng khoán DNSE,"Tue, 11 Mar 2025 07:00:00 GMT",https://news.google.com/rss/articles/CBMitAFBVV95cUxONE80LVJGWEVxQ3hxeVpkbFNLaEJTMmJBY2FPd0k1OG5Bakp4cm8xUlFQT25hU0FPT3ZIbXR0U0ZvZE1FQkxTRkV1T0NjYWVBM05MSlBOZGkzYktSbkIyaXpQamRMbjg3b2hSeHp2U1RxY2FSNXJGTUNXTjVhdjVDNXZTUjVGbFZKMDBBQXNMTU1zakpIY2FVMW91X1lCcEZqVmE2Z2RRb0FId2RDQmluY1RiNk8?oc=5&hl=en-US&gl=US&ceid=US:en,Chứng khoán DNSE
STB,Ngân hàng Việt Nam đầu tiên lên sàn chứng khoán vừa lập kỷ lục mới - CafeF,Ngân hàng Việt Nam đầu tiên lên sàn chứng khoán vừa lập kỷ lục mới  CafeF,"Tue, 25 Feb 2025 08:00:00 GMT",https://news.google.com/rss/articles/CBMiqgFBVV95cUxNcjZSdlppeWZiNHpybExHZDczQ3BMREJFQVVoeEl6SDg0T0laRFR0S3hSYkUxbEZqS3QxeUFfT0dmaS0zaU15Yk9BRHNQNUJ0cjdnOFE0QVYxWndTMExLalEybkp2X01Tanh0UjNGZFd5aF84TjNUdExqYlFfTnp2al9xMklqTFVPaWlhUFlwam1pN3BlY3Z6Q0JNeEtrcVV5aGtYWnBNZ204UQ?oc=5&hl=en-US&gl=US&ceid=US:en,CafeF
STB,Cổ phiếu STB - cổ phiếu ngân hàng vượt đỉnh tiếp theo? - 24HMoney,Cổ phiếu STB - cổ phiếu ngân hàng vượt đỉnh tiếp theo?  24HMoney,"Fri, 09 May 2025 07:00:00 GMT",https://news.google.com/rss/articles/CBMimAFBVV95cUxNaWh6Q2JwU251NW5Kdm5xZjlZODQ2NkIyRFkwd2g2R1lyWjM1alo1N0hONmdDTm8xaGJ6ZmVsUDRqWHMxX0Z0V0d0QVRfemJ3ZzV5QjhDNGIwZEVjVElTLVFyUVMzUms1aFFicDVMTlpOOUxhZ0p6X21Xa3U3OVBSV18yNXlReHF0R0lqOXRxelF5RmZiUUx3Vg?oc=5&hl=en-US&gl=US&ceid=US:en,24HMoney
STB,Cổ phiếu STB - Vì sao giá giảm? Có nên mua? Có còn tiềm năng tăng giá? - 24HMoney,Cổ phiếu STB - Vì sao giá giảm? Có nên mua? Có còn tiềm năng tăng giá?  24HMoney,"Sat, 10 Jan 2026 08:00:00 GMT",https://news.google.com/rss/articles/CBMiqwFBVV95cUxNazdUQldCelNjNXBqZnZLdE5pcU1GZ21yYjlobEJkdElTa2dhT2E2Z1p1R0JIc2JyWTREQi0wTG8xUkNEaWlHZDl0WjlMQTZwSS05c2x3bnBtOHRBRmkyNmwyTlI1OUhEcm54Ym5HWlN5SGNsX0NwV19yOXE0d2JwdDhZSGloYlg5LXFKdDBlaUhnNW54aEM3R3BheExldXViQ3RGVmJJRE5aTUU?oc=5&hl=en-US&gl=US&ceid=US:en,24HMoney
STB,Cổ phiếu Sacombank phá đỉnh - Znews,Cổ phiếu Sacombank phá đỉnh  Znews,"Wed, 21 Jan 2026 08:00:00 GMT",https://news.google.com/rss/articles/CBMibkFVX3lxTE9QYTVHUjVIbV9Pc0NtTENSdmZjY1hTQ0loemk4U2VEMEdPaVBncmJxNlBwMFNUeFpwQUVuYk5USlphdVdkcnJiNjJ6S0Rxclh2em1jX1BKYkxZNE8zZnVOUXUwTnp6YTUyREh3UjhR?oc=5&hl=en-US&gl=US&ceid=US:en,Znews
STB,"Cổ phiếu STB ‘nhấn ga’ tăng trần, cổ đông Sacombank kỳ vọng điều gì? - Chứng khoán DNSE","Cổ phiếu STB ‘nhấn ga’ tăng trần, cổ đông Sacombank kỳ vọng điều gì?  Chứng khoán DNSE","Mon, 22 Dec 2025 08:00:00 GMT",https://news.google.com/rss/articles/CBMisgFBVV95cUxQTFhaU3NnNkRfVm56TnNWaFlGanlxazFDVmJjNGNuQVN2U1hEMnhWZXRnOHNLS0prRElmdWEtdm5LbTRTWEM3LWd2LUlKcmVFQnNndGVVSkJhN1pURVpwM1ltMm9mQXEwWVprMldzTERmWTNtaXQ5V21IbFFyTDR5V0tJSTA0LXNUbTVUNjNfX1hMSXVtQWJHLXB4QUtaVFZJcDlHVXZZanVPQ0F1RUgycl9B?oc=5&hl=en-US&gl=US&ceid=US:en,Chứng khoán DNSE
STB,"Ngân hàng Sacombank (STB): Thời điểm “sạch trái phiếu VAMC” cận kề, kỳ vọng tái định giá cổ phiếu - Tạp chí Công Thương","Ngân hàng Sacombank (STB): Thời điểm “sạch trái phiếu VAMC” cận kề, kỳ vọng tái định giá cổ phiếu  Tạp chí Công Thương","Mon, 23 Sep 2024 07:00:00 GMT",https://news.google.com/rss/articles/CBMizwFBVV95cUxNTnVLcXAxd1pLU0FrTnU0bFdWaDI0OEg5VGFJZl9SemFHcUFMRmZtVDBpejVFcTllcnQ5RU8zWURlN093ek5vWl8wZVl6My15elJNSkFVMGp1emF4ZGZqVGpjN0ZVWHRxZWtVMkhqU1gzaEhMUVZudGptTktOSGd0d0VEd3AyTHd5c0FWWm9lYzEtcTFncVZBWV9qWXhEa0xtUExicHRHZ28yLWJXSWtXdHF6UHFLWHJRTmFIOTNDekpLeWJtdlpQRTBIWjljbzA?oc=5&hl=en-US&gl=US&ceid=US:en,Tạp chí Công Thương
STB,"Cổ phiếu ""vua"" phân hóa, ngân hàng ông Nguyễn Đức Thụy đón tin vui - Báo Dân trí","Cổ phiếu ""vua"" phân hóa, ngân hàng ông Nguyễn Đức Thụy đón tin vui  Báo Dân trí","Thu, 15 Jan 2026 08:00:00 GMT",https://news.google.com/rss/articles/CBMiugFBVV95cUxOeDk5TVU2bHVnM21fRWxrMUFoS1RlT1pxRjFqWDE3eXktMFNDLXAxZmxyV1NDVUFGbnZJaWFZTnZ0MV8zMkNPR0c2SV9Nd3pWQmVFZWxlSWxCYW5jZFFyd29VYzFObFJ5RlJDbWlYVjRBRWZEMWw4dHF5TnVYc1ZQTmE0NEJ0M21YekZ6ZExzVjlST2ZZWGoya2JQQTNzOHBQM0lVMENOZVhORDEtTml3SU9HendvUVdhelE?oc=5&hl=en-US&gl=US&ceid=US:en,Báo Dân trí
STB,"Tăng trưởng tích cực, lãi ròng năm nay của Ngân hàng Sacombank (STB) ước tăng 21% - Tạp chí Công Thương","Tăng trưởng tích cực, lãi ròng năm nay của Ngân hàng Sacombank (STB) ước tăng 21%  Tạp chí Công Thương","Sat, 02 Nov 2024 07:00:00 GMT",https://news.google.com/rss/articles/CBMiuwFBVV95cUxQV1VuZGVpTHd0d2pFLUxqck9JUUZ3bGFIMUEtWHZiel84bmhTWmNyZ0hyVTVFYmZCdTBJQlZYYjJIay1MVV9sb0ZDS3owdnY1a29tN3ozT2gwNFdtbUJFNmdBTEpFV2xuQzJrYTZxRldJaGFISE45bWphd1JQQWZnYmNuYk83M2dvUWotWW1EMEd0NGM4SnJwNHktZzAzZ0c4U2x4Yi1RN1Q4LTU2WGVRejdTa1E1R0Jmd3Yw?oc=5&hl=en-US&gl=US&ceid=US:en,Tạp chí Công Thương
STB,"'Họ Vin' kéo chỉ số, Sacombank tăng trần, VN-Index tiến sát 1.800 điểm - Báo VietNamNet","'Họ Vin' kéo chỉ số, Sacombank tăng trần, VN-Index tiến sát 1.800 điểm  Báo VietNamNet","Tue, 23 Dec 2025 08:00:00 GMT",https://news.google.com/rss/articles/CBMiowFBVV95cUxQSy1BQ0VvV2c5ejJHcjV6X0taZDhBZnEyMHZJdkFlNGkyVXdpLXdMOVVtRmk4U3BPLUt6ZVdlMDFrVWtSTzl6VFRHalRRWVJuSlljUF9VclppOEJlOE05X3JXNy11WEs4b3NkOXFBS054SUNVMmltajhHNXNGUDk5X0NncU1EekVvX1A5cmVPSDhwZkFzaFNnUm9QaHhLbDhPVzhz?oc=5&hl=en-US&gl=US&ceid=US:en,Báo VietNamNet
STB,Cổ phiếu Sacombank phá đỉnh trong ngày tiền vào thị trường 'mất hút' - Znews,Cổ phiếu Sacombank phá đỉnh trong ngày tiền vào thị trường 'mất hút'  Znews,"Wed, 01 Oct 2025 07:00:00 GMT",https://news.google.com/rss/articles/CBMiogFBVV95cUxOS2VRVDV4SzB1eDhDOEtKYmljVVZmc2VSQ3dFRHhRT1U2RU5Nal9jWDV0V0hJSkN2UmYzWmViOUV6bUlRM1VmUG12WVp1eS16MWE0ZXlibE8xZW1vdG4tNFZDQk0tQTFycmp6QWVQWVJPM3ZmM2FJYTE0Q0hsYVNNTGhHZ3FhLXVVS3pOemVjT0hiUmpqMVE0MHp1M0N6MlMzRlE?oc=5&hl=en-US&gl=US&ceid=US:en,Znews
STB,"Nhóm Dragon Capital thoái vốn, Sacombank còn hai cổ đông lớn trên 1% vốn - Tuổi Trẻ","Nhóm Dragon Capital thoái vốn, Sacombank còn hai cổ đông lớn trên 1% vốn  Tuổi Trẻ","Wed, 15 Oct 2025 07:00:00 GMT",https://news.google.com/rss/articles/CBMisAFBVV95cUxQM0dEOWUtMW1zUnVMOGVINDc4b0tjLTE4UkZtV2dLT2doS09iZTZVZGNUZVJOX2RnNG9MODFXQVA2MmFfdXBMc296WlJMZThJT3BJQWNfZ21CdDhUaWZXQVRGdGF1dVFpX2RvNUc1WklEVXBjeFN0VG1KMHFZZTFrMGJWZ2F3YzBlRTFDaTZ6aW5reXJObzF6YndKOWtSR2dEbVRJUDB4YlMzX3Z1bXY2Uw?oc=5&hl=en-US&gl=US&ceid=US:en,Tuổi Trẻ
STB,Sacombank sắp chia cổ tức sau 8 năm - Mekong ASEAN,Sacombank sắp chia cổ tức sau 8 năm  Mekong ASEAN,"Mon, 21 Apr 2025 07:00:00 GMT",https://news.google.com/rss/articles/CBMieEFVX3lxTE9vdEN5QzZNR3hOblM0dWZKSkh3QWpxY2xTaGhMZ2tUZndmNjEzbG1IcGp6T0VlNDhKamJUcW1NZUI3aWotQ05TMmlpNUNqcXFTOWJyanJXaU1JSXZWQ085eEJKY0hxZVhyQU9wZHpiQndSbVpRQXFEZQ?oc=5&hl=en-US&gl=US&ceid=US:en,Mekong ASEAN
STB,"Sacombank Lỗ Kỷ Lục, Nợ Xấu Tăng Vọt - Có Nên Mua Cổ Phiếu STB ? - 24HMoney","Sacombank Lỗ Kỷ Lục, Nợ Xấu Tăng Vọt - Có Nên Mua Cổ Phiếu STB ?  24HMoney","Mon, 12 Jan 2026 08:00:00 GMT",https://news.google.com/rss/articles/CBMiowFBVV95cUxOV0FQUVNpOXptNFBPQ19GWlkxMjdKUnNILVJwWjkweFpxUEdadVkzaXl6MXdQVXhLSVBTcTM2OUhKbUdXZkVtekJnbUUwNWFiYkNUMV9IWmZ4aDh1NWVaX2tMTXREVkI5ejVVUUV0YnlKV2pBamdnNnRtUjJQY0lYRzFXdTlPOTBjNFpFMkNma2dXTUdDUnVGbHAyQlhFTUtmSEQ4?oc=5&hl=en-US&gl=US&ceid=US:en,24HMoney
STB,"Sacombank sắp bầu bổ sung 4 thành viên Hội đồng quản trị, cổ phiếu STB tăng trần - Thời báo Tài chính Việt Nam","Sacombank sắp bầu bổ sung 4 thành viên Hội đồng quản trị, cổ phiếu STB tăng trần  Thời báo Tài chính Việt Nam","Wed, 21 Jan 2026 08:00:00 GMT",https://news.google.com/rss/articles/CBMiwwFBVV95cUxPWlhYMnRYNnhMQ054ZVg1NTFlVUVhWGF0Mmw4WjlwRWVZS3V3S1lKdXhLZjlQWFQ5a0pTZy1tR2NKc0RwczZIQ2RZOURUNy1fVDk5WXZxMjIyNnpxRXctZXRMUHp1bWdpbURxcHBlVzJucS1LcmJOTHZZaFZOZnVoazRxMkxwT2VaREFBWDhNWXlEck54WmNZc1YxSlQ3ZUhkdlpoeUtCQThrSVFITFY0V1dlUkpjNGo3eFBLQkJpQWFUb3c?oc=5&hl=en-US&gl=US&ceid=US:en,Thời báo Tài chính Việt Nam
STB,Cập nhật cổ phiếu STB – Q3/2025: Tăng trưởng 33%; thấp hơn một chút so với dự báo - dautucophieu.net,Cập nhật cổ phiếu STB – Q3/2025: Tăng trưởng 33%; thấp hơn một chút so với dự báo  dautucophieu.net,"Mon, 10 Nov 2025 08:00:00 GMT",https://news.google.com/rss/articles/CBMipAFBVV95cUxPN3B1VHZENHpSc2JrUkpUMjhRVVJiX1I5VWxHaWg2LXRMN2lrNHdPNlFma0VQbzRjV3l1N3BIZTFtazBmWjZMSUJSRWRTRXdQZUFRUVhfbEtkNVgxWDR3dUJSWkNBVHZETmh2djItSXNMSDJDZklJTWk0MFVMWVBZYWhwMEp3WE4tbGY5d01WWTg1SjFYcjdqeUYxZGRVN3kwNVRpbQ?oc=5&hl=en-US&gl=US&ceid=US:en,dautucophieu.net
STB,"""Nóng"" chuyện cổ tức, hai cổ phiếu ngân hàng tăng mạnh phiên 21/4 - CafeF","""Nóng"" chuyện cổ tức, hai cổ phiếu ngân hàng tăng mạnh phiên 21/4  CafeF","Mon, 21 Apr 2025 07:00:00 GMT",https://news.google.com/rss/articles/CBMipAFBVV95cUxNNURxY3pvNVpsc0t4dnltUDREWWs1QWtOMFJiRWRRYWRHdlRMYTNocVRjUmNJMmk3Zi14QnowakoxdnN4Z0RJd2xLOWhHRlBuUnJSWmRlc0JYUUJRMWVPLTZwX2JHb1J2eENUUE4yWDR0VHZmUFYxenJnUW1iMGhFYW84TmNXTnIwdmh3dkE4anNUOXBDd2NZTkt1TmdnNHZONGNrbw?oc=5&hl=en-US&gl=US&ceid=US:en,CafeF
STB,Sacombank (STB) đặt mục tiêu lợi nhuận 14.560 tỷ đồng trước thuế trong 2025 - Tin nhanh chứng khoán,Sacombank (STB) đặt mục tiêu lợi nhuận 14.560 tỷ đồng trước thuế trong 2025  Tin nhanh chứng khoán,"Sat, 05 Apr 2025 07:00:00 GMT",https://news.google.com/rss/articles/CBMivwFBVV95cUxOMDdxVjVtT01UYXFKOXVxY04yM2ozSG14MkhtWjhjRFc4cmFJeFpSMjdvdUdXRUthMTRoRFlQMUtnSFphQ0QzQkdIY0Jud2lKNzZRNHRhbUgzNHRIVl9IMERGeVVMZ1l1cldJa1JzaWtjb2pVVktFQU9ZWEhlem1OTmc5ODZoWHByTVEzSmFaOE9abDJ1UjBFNlhDU1JlUTc0ZEJ4d0NNZmQtdkwweEVTb3R5S096MFF0NVg2NnNXONIBuwFBVV95cUxNMk1Db0RnaFZpYzB6QlBPVmlySEFndjdvVFM4NGoxNUpTbkdKVC1aNHBOcWJfOEg1ankwc0dScE1IeUF0MXl4RlJ4NF95RFZISXUwMFFMblpyV0o5UjAtOHh6NGNVc0VXaWpZTVlzS1EwTkQteHk2MUJIeFEyN3pwMV9HVnJWcklER1I5TEw2Q1BtTDZ1QmJoZ3c5dWI1WFc3d3ZhZlJxUnZDbnlteEhBUzh1MW5mOUhKcDd3?oc=5&hl=en-US&gl=US&ceid=US:en,Tin nhanh chứng khoán
STB,"“Cá mập” Pyn Elite Fund gom mạnh cổ phiếu STB, trở thành cổ đông lớn của Ngân hàng Sacombank - Tạp chí Công Thương","“Cá mập” Pyn Elite Fund gom mạnh cổ phiếu STB, trở thành cổ đông lớn của Ngân hàng Sacombank  Tạp chí Công Thương","Mon, 08 Apr 2024 07:00:00 GMT",https://news.google.com/rss/articles/CBMiygFBVV95cUxPaWVmUElZMDRSSmRmbjJoalFXd1c4S3JtdldpTjV3WF92dzJrUnVtOUVBeTlJendYR0NkRmN4Qkx4Y0lNWktGZGpEdU9lZ1FhQ09OWUdtb0NMRFZVSmliUDBuVjh4X19zbUl6MzFCWVhBQ0JOWnlMdXVTdFlndDltVjBIVk5mTWZMYkwzemVLa2JCRV9EMlJhNWcwTVI1b3ZOQ1ozT2xBUE5vbEs5aXNQWF9GemtnRUg4SWdEb3BLcktBOFZha3IwckJn?oc=5&hl=en-US&gl=US&ceid=US:en,Tạp chí Công Thương
STB,Thanh khoản cổ phiếu Sacombank của Chủ tịch Dương Công Minh cao nhất trong vòng 1 năm - Laodong.vn,Thanh khoản cổ phiếu Sacombank của Chủ tịch Dương Công Minh cao nhất trong vòng 1 năm  Laodong.vn,"Tue, 02 Apr 2024 07:00:00 GMT",https://news.google.com/rss/articles/CBMiwgFBVV95cUxNWUNRZmFZdmNWX0RvRXB3ZkY0YlZCeHVYdlJPNERUcnJ5N1owOFE0bzduVWlBUzdCcTdwdFF0X1BwejBXT2hFVnBDWWlyZkR2eExLdlg3MWpWZjJadHkxdW1KcU1TejRUMUpMTExLYkx3YnRDazIwdkc4YlhUMVFJU0EyVV9NZjlZNVJ5V0hhbnU2a2pKOFl2cVdXaWNLeVE3dkRNMGtSWmJTM3dqc21fblJISDc4VlF1SURqdW9sOVhSUQ?oc=5&hl=en-US&gl=US&ceid=US:en,Laodong.vn
STB,"Sacombank muốn chia cổ tức sau 1 thập kỷ, sẽ bỏ nghìn tỉ mua công ty chứng khoán - Tuổi Trẻ","Sacombank muốn chia cổ tức sau 1 thập kỷ, sẽ bỏ nghìn tỉ mua công ty chứng khoán  Tuổi Trẻ","Mon, 21 Apr 2025 07:00:00 GMT",https://news.google.com/rss/articles/CBMivAFBVV95cUxNblJKZjk0TlBjVkxVUTBoLTY0TXF4Xy1LTUFhQTd6SUdaZV80OXFpck5qTTJJU1ZhS3VlUW9MUVJxN3VxZUpnMVM0dTd6RkRjWEVNRzhBdnNGV0FieG9lWnNVaW1wX1lFdm1uaDNJMTVmVjlWLTJoV1ZZRF9uR3VhYnNHUjJ1MnNKbDIyZUwyLVdqRXhsVUJRaVNwYVVRbWhDNGJsbGVBeG9feG9OVkJUb1NVQ2kxcUt2WFp6Zw?oc=5&hl=en-US&gl=US&ceid=US:en,Tuổi Trẻ
STB,Cổ phiếu STB (Sacombank) giảm sàn ngay khi nhóm Dragon Capital thoái vốn - nguoiquansat.vn,Cổ phiếu STB (Sacombank) giảm sàn ngay khi nhóm Dragon Capital thoái vốn  nguoiquansat.vn,"Tue, 21 Oct 2025 07:00:00 GMT",https://news.google.com/rss/articles/CBMiqgFBVV95cUxOYUZyVUZWWDl6VGhySWI1WG5xVXpUZWFWclJUeDBmMjVnNjlGa2RqY2ktNXgxeHRiSENfWjNqajNmbG9JbWJkNVZ6eXN6WW5tWTR0bHM4RTgxUGphLWRDUHBjQWx1VXAtS192aGgtTzlhWXlXczduSENhd2VZbURSU2JBTGdSbWQwRFYtbG82ajdSSHJOdzBKcTdmbmsycmxkQk9kcXAtdVJuUQ?oc=5&hl=en-US&gl=US&ceid=US:en,nguoiquansat.vn
STB,"STB: Triển vọng đấu giá cổ phần, ghi nhận khoản thu từ KCN Phong Phú - diendandoanhnghiep.vn","STB: Triển vọng đấu giá cổ phần, ghi nhận khoản thu từ KCN Phong Phú  diendandoanhnghiep.vn","Thu, 13 Nov 2025 08:00:00 GMT",https://news.google.com/rss/articles/CBMirwFBVV95cUxQZTAzWk5OeFFhYko4WXRLOEZXRjNpTFRQV3pjR2RmLXdzMUUxdE5FZy1EZ0ctWWNJSXh1a3FuZ3pUd3MtMmJOaTRWQkI2T3VNQjFvUGNyNTVrSE5kbllWZTVxdXZPUDVVTldfVmVkRFZiNTR0bW1QNE03VWI1X2FjZ1RaQTZPRGpYMDZVZXR2QmdzbzBqYklTbGthbjFaTF9SWndiamRCVHhxVEdzRV9j?oc=5&hl=en-US&gl=US&ceid=US:en,diendandoanhnghiep.vn
STB,"Bất chấp áp lực cạnh tranh, lợi nhuận của Ngân hàng Sacombank (STB) dự báo tăng 15% - Tạp chí Công Thương","Bất chấp áp lực cạnh tranh, lợi nhuận của Ngân hàng Sacombank (STB) dự báo tăng 15%  Tạp chí Công Thương","Sun, 25 May 2025 07:00:00 GMT",https://news.google.com/rss/articles/CBMivgFBVV95cUxPdUZpVm4yenVwWkJZTHd3bi16NXZ5cW4teFNsTzJlX19paXFjYVBYNm52T0dCZlk5elM5SklnLWlfZ2ttdEtxMFJTaVhUMGxpWVQ3SHFOb2Y1SGZoU2FUczMxZzZ5Q3o0V3J5RkhuRUp4dEJkN3RkbVBobTFUNFNWeDgtczNRNUVvcEhrSjY0d1ZoNnNQbHFUVFVXMkx4SFhuYUcybEkwT2JHNkNJWnVzTE51dzhHSmhxendxTnF3?oc=5&hl=en-US&gl=US&ceid=US:en,Tạp chí Công Thương
STB,"Gia hạn tái cơ cấu đến 2030, Sacombank đối mặt áp lực nợ xấu và niềm tin thị trường - Nhadautu.vn","Gia hạn tái cơ cấu đến 2030, Sacombank đối mặt áp lực nợ xấu và niềm tin thị trường  Nhadautu.vn","Wed, 18 Mar 2026 07:00:00 GMT",https://news.google.com/rss/articles/CBMitgFBVV95cUxPTmlGeVpZS1hRdm1lTmRleHV2UFdVOGlfRW9TUDhtNUdFQVdUM2hFazAxMTJjbFYtN3J6eGpKUjByenplRWoxUWlOT1Q4WTFRQVh5UWEwSmljTzdiQkQ2cDZ3bmQ2NHR6UkxUdE4wRG9sX0NvTlRrRVd6N3dWR0lYVDFURURlLWE5d1Vxc1BnWFJLX3ROUXlsUUhFTVVncC1xSDkyUlcydGZqQUVYU244OG1SOFYtdw?oc=5&hl=en-US&gl=US&ceid=US:en,Nhadautu.vn
STB,Sacombank có chia cổ tức trong năm nay? - baodautu,Sacombank có chia cổ tức trong năm nay?  baodautu,"Sun, 06 Apr 2025 07:00:00 GMT",https://news.google.com/rss/articles/CBMie0FVX3lxTE4xc2trU3RRNEpsWmwtdEIyUF90U0pwNG1pOUwyeXc2bl9qMk5lUXpiNlc3dzZPd2ZJcE1rcVFpMzBaZk9aWFBoQlJiMTJudkpzQ2F5eU9xYWVvdU5TbGJJdW5PWFcwMUtGNGN1MmhGWlVWUW1sUVRmdG5nWQ?oc=5&hl=en-US&gl=US&ceid=US:en,baodautu
STB,"Cổ phiếu STB lập đỉnh mới: Hai quỹ ngoại nắm gần 11% vốn, một công ty chứng khoán 'về bờ' - nguoiquansat.vn","Cổ phiếu STB lập đỉnh mới: Hai quỹ ngoại nắm gần 11% vốn, một công ty chứng khoán 'về bờ'  nguoiquansat.vn","Wed, 21 Jan 2026 08:00:00 GMT",https://news.google.com/rss/articles/CBMivAFBVV95cUxNc2YtREQwWFRhUmNRQkxsY3gxaXdZLTdKZ1pkaWNWRUUwSVpEVE9CYTVONExuRlhCUW9EMi1US3dvZGlwcmoxVEVsb3FUTmxqOHJWNGhCdWp1bnBYVDV3ZnNsVy1nUTAyVDFIQUxWQ21RcTdaakpISHo1Nl9WejM1WnFZakduT3M3VVluUXBKOHdVd1hJc1JoUVZGcTJIUmdHVUhnaDZNNm9JNHJJZVRUNVE0ZmZxc2tRN3JfUQ?oc=5&hl=en-US&gl=US&ceid=US:en,nguoiquansat.vn
