ticker,title,desc,date_raw,url,source
STB,"Dính tin đồn, STB bị bán tháo khớp lệnh kỷ lục 105 triệu cổ phiếu, tương đương hơn 3.100 tỷ - VnEconomy","Dính tin đồn, STB bị bán tháo khớp lệnh kỷ lục 105 triệu cổ phiếu, tương đương hơn 3.100 tỷ  VnEconomy","Tue, 02 Apr 2024 07:00:00 GMT",https://news.google.com/rss/articles/CBMitAFBVV95cUxPcGxDUGJTNkNhR1lad19TNlZkSG4xNjFOM1pJaHo1S0NYQUtzV3d6RUh4YTh6TkVTdEJWWGRNQlg4d1BPYktqajhuWDhIbTlSOFVFbU1mNjljMmRyandEUHpDUXNQZVZEMjZrYWR3SEdLX1ZXaTQ5akgwWVBCWFFDSDlGbkFCdTREZTNGUlg5NUJoeENqZm9BNWVfdnNabHZBY0lsUGxsUnRRa0NmMGYtX2l0MFk?oc=5&hl=en-US&gl=US&ceid=US:en,VnEconomy
STB,"Giá cổ phiếu STB vượt VCB, trở thành mã chứng khoán có thị giá cao nhất ngành ngân hàng - CafeF","Giá cổ phiếu STB vượt VCB, trở thành mã chứng khoán có thị giá cao nhất ngành ngân hàng  CafeF","Wed, 24 Dec 2025 08:00:00 GMT",https://news.google.com/rss/articles/CBMixAFBVV95cUxOSkFGalVxVGFGM3N1NURDYm1aN2dKSWZkRXhjWkltUmdvZXlTNEYzQkI0RFpHaThmZzgwckctMjE3akFjbnNWR1hKTHA3aGEtUkQwU2kyT1R4aW1waElHNlpscVZ1RlJKTWU1VW9yQXBYY1VVNUFLZ3lud0xhVXg5enJfNlRiRTFscVVEMnN6bFEtc19YMlBjY2UtRDVvQkQwUnppbHpaSWJBY2duZnFVYlk2UHYtVzFsZzFIdTlFNWFGZ1du?oc=5&hl=en-US&gl=US&ceid=US:en,CafeF
STB,Cổ phiếu Sacombank (STB) tăng trần phiên thứ 2 giữa lúc cổ phiếu ngân hàng bị bán tháo - Chứng khoán DNSE,Cổ phiếu Sacombank (STB) tăng trần phiên thứ 2 giữa lúc cổ phiếu ngân hàng bị bán tháo  Chứng khoán DNSE,"Tue, 23 Dec 2025 08:00:00 GMT",https://news.google.com/rss/articles/CBMizAFBVV95cUxOTzR1YkRIeHJ5aW9Ha0x6T0lyV24zV1hzeVl3V0Y0amhqTHZYajI2aF9pNWpaTDIyZS1aOW9uYnJ5MFNIUDhWXzZyUERJQjhiYVZ1SndXNndvQ2dvVHlob1lVWjZnV1hZcENDdlpRUk5xWElyRGlqVzJiUzdWVVk1UWp4SGNEdENmX1l2aDZmcHpKMzhxTEQwRER0aktlb1F5SEpBcXJBQTlVa1Z4dnEweHhqNmZnOE5yaGRNUTJaelpMc1dlNFhGS3FvNGw?oc=5&hl=en-US&gl=US&ceid=US:en,Chứng khoán DNSE
STB,"Ngân hàng Sacombank (STB): Bổ sung tờ trình về chia cổ tức bằng cổ phiếu, muốn mua công ty chứng khoán - Tạp chí Công Thương","Ngân hàng Sacombank (STB): Bổ sung tờ trình về chia cổ tức bằng cổ phiếu, muốn mua công ty chứng khoán  Tạp chí Công Thương","Tue, 22 Apr 2025 07:00:00 GMT",https://news.google.com/rss/articles/CBMi1gFBVV95cUxQWnF6RDBwZFJlY1VLNWROa2RKRG5lY1o0b1RWMDd0MlVIS3RvXzRHM3YyY0JqTTRpRWhmTHl1NU9aN2JEaFE4dmxiTjFLanU2REJxQnBFa2t4SDFFZ0tXT2dzVTlBZFN3bTREUjJBRG13VXlOMkx4cjlUN1VhNG5fTDhNUkJ2b0s5cTlqQl9TaHVlYUJrN3ZoTnN5RExzZ1A4T1BzY3Vfd0c3WTN6ZzRqdU1wMGFPVDlnR3dyNEZ5N19zSW9jdzdGclgtWlFyUHQ1LUpGNjFB?oc=5&hl=en-US&gl=US&ceid=US:en,Tạp chí Công Thương
STB,Chờ lãnh đạo tiềm năng và tín hiệu tích cực của cổ phiếu STB - diendandoanhnghiep.vn,Chờ lãnh đạo tiềm năng và tín hiệu tích cực của cổ phiếu STB  diendandoanhnghiep.vn,"Wed, 21 May 2025 07:00:00 GMT",https://news.google.com/rss/articles/CBMipwFBVV95cUxNc051RnRGb0p3THo1c0p0YmZZV0k2MDZqMWtmdDdPS1kxVmNrZEwzV1lWaWlXc1JxWjVLY0dqSk5DblAzUWVDaWdlc0NMYnZvLUtuUUVSV3Zkc1NHdkZJZFFvX2lpZlNrTWV6Q3JteWJfTHVfVkpkNTR5VE96V1lqcy02RmVtLVJUS0Z1enBpQUZwSHNKeGtWUFBvQmlBQm94OWdnQmtWOA?oc=5&hl=en-US&gl=US&ceid=US:en,diendandoanhnghiep.vn
STB,Sacombank (STB) bổ sung 2 tờ trình xin chia cổ tức và mua lại công ty chứng khoán vào đại hội cổ đông - Tin nhanh chứng khoán,Sacombank (STB) bổ sung 2 tờ trình xin chia cổ tức và mua lại công ty chứng khoán vào đại hội cổ đông  Tin nhanh chứng khoán,"Mon, 21 Apr 2025 07:00:00 GMT",https://news.google.com/rss/articles/CBMi4wFBVV95cUxPZmhrWE9rNHBrRWpkMXJRcmxBMjRESnR4TDFfNkZtNXN6THhGWEMxMjVQbDh1TkQ0N1Y1TVRFeEdqa0hIeXI0TFp2S2hwSHFBRHdwRk9GSXI3MG9iVndWRFZzSWVVc2FGM21YelFKWXl5NkNyUE5FbTV5emd1UlN3em5UTS1QZjFFN1k4eEwxaVhDQkpsNThtY2VweWJhekJiUW1XaktkZ1Byb3pZSmM2d3M2RngxTzVoY3dWQjQxbllSUGQ0cjJPWTlSWFQtREQtSUUzMVNYalpCVHk0YTF2WlVvNNIB3wFBVV95cUxNWUJqVmdMMDBjaWRnY205TDFVem5OR1ZDR1A5QWhvY0FjckYtOGFkQW94QWduV01PeUp2TFR2cHpwclJ3ZktBd0dFakRtOS13SzlSRWpNZnA3NXlYMmdjeEx2a0V1ZDZUZ0FCYUg5ZVppMTRkWHdKQjVDYjgzSGYySE5zVk1VQV82eXJSWS02TVlNN3FIYzFCbkxwTGNnZnQ4UjFIVlduNzBqWV9Wai1ZaFZ4ZVNsRDh1OGItR0JxSW1LamJsNjI4Z0dXeHRMTmZmZThvRWh0UUVtV2F3Uzc0?oc=5&hl=en-US&gl=US&ceid=US:en,Tin nhanh chứng khoán
STB,"Cổ phiếu STB ""bất ngờ"" hút dòng tiền: Tín hiệu mới của Sacombank sau thập kỷ ""sóng gió""? - Báo Dân Việt","Cổ phiếu STB ""bất ngờ"" hút dòng tiền: Tín hiệu mới của Sacombank sau thập kỷ ""sóng gió""?  Báo Dân Việt","Tue, 23 Dec 2025 08:00:00 GMT",https://news.google.com/rss/articles/CBMitgFBVV95cUxPNjhyWEYtbmQtemNEQmdiNmFBZ05BUUY5VXgxYU0xLUlaQVRPMlh4MUhabnZZZEJVZkd1cDZCanREM05YZWVtRjFGclI3NGRtTTdFZ2hIOVUyYWRNQ3pZeDhMVlJCZFdSUEtFOVJBaUhKY2RSWVdNdXd4d2p0YU1FOEN0TVNDMEstU1R5VTA5X3pXd1dTc2pBYVo0U1pKSjkwQ0luWVl4R1lXV2plOG04M3NIOGJjdw?oc=5&hl=en-US&gl=US&ceid=US:en,Báo Dân Việt
STB,Cổ phiếu của Sacombank tăng trần sau thông tin sắp đổi tên thành Ngân hàng Sài Gòn Tài Lộc - Thời báo Tài chính Việt Nam,Cổ phiếu của Sacombank tăng trần sau thông tin sắp đổi tên thành Ngân hàng Sài Gòn Tài Lộc  Thời báo Tài chính Việt Nam,"Wed, 25 Feb 2026 08:00:00 GMT",https://news.google.com/rss/articles/CBMi0gFBVV95cUxNTkVtRnhGdU9fN0QwUkJvVVFPQllkaXdEdXJrbkNnLWVfZV9QWmpFVl84cXc0M21GZ0VlTUFZSWdiRXJnVEx6UXc0VHl3VDVEUzlxNjVrUlMtZnV4YXZXSVFjTmZKNUtFa2JVSHp6TmdtNmE3dF9Va1RJSEdscWp1Z1hOeGFreFphMkhlSk5xU0plS3UxQms0MFoyTVFNS3NXaldJTkdBZGUzSXRhaktxeFF3ZTdfbUMyMzVxcER2T1dJVUpQVnhUbEU3Rmo5R0J3Qmc?oc=5&hl=en-US&gl=US&ceid=US:en,Thời báo Tài chính Việt Nam
STB,"Cập nhật cổ phiếu STB - HĐKD cốt lõi ổn định, kỳ vọng định giá cao hơn; nâng khuyến nghị lên Mua vào - dautucophieu.net","Cập nhật cổ phiếu STB - HĐKD cốt lõi ổn định, kỳ vọng định giá cao hơn; nâng khuyến nghị lên Mua vào  dautucophieu.net","Thu, 05 Jun 2025 07:00:00 GMT",https://news.google.com/rss/articles/CBMivwFBVV95cUxPSmpqQWhRVTRCUE9LSFpJdFl3TG0zcmpuTHl5Zjg4V2FOYkxEVXljc1ljOWRkekhHWmdWSzFJQ2pENlJSX21hUFJGYWc5eEVaNlBZelZLZGZvNDR6OTNmZ0VUOFh4QV84cE8ybjFqV3UzQXB2OUZpMEc5cnNEVnFwQWlJSnIybFRYMDRINk9WMkFWTWZPbXpsQWp3ZEhNUDZaVldrQk1tNEowUGlyN1dGQVcxTGh2T1Z1NENxampvVQ?oc=5&hl=en-US&gl=US&ceid=US:en,dautucophieu.net
STB,STB tiếp tục tăng trần sau tin ông Nguyễn Đức Thụy làm quyền Tổng giám đốc Sacombank - VIETTIMES,STB tiếp tục tăng trần sau tin ông Nguyễn Đức Thụy làm quyền Tổng giám đốc Sacombank  VIETTIMES,"Tue, 23 Dec 2025 08:00:00 GMT",https://news.google.com/rss/articles/CBMivgFBVV95cUxPbldPUnoxZnpyX2pCc3BaRHJ2Szk4LWtLQW5xc2hhZ19ZanlpWk9CaGFoVFZTUXZmbDVhTEdUMjdsYXoyczRtMDdvOU9VVURaUzJiNGQ5UEx3a1Zhb0ljakRqV1VYSzJWTktndE9pS3lkX2RuQklPTEVDMTcwUVJIYnRKcUZ2WHZjZHBaWEpfTlg3ZXJBTTk3MkxJbndDeVVydEZKb21lYjNxRXllQk5hSjBTZ0xOcTNSdnFjNDBn?oc=5&hl=en-US&gl=US&ceid=US:en,VIETTIMES
STB,"Cổ phiếu ngân hàng 'kéo' VN-Index, STB vượt VCB về thị giá - Tuổi Trẻ","Cổ phiếu ngân hàng 'kéo' VN-Index, STB vượt VCB về thị giá  Tuổi Trẻ","Wed, 24 Dec 2025 08:00:00 GMT",https://news.google.com/rss/articles/CBMinAFBVV95cUxNYkFoLVFNSWxsSXhJN3FBWkNPNzN5TUtWcWdlQndManlIY0ZlU3pwV1NmWkU5YnNrcXM1Y3lLNkpYYkFlTDVhVjBZYzlCRzdCSlJPRkEycUJYV210cmduZkhTRWxzTHZQT3B5MFhyaElzNHQyOXlldnlYNHFSTktrWkQ4bEJETnBUTHJEb2ZPdGJqNGZKdVc1OUZaUXI?oc=5&hl=en-US&gl=US&ceid=US:en,Tuổi Trẻ
STB,"Sacombank bất ngờ báo lỗ quý IV/2025, cổ phiếu lao dốc - Nhadautu.vn","Sacombank bất ngờ báo lỗ quý IV/2025, cổ phiếu lao dốc  Nhadautu.vn","Wed, 07 Jan 2026 08:00:00 GMT",https://news.google.com/rss/articles/CBMijwFBVV95cUxQUFRQZGlHWnZwWWtkU2JVS0RLcWxyTFVNa2l0aGJMRDJxbWw3X0JFOE5BT3NtaUl2N0F4UEVtM1piQ05YOTI3RUJDbnpUWGJqWGtsdkRtNGlVNkxwMWtmM1AyQ2J5cHhpa0dvV29zMldwX19UVV9sR09HSFBtNlVjRDY0T3pZYndjZ0E0OTR3UQ?oc=5&hl=en-US&gl=US&ceid=US:en,Nhadautu.vn
STB,Cổ phiếu Sacombank bứt phá sau loạt thông tin quan trọng - CafeF,Cổ phiếu Sacombank bứt phá sau loạt thông tin quan trọng  CafeF,"Wed, 25 Feb 2026 08:00:00 GMT",https://news.google.com/rss/articles/CBMinAFBVV95cUxNRGM0bmNBUXdER1VOUGd4N2RqUDhIb3YyOU0zbERYb045QnJuUE5UVU55TEUtcnlUZVNRUjMwd0xCMTctbjNnaC1OUHZybEVEc19mdFdNSFJaeVhkdHUyNXNISElwbjV2ZmwwSXRDSHV1dHpPbkVPWVVGb0V4WnE5U25OSlpIS1RHaDQ1cDJ2MmR6WGh1dnlqajVLRmM?oc=5&hl=en-US&gl=US&ceid=US:en,CafeF
STB,"Lô 32,5% cổ phần Ngân hàng Sacombank (STB) của nhóm ông Trầm Bê sẽ đấu giá từ 60.000 đồng/cổ phiếu? - Tạp chí Công Thương","Lô 32,5% cổ phần Ngân hàng Sacombank (STB) của nhóm ông Trầm Bê sẽ đấu giá từ 60.000 đồng/cổ phiếu?  Tạp chí Công Thương","Sat, 08 Jun 2024 07:00:00 GMT",https://news.google.com/rss/articles/CBMi0wFBVV95cUxPN20wOFNvNlc4WEpGWmNfWkpjLXROOGxfdUdEdnpQbTRGUExZTXRUTFk0N190b3E5RjR1UXEyWGdHTHYxeTl2SXIzVU9CWTNBMHhqaENyMnVEQnhKRnpLYjJrOEMtemt6bWRGc1Y5SXZ5ejNiRFlxR2pzNkxXc2lCM2JwRGNyS3ZDREdPc3gyYzY2UUNzOURwcnpSOGFIbGR3U01EZHVxQVRQUF9RaTVkeUVkekNPdWtEdzZYNTUxeUtPT3h5emlIYnFuRnN0b3pKbzJN?oc=5&hl=en-US&gl=US&ceid=US:en,Tạp chí Công Thương
STB,"Vượt đỉnh mọi thời đại, STB trở thành cổ phiếu ngân hàng đắt nhất TTCK - Chứng khoán DNSE","Vượt đỉnh mọi thời đại, STB trở thành cổ phiếu ngân hàng đắt nhất TTCK  Chứng khoán DNSE","Wed, 25 Feb 2026 08:00:00 GMT",https://news.google.com/rss/articles/CBMitAFBVV95cUxORkFSYVVtRG4zdE9jekZRZmw5RTJwTjZ4UF8tRldOa1NBdnNhNVpXZ3UxSFppbV9HNVNzbjYyU1E1NlhZZ3RxSG1Sd3BhN0tqU09FbERzX1ZqUkFXOW1GcEdvUTFOYmhQMDhqNHNKRXpRXzE0NnZFbUxNRUQ3WVhoV0NKQ25YOWxpV3JPSTgyNzdRcnhoN3hJT0lieWc0R1ZxSndERG9WemJtUWUtTjZHRW1oMUo?oc=5&hl=en-US&gl=US&ceid=US:en,Chứng khoán DNSE
STB,"Báo lỗ quý IV, cổ phiếu Sacombank bị khối ngoại bán ròng hơn 1.100 tỷ - VIETTIMES","Báo lỗ quý IV, cổ phiếu Sacombank bị khối ngoại bán ròng hơn 1.100 tỷ  VIETTIMES","Wed, 07 Jan 2026 08:00:00 GMT",https://news.google.com/rss/articles/CBMipwFBVV95cUxNblRUY00tdnVLOVZKa2VTYVBLaGxRNmplZnlWMUctUElKdDJqcUxZWFRJNG5mM1kzYzNPRHRsc1hkZ2tUT0ZlMkVoUUcwdkN5a1BobkR3Y0Q0UGx5M3VxZlBJVGM1eVZDdjJISXRHSkQzd1lkS0NKQ1NNTWFVTU82Rnc2TG9ZYW5uYVdLRld1V1NOZzc3Q2N0TmhqT0tBa3BCZzJsNmZUOA?oc=5&hl=en-US&gl=US&ceid=US:en,VIETTIMES
STB,"STB vượt 50.000 đồng/cp, một cổ phiếu ngân hàng tăng hơn 9% phiên 18/7 - CafeF","STB vượt 50.000 đồng/cp, một cổ phiếu ngân hàng tăng hơn 9% phiên 18/7  CafeF","Fri, 18 Jul 2025 07:00:00 GMT",https://news.google.com/rss/articles/CBMiqwFBVV95cUxOMG0xenkzNTh0Ty1SMGlFck9tZnUzUVhNZVlReGhtQlJaY2xGekJLbDBoU2NDWjI4N3NHa2VON0liRFVzaWFYRGdoenpUakhyMWtUZXdlYWptMGxoMmFCNTZfbWhXMnVLTzhJOFkyMmxlelprOEVSc0tMTWtFblF0c3dON0phd3F6V0JYSFB5Zm5IdW9Ld0czZ3JZcmNsUUw5YjVGZXBWYjdBM1U?oc=5&hl=en-US&gl=US&ceid=US:en,CafeF
STB,Khối ngoại “chốt lời” đột biến cổ phiếu STB trong ngày VN-Index vượt 1.861 điểm - Chứng khoán DNSE,Khối ngoại “chốt lời” đột biến cổ phiếu STB trong ngày VN-Index vượt 1.861 điểm  Chứng khoán DNSE,"Wed, 07 Jan 2026 08:00:00 GMT",https://news.google.com/rss/articles/CBMiwgFBVV95cUxOOHBTZ0hfTFVVM3ZOUGU2b1NLNTFhZGJVZXpRWU5jU3pLVUxLRzVBZEJDSkphcjJmX1A0RWxGbkpSV0dHN0tVOFFuSDNVRW5fTTBLakt1QzN5bVRoT3k0NExPZExTaUZWY0Y3QXlmNlVyUXBOQWFUeEg1TkMxSENuRjdRZW9WYmV2V1FtSHM4bWt3aWVHQlJwU2F6dmNlZllPeUFfY19hSWR1SFJyV2JvVHpWTUhCaTNpR3ZQTk1xNVZ1QQ?oc=5&hl=en-US&gl=US&ceid=US:en,Chứng khoán DNSE
STB,Cổ phiếu Sacombank giảm chạm sàn - CafeF,Cổ phiếu Sacombank giảm chạm sàn  CafeF,"Wed, 07 Jan 2026 08:00:00 GMT",https://news.google.com/rss/articles/CBMifEFVX3lxTFBHS2hod0JfN2dQbjFNYkdGZ1p0SEFFZnZHZEZqUmtWZjhHdlFScUR5RndfT1lMbHZvRnlXd2hQRldIWHBQZV9ueTNodlZTTldVbVFhQXZQMFhCVFF5d1p3V2RqeS03eHlyV0JHV1F4QmVqWlNXcHhHd2t1LXo?oc=5&hl=en-US&gl=US&ceid=US:en,CafeF
STB,"Cổ phiếu Sacombank tăng trần liên tiếp, chủ tịch Dương Công Minh có thêm hàng trăm tỷ đồng - CafeF","Cổ phiếu Sacombank tăng trần liên tiếp, chủ tịch Dương Công Minh có thêm hàng trăm tỷ đồng  CafeF","Tue, 23 Dec 2025 08:00:00 GMT",https://news.google.com/rss/articles/CBMiyAFBVV95cUxPWGFMVkh5bzF3eTYyUloxci1TVU1NNEx1b1dnbjRPSGk0Mlp1V1V4ZmtuSHRxY2k4S29ISzgwa296WUVtdTlCYjc0TTEyU3VRMTc0T2N0Y2JpbHF1bm1NMWptSkRVQ0J5NWYyWlhNU2t2QzhscHdsVF9rR1BUVWwtdTZYa0dBaFIzWTVOQmVhZ1hhTmVfbnA2RmR6MUlwd016bXZ2ZDRPM0NPSDJTYmFVcGtoYkJYcnc4MHJQQkxuRlVrVHlaNXl5TQ?oc=5&hl=en-US&gl=US&ceid=US:en,CafeF
STB,"Cổ phiếu Sacombank kịch trần, bất ngờ ở mã LPB khi chủ tịch Thụy từ chức - Tuổi Trẻ","Cổ phiếu Sacombank kịch trần, bất ngờ ở mã LPB khi chủ tịch Thụy từ chức  Tuổi Trẻ","Tue, 23 Dec 2025 08:00:00 GMT",https://news.google.com/rss/articles/CBMisgFBVV95cUxNTFpfdEc2N3ZFUXN1eG1sci04ZjRBLVNMTUtIb3VLVFhEZ2I2NXkteC1hVnoxdHVHRHBMa2c1b1ZsREpYYkFXclNES0Z0dE9YUUZKYVlaazk1YlMzRWxHMnFUQk55UW9sOTZiaGQ5anc0cUlYYnhBR3JyOU1HZTZsWEloa0VKa05MQTRkZXVOX2RrOW5wUUpORlc1aWFIYWpRZzZTRlN3MTkxeDRUbWRxOUhR?oc=5&hl=en-US&gl=US&ceid=US:en,Tuổi Trẻ
STB,"Một số cổ phiếu đáng chú ý ngày 16/1: KDH, STB, HSG - thuonghieucongluan.com.vn","Một số cổ phiếu đáng chú ý ngày 16/1: KDH, STB, HSG  thuonghieucongluan.com.vn","Fri, 16 Jan 2026 08:00:00 GMT",https://news.google.com/rss/articles/CBMimwFBVV95cUxQZi13ZWRuS09fbTRmZjRyc0NiWFNrNVg4bWxscWxoSkNuMWZPWG4ybVlKdWlhbkoxTEpOSm15ejE4TkhSa1lrQlZwcjZmSWFCYmcyYk1DUEVmcHJFSHJXTzllQUxXY2RsZFQ5TFBfdFVCMFhxc3ZLYUlLNkJXV3NUOHdJNF9Ld0RvZGpEVFJETTgwNlh2RUpHdFlvWQ?oc=5&hl=en-US&gl=US&ceid=US:en,thuonghieucongluan.com.vn
STB,"Ngân hàng Sacombank (STB): Tự tin lãi năm nay tăng 15%, lên kế hoạch chia cổ tức - Tạp chí Công Thương","Ngân hàng Sacombank (STB): Tự tin lãi năm nay tăng 15%, lên kế hoạch chia cổ tức  Tạp chí Công Thương","Mon, 28 Apr 2025 07:00:00 GMT",https://news.google.com/rss/articles/CBMitgFBVV95cUxOM29lOUhsYjZsT21hWkJYSk45RWtiMXJjdmRBWWRxaloxbGRkcmVfRzhmS24tdzhuR0lfNDRhMkZfVFhaa3JMaUVIQjF4VGFyUFFwRFlHRDd2eE56T1E3VU1qal9uSTBOdVlUalIwTW9PUHJlWEJLRG5LQkx4cmc2SzVxbVhvcVFzVUFIb1d5YWFtTjVsT040R0R4NjNBcDJwZVlRb3UtVkZyTEEyR0VvZDR6TTI5UQ?oc=5&hl=en-US&gl=US&ceid=US:en,Tạp chí Công Thương
STB,"ĐHCĐ Sacombank (STB): Ngân hàng đang trình xử lý 32,5% cổ phiếu ông Trầm Bê, sẽ không mua lại Chứng khoán SBS - Tin nhanh chứng khoán","ĐHCĐ Sacombank (STB): Ngân hàng đang trình xử lý 32,5% cổ phiếu ông Trầm Bê, sẽ không mua lại Chứng khoán SBS  Tin nhanh chứng khoán","Thu, 24 Apr 2025 07:00:00 GMT",https://news.google.com/rss/articles/CBMi6AFBVV95cUxPMC0teDVpaHlhTnk0UXZEbXBvZWpfdlc3MUN6RWZUT1BBYWdxZGk1RExPWmpmWml0Z1dNR1hzVU5kQzdnejFRVEpLVXpuZjgzelM2dWZBeG1OckZUMTBEbjItWTIwR0ZMelFBVS1TXzRHeDhZNHlod0pZNFJqYi00blNvMHVGRGNNQVBzSFZFWmdGRjlZUHRkOWtNRm1pa2tSV19fZEctRXJSNDJfbk9odUdtUFNGSW1wUHVObWhwRWs5SXloVjlsVWxmYkw2cXZfekdQS2x1eWpqVl9RRHlmbjhCNE5iUkI10gHkAUFVX3lxTE1tY0hYZ040dTBJaUM0X2VlOHBYRDBZN3R0bDdKalB4V0ZoNE1Kc2x2R0FrQk55N003OENPTnQwOXd3Z3ZFa1MzVktacjZORGJ6ZW9uQTlkWVphU3VsNW9yU1JJV0VKdEd6d1hISzBBWm5HaUhJVXZEc29wV21Tb2x1LVYtMWwxRFJSZ0JyUVJ0MVdFM1RXNzl2cXNYOF80Z002VzlfakFFcExNS09VMkJnTF9QRS1oXzA5NnhyRi1ycDRjbUFoZFJYMHJFWVA5UDJrUGloaHE4U1c5LTI0V2FIeERDRA?oc=5&hl=en-US&gl=US&ceid=US:en,Tin nhanh chứng khoán
STB,Vì sao Ngân hàng Sacombank (STB) chưa thể chính thức hoàn tất Đề án tái cơ cấu? - Tạp chí Công Thương,Vì sao Ngân hàng Sacombank (STB) chưa thể chính thức hoàn tất Đề án tái cơ cấu?  Tạp chí Công Thương,"Fri, 06 Sep 2024 07:00:00 GMT",https://news.google.com/rss/articles/CBMiuAFBVV95cUxOY0dtNFhhS0N0bkFXMnZjbTNieUIyWTBTWXYxWmxSV1JxQVBTazU5SWZzQmlvZWROWUhKVXNsVkR6ZkZ4TUZ1d2hZaVRISDBPV3pxZUcxQlViWHJDRWdBMlcxM3lIUmpXOE9NQmg3dWpfeHdRX2x0dl9VSnBUNjRpcE5YN2d0SWxRTzduVWtDOFhXWGNkOVZPV3ZOOThVQlloeVprUlZKcC1FN2dWSDd1TXZDYVZxcVlC?oc=5&hl=en-US&gl=US&ceid=US:en,Tạp chí Công Thương
STB,"“Cầm vàng lại để vàng rơi”, PYN Elite lỡ “chuyến tàu” cổ phiếu STB - CafeF","“Cầm vàng lại để vàng rơi”, PYN Elite lỡ “chuyến tàu” cổ phiếu STB  CafeF","Wed, 24 Dec 2025 08:00:00 GMT",https://news.google.com/rss/articles/CBMiowFBVV95cUxQUVk5eTlpTTBnTGNfcGZQTVVVMEZmaFlsVWFzamJXQXBwS1QzM0luTWRBNVczbDR1YkNYUF9rTzk4bnJReV95aXIzdVp6dFU1aFo0WkhJR2t1NEtjeHFwdHh6dFdYdlYwVXNGVFdPOG5qNkJCeGY5a2w4S18zYk4zbDV5RXdrci1fMGJTODF3TVhFMWg5NUlFQU9wYWhaek9zRkh3?oc=5&hl=en-US&gl=US&ceid=US:en,CafeF
STB,Ngân hàng Sacombank (STB) có thể thu hơn 3.100 tỷ đồng từ bán KCN Phong Phú trong năm nay - Tạp chí Công Thương,Ngân hàng Sacombank (STB) có thể thu hơn 3.100 tỷ đồng từ bán KCN Phong Phú trong năm nay  Tạp chí Công Thương,"Sat, 14 Jun 2025 07:00:00 GMT",https://news.google.com/rss/articles/CBMixwFBVV95cUxOUG40cHJBX0xFS0JDb0hXUVdQYXBUVzlFSTJ4X25nZU1SYWlkU1kwQXpqMTBlMHNmTWhZWlltQ2xSMFR2b1ROdVY0eWJsQVUwRy03anhjM1F1UEVPNjh1VjRGMEJQV3VOT0Z5MGx3WldRVzl0eE44d3c1U0J0dXZqMmk4WVg4aEd2eFZmbmNnMHU0Z1ROUkdWQTJfSlZzc2tOb1Z5NDA0dUJOdElmbDdqSFV0MWNBdWFCTVNjV2RvTkZ2UTU4akVB?oc=5&hl=en-US&gl=US&ceid=US:en,Tạp chí Công Thương
STB,"Cập nhật cổ phiếu STB - Cần động lực tăng giá trong ngắn hạn, duy trì khuyến nghị Tăng tỷ trọng - dautucophieu.net","Cập nhật cổ phiếu STB - Cần động lực tăng giá trong ngắn hạn, duy trì khuyến nghị Tăng tỷ trọng  dautucophieu.net","Tue, 06 Jan 2026 08:00:00 GMT",https://news.google.com/rss/articles/CBMiugFBVV95cUxNSS1HRDBJQW0tQno2SUxCU0pUbUlPU2x2a0JmN2d1c3BMNWJYSUxGd0tyUm9sTGp3V0RBQ25EUmNRX3hNMVdjYVZWSVJ0SXdCNjR2Z0k4TzFPNmJkVGpRTlhDejczQk1Sd2prbmZVVEEzVFR0WFExaXA0enhWbE82cm5RWFZGM0pMbGVTN0VMcFpHb0xXc1lRS05QaGZrNmx2cWxVWU1CcjNwdWZHR2NQajU0SGRqTVVoZ2c?oc=5&hl=en-US&gl=US&ceid=US:en,dautucophieu.net
STB,"STB bất ngờ 'trần cứng', dư mua gần 9 triệu cổ phiếu - VietnamFinance","STB bất ngờ 'trần cứng', dư mua gần 9 triệu cổ phiếu  VietnamFinance","Mon, 22 Dec 2025 08:00:00 GMT",https://news.google.com/rss/articles/CBMikgFBVV95cUxNc3ZNdWltWlliYUJGTFFBV0hoTXhRQ3F5UWJhZ2d5UEVMYkFvWkcySWtXR2R6bm9sZXktUHlFRDRxWGxIREJjYVhaa0xkcGV6NVRuZ2tiNUJsNUJRSWpiaDdJVlA3eUl6cTA4UWN4eVNtMjdQa09DSUdUeWx3eHJ4VjJiWDF4Q1U2MjlrTVF4N2V4dw?oc=5&hl=en-US&gl=US&ceid=US:en,VietnamFinance
STB,"Sacombank (STB): 4 cổ đông tổ chức nắm 10,88% cổ phần của Ngân hàng - Tin nhanh chứng khoán","Sacombank (STB): 4 cổ đông tổ chức nắm 10,88% cổ phần của Ngân hàng  Tin nhanh chứng khoán","Wed, 04 Dec 2024 08:00:00 GMT",https://news.google.com/rss/articles/CBMisgFBVV95cUxOaWlvQU82dXV3QXdrWHVKOXlseWVBOVZEbWNNb2lOWTM0Q2pacTZlME16SXlHR2ZFb0UybmJxUllFWjY3OGhNYzhMTlZQa2NCcnM4VU40cDdLcWdqVmY2RVBMdXM4QmZtdXFvMmFIUDJqN0h2c0tkVG4ycjJxVHQxajZNaFZvZmRBSWkxM010T1UzcHliV0NzeVl0R0F2dHRqUi1KWVNnbzM5SVhSWXRobkFn0gGuAUFVX3lxTFBSa3l6bENCZ1JHTUhlcjhfWjd4N3hxSFd1cTBoMDgyR2gxQ1ZXQm9WeUZnRGo5blRybU5sN3FjUFdoNlk2QVAxdGpUbEoyVllUMXJmZjRCXzBiNDh0RG9XYnR3WGFTZ2NGV011WkNyX0dQRmJtQm1VSllZbFdhblZneHdqUUU1U1k0YXE3ZjJybFFabEZRVHhCVkVMdl9QbGtmTG5ZUFRWV2hia1BNQQ?oc=5&hl=en-US&gl=US&ceid=US:en,Tin nhanh chứng khoán
STB,Cổ phiếu STB: Vì sao không chia cổ tức năm 2025? - 24HMoney,Cổ phiếu STB: Vì sao không chia cổ tức năm 2025?  24HMoney,"Sun, 09 Feb 2025 08:00:00 GMT",https://news.google.com/rss/articles/CBMikgFBVV95cUxPUi1PVXVoZG9RdjlVbS1jXy1QWmJjODE4djRmcC1ESzFKc1hLbHNaRlZFOW52THhNLTFHOUFxTXZ4T2xkcU94cHYxUm5mZVAzQi05ak9aSnkxR0JJNFRtQ1Q0dkNGZWlDcUlELTZwandoN3k5eW1TY18tOEgtdEFEaldyOFg5OW1IZ0pheDNJZXUydw?oc=5&hl=en-US&gl=US&ceid=US:en,24HMoney
STB,Pyn Elite Fund không còn là cổ đông lớn của Sacombank ngay trước khi cổ phiếu tăng trần 2 phiên - CafeF,Pyn Elite Fund không còn là cổ đông lớn của Sacombank ngay trước khi cổ phiếu tăng trần 2 phiên  CafeF,"Tue, 23 Dec 2025 08:00:00 GMT",https://news.google.com/rss/articles/CBMi0AFBVV95cUxQTk10Mlcyd2JvS3dzY19ZSEhlUmFsbXh1WHNKWlQ5SVI4d1NkN0xZZzdKZXdUdWE5QXc5ZENPX0pQMjdQZlluaEkyNmhPLVBzT0oyS0RWYmk5b05uWjBiWXd6UDRiR1U1bDFybjFVN2Vvck5XazNXQnVJQkZPQi1haERlTzJLSFFLRW12T2YtY2cwQWxQZk94VnJmcmI0UFpwM1d1MU1QWS1FY1A4Nmc3a19fMEQyeGZhUHNTVzNsRlBDZE5keFNKU0dFZnIyeUlQ?oc=5&hl=en-US&gl=US&ceid=US:en,CafeF
STB,Nhóm quỹ Dragon Capital không còn là cổ đông sở hữu từ 1% vốn trở lên của STB - VnEconomy,Nhóm quỹ Dragon Capital không còn là cổ đông sở hữu từ 1% vốn trở lên của STB  VnEconomy,"Wed, 08 Oct 2025 07:00:00 GMT",https://news.google.com/rss/articles/CBMiowFBVV95cUxQYmhmdk9SM1dlcDB4WlBTZUJVQnpZWEt1ZDdSZHRUWVh4QXVxRjdTSmZqZW1UZm1CMUlRaWV0YUhORE9VU2RXZ0pkdTN5N1ZiOUhmSVhyaWc4bmp6eFc2MFFwbEJQdlJpUkROMW82OVVoS3htbkpSS3ZkZGdHWW96a1NRTWlFZDF0TFVtcVJ6cnMwT2RTWGRZRF84N2pOcFAzVzdN?oc=5&hl=en-US&gl=US&ceid=US:en,VnEconomy
STB,Sacombank (STB): Sức hút từ năng lực kinh doanh - Tin nhanh chứng khoán,Sacombank (STB): Sức hút từ năng lực kinh doanh  Tin nhanh chứng khoán,"Fri, 04 Jul 2025 07:00:00 GMT",https://news.google.com/rss/articles/CBMimgFBVV95cUxOb01XeG1EcFM5bUFIWE1Da08wS0VGUGdKanY5bGN6d3NodXNLakFXUnhselhoWmlHcWdXQUtzci1sbmxzblFMNlZOOHNhM0FZVDNzRGhZaE9VNFlWZ2pmanJXMXFRVi1iWjBkYkZoYXFLX21vZmFkZ2dsQXUzZ0wyLVIzdm85TWtkc1N3c1FyRm9wNDVmdzgxOEN30gGWAUFVX3lxTE45bHpxQVZzMWpZcndFaGJ2UmNjbk52V0p3MmRSUHdDWDdzMEdPcVp4OTl5VFBNVkYxeGtpM0ExTldnNkw3d0F4NmNSTzlHY3o4R2kta3JMWGRTRlVleDNENlFMdWk4LW5oREZhbElqUmpwb0RKYlpXU3A5S256VmE5WDVvblBTbmgyQUdIWUpDaWNxc3Nxdw?oc=5&hl=en-US&gl=US&ceid=US:en,Tin nhanh chứng khoán
STB,"Cập nhật cổ phiếu STB – Quá trình tái cấu trúc gần hoàn tất, khuyến nghị Mua vào - dautucophieu.net","Cập nhật cổ phiếu STB – Quá trình tái cấu trúc gần hoàn tất, khuyến nghị Mua vào  dautucophieu.net","Wed, 27 Nov 2024 08:00:00 GMT",https://news.google.com/rss/articles/CBMipgFBVV95cUxQVVBabE12dV9YcUVfOUxzeGZUTHk2SF9QWi0zNXJVMFhyMGRITXRIWGFjaVpGQU9JeFBGdHJpNTlOQWpCWWRUZGVNQ0ktSTNHV3NwYllpOUFmSU9FY0JFMmxZMEpSTVhKT1lFeWVxN2N3V3g5RmRuc3RPdXprWkpCMkViZUR4cVJyTUxScHFWVVUwc0JWMVBBOWlUZXJyLVlHX0N3TjRR?oc=5&hl=en-US&gl=US&ceid=US:en,dautucophieu.net
STB,"Cổ phiếu Sacombank (STB) và cổ phiếu Thế Giới Di Động (MWG) bị bán tháo, VN-Index giảm hơn 2 điểm - CafeF","Cổ phiếu Sacombank (STB) và cổ phiếu Thế Giới Di Động (MWG) bị bán tháo, VN-Index giảm hơn 2 điểm  CafeF","Mon, 11 Nov 2024 08:00:00 GMT",https://news.google.com/rss/articles/CBMizAFBVV95cUxPa1BNZ29VbnV6U0QtOTlUSFZ0MWp6R1BrWk5MZl9CU0wxMnZKVngtTDQwX0pibHJOaFZVWXoyeXdxYXc3Z0F4dHVyZ1N4S21qbDZxZHZPcTZXNmE0MGpBVmd2Ukc4cHdkNWpMVHFZb2UzRE9lUlA2ZUxqU0NvQnk5SUdWSGd0cm13UHN2SG9IUVk0OUVQMW5ZcUtVVThiNjlpaVZiOS10UHJwckU2dkVhZEdWLW9UcE1RMGRHRjlDT09JWDZlQjNTc3RiNVI?oc=5&hl=en-US&gl=US&ceid=US:en,CafeF
STB,"Sáng 25/2: Loạt mã ngân hàng tăng mạnh, cổ phiếu Sacombank trần cứng sau thông tin đổi tên - CafeF","Sáng 25/2: Loạt mã ngân hàng tăng mạnh, cổ phiếu Sacombank trần cứng sau thông tin đổi tên  CafeF","Wed, 25 Feb 2026 08:00:00 GMT",https://news.google.com/rss/articles/CBMixwFBVV95cUxPcWZNUEZ6VHplNTMzTjFYUkc2c0hOR2hRWndqbzhtcWdGMmsxX1pSTHRXVUxqeHNlTlAxMDVQcGNTc0JSejVaeUxmd3JyTTNLTmFsYXBaZlRZQnpURlBnRFJZNzl6eS1qQnNTVkQwNTNDdXhqc2xBZmROTkVTR3lhd1JtNnR4NUNVZmZTZE9ZQ2tuRGIxTVBsbWxndHdFVk8xQ0UySDVPeGJQX1FxeG9qN1haMnVNdWpERHZsVGl5ZFVTMVBrMS0w?oc=5&hl=en-US&gl=US&ceid=US:en,CafeF
STB,Cổ đông Sacombank (STB) có sớm được nhận cổ tức? - Tin nhanh chứng khoán,Cổ đông Sacombank (STB) có sớm được nhận cổ tức?  Tin nhanh chứng khoán,"Thu, 24 Apr 2025 07:00:00 GMT",https://news.google.com/rss/articles/CBMimwFBVV95cUxQOWtnY09CQ3VvOFF2eGpwRE9rNmQ5R1BmRlYyVXlwaXplTE02cVFJWU5kaWNESVpWSlpnSjlHa1BJdXRmQlRVWTU5ZDBFZ2xEaVFuTmlzd0ZJdVREOTFjMURJUXA5aVAzd0pjY3dieDl5bDY0am1Xd2RzZlpMdktDc240SE1LX1hPOEFMck54SEFfU2ZST0RfWmpCZ9IBlwFBVV95cUxOcExja29LajNyeE42TV9DSUs5aF9TUXdCUnpBMFFZMFE1dDhlNjA4eWprRUZJbFlTZmFyUTVXYkR6SVZud0lPbW9Oa21MVmswSG5JUHdhRWRLUXppM29LSm5zamk0MXc2cnBDM2ZuZUtQNHlHRERxLW1hbmVNSkJHeG5sdGlEdy1yZHZFOVR2V3hQRzFzcW5r?oc=5&hl=en-US&gl=US&ceid=US:en,Tin nhanh chứng khoán
STB,Ai đang nắm quyền chi phối Sacombank? - Znews,Ai đang nắm quyền chi phối Sacombank?  Znews,"Wed, 24 Dec 2025 08:00:00 GMT",https://news.google.com/rss/articles/CBMiekFVX3lxTE9fVERkQ2hXX3h4aVk1R2w2X1lrZmFhTmxqTWFPMFVTSFlxa05PVHhRb08tM2JQYkNtNzhic1kySUpqeExLb1E2a1lBZDZlbV9ZWnI3ZTM3dTdpaTNyMnk1YklGYWhWQlEzZDNLeVpQMFZzUkhoNXFGT0JR?oc=5&hl=en-US&gl=US&ceid=US:en,Znews
STB,"Ngân hàng Sacombank (STB): Có hơn 25.000 tỷ đồng lợi nhuận để lại, sẵn sàng chia cổ tức ngay khi được duyệt - Tạp chí Công Thương","Ngân hàng Sacombank (STB): Có hơn 25.000 tỷ đồng lợi nhuận để lại, sẵn sàng chia cổ tức ngay khi được duyệt  Tạp chí Công Thương","Fri, 18 Apr 2025 07:00:00 GMT",https://news.google.com/rss/articles/CBMi3AFBVV95cUxPdlN4aWpnWUh2aVJHcUJtcUlDcUM2MlFzWkt2b2I5QTNDbVhEWDZkblJlczhieFJueWhPRFNweVRuSFozb3lHb1NVRVp1QXV6OHUtSW9Na0ZTZE1iQnFQQlRZd2JkNkpxd0oxWEZmSXVGb2dLWmZFbktBeWRCS3BoZDc3X00yOC0zS0syMUZhNjMxcU1peGdoNzNNVWVxQkdHMDdBV2JHbHNScEFLXzgzXzMwa3Nib245YXAtX0NvRGYwaXhGazNfbFZVajNuSF9ZVDdoVGtDeFVEWUNK?oc=5&hl=en-US&gl=US&ceid=US:en,Tạp chí Công Thương
STB,Lộ diện thêm quỹ ngoại sở hữu lượng lớn cổ phiếu Sacombank - CafeF,Lộ diện thêm quỹ ngoại sở hữu lượng lớn cổ phiếu Sacombank  CafeF,"Wed, 15 Jan 2025 08:00:00 GMT",https://news.google.com/rss/articles/CBMinwFBVV95cUxQbHFVbldLSmE1VksxQUdGdUhzd1hnZ2hWU2ZSNjVVNmNpd0FNSTgtbjVWVW1HekQ0ZjVNQ25WNkZZd1A1T19jTjJjZC11dkNfQkVTR1ZPY0ROeVBqeXB2SHVhVmI0Ui1OWXo2cXVscmptZTJsbmJZNm80c0h5OWRQR1pfemM2S2VSc3cxZ0N5X0kySTZFVlZLUzhmbTBzc3c?oc=5&hl=en-US&gl=US&ceid=US:en,CafeF
