ticker,title,desc,date_raw,url,source
STB,"Tiền bắt đáy ồ ạt đổ vào, loạt cổ phiếu ngân hàng bật tăng mạnh: STB và MBB tím trần, ACB, CTG, VCB hồi phục ấn tượng - CafeF","Tiền bắt đáy ồ ạt đổ vào, loạt cổ phiếu ngân hàng bật tăng mạnh: STB và MBB tím trần, ACB, CTG, VCB hồi phục ấn tượng  CafeF","Tue, 10 Mar 2026 07:00:00 GMT",https://news.google.com/rss/articles/CBMi5wFBVV95cUxPR1hxVl9rZXo5d3o4djBZUDdkQUE2SGFaUVk1a3Bzdmc0ZWdqY3RwVkJ4N1c1SG9SU2k1SVhFSEFpa1VDQ0l3MjFJNEg3X1o5UDZhTW9QZXJUMkZHaWgwVk5jeWJvMGpMdWRZR21UY0kzNnhYN2NLdzJUMDNXWFc0b2MyclBLY0hfOFRDVGU5bGVHaWhrcUk1WC1BcWF1UlM0d0xodWxUeUo1U3FXaFBoY1EzeXoyWUFTX0NBUFVoV0hjNGFkTXRwbHdHTllhejMzZ1Y5QVVSbUNhM0JFU0NBMXhWRUZSWDQ?oc=5&hl=en-US&gl=US&ceid=US:en,CafeF
STB,Săn cơ hội ở cổ phiếu có câu chuyện riêng - Tin nhanh chứng khoán,Săn cơ hội ở cổ phiếu có câu chuyện riêng  Tin nhanh chứng khoán,"Tue, 30 Dec 2025 08:00:00 GMT",https://news.google.com/rss/articles/CBMilgFBVV95cUxQVzIxNVdla0NFODdaLXcyZmlsMFhFbXVVeDFxd1REVmthcGYtTFNuUzd3VTJ0enVrVW9NeFJUZnF6U1Q5d1U2TmpnX2owTldIRDFORURrRW5KU0N1ZC1UUHQ4OVRUWDRSZFkyR0RwVWpZQ3pydXVIZ0tYbDU2NXBtaFduWGQta3pfUE44NWFlRmViX2pvT2fSAZIBQVVfeXFMUGVrY0c0cEk0M1RCaFk4Mk8tck9adUMwTHdfUHY0NTE3ZVJzcy1aNFd4YUNYQlFOeUt1LUNyQlVoZVlIMGdaMWVWX2lxaVpQMm02NTdocnpLVzNaRFJmMW9DR3RPM0FVYTNrb21xdXhYZGJxa29keW0zOVdnazNnSllkR1h3dGZmZHFNOHZTWEtDZ0E?oc=5&hl=en-US&gl=US&ceid=US:en,Tin nhanh chứng khoán
STB,Quỹ từ Trung Quốc nắm bao nhiêu cổ phiếu Sacombank? - Tuổi Trẻ,Quỹ từ Trung Quốc nắm bao nhiêu cổ phiếu Sacombank?  Tuổi Trẻ,"Wed, 04 Dec 2024 08:00:00 GMT",https://news.google.com/rss/articles/CBMilgFBVV95cUxOckhqMjZFOWowU3ZuM0lQbVJ2clE0WEZzcjU0TDIta2FPMkdnQnlJb0ZFQXNpakpPWlJGajdTanJzV0w0T3lhdmdhNXBIXzB0dEVxZ0tpV3VGNHhnREI2NGNBNGMtMnhJN0hoOUF6ME5NaWstXzFVNndCZG42M2diVzBfamRyYllVcVlRaV9EYmpDNEw0NEE?oc=5&hl=en-US&gl=US&ceid=US:en,Tuổi Trẻ
STB,"Cổ phiếu STB lập đỉnh, ai đang hưởng lợi? - 24HMoney","Cổ phiếu STB lập đỉnh, ai đang hưởng lợi?  24HMoney","Thu, 22 Jan 2026 08:00:00 GMT",https://news.google.com/rss/articles/CBMihwFBVV95cUxQUnkya2ptUHptZUlzSWRtMTNwWEw0M1pGZ2hJX2lZZmpRMWg4aE5PTHhWU0c1aWUtTGt4bVNFVkh2Q2x0YVZBWm9ETzd3ck5lQlJWelJwV3dCbGZYOWpSaldEaEtRSDBsWndsQ2NZYnFZbE43a2hNZGdGNkJNX1VPOUNfVnFmOFk?oc=5&hl=en-US&gl=US&ceid=US:en,24HMoney
STB,Cổ phiếu Sacombank bất ngờ tăng trần sau tâm thư của CEO Nguyễn Đức Thạch Diễm - CafeF,Cổ phiếu Sacombank bất ngờ tăng trần sau tâm thư của CEO Nguyễn Đức Thạch Diễm  CafeF,"Wed, 21 May 2025 07:00:00 GMT",https://news.google.com/rss/articles/CBMiugFBVV95cUxQSHlGTmc3VVAtYnp6ZEFTYXRrV0c4a3RkM2ZtRTVXUUlmZEY2SXZtQ3psaHZuTHNrSW81UDlQMFlRTmZTTEVFdkNIVnZYVjBHMUtfMWxncFFfcmZPcFlaOC1uSHI5Qm5Ud3lDWEVjcEhhbkVrMjNuTjV2aTFHdTVpUkhyYzNHM2FoaEtpczZVNVJQNTRXRUh5SFFoU1ZZUTZfZjVMUkptWWdscGx2UDYzc2xmc0FXV0FYVXc?oc=5&hl=en-US&gl=US&ceid=US:en,CafeF
STB,"Một số cổ phiếu đáng chú ý ngày 24/12: MWG, STB, FRT - thuonghieucongluan.com.vn","Một số cổ phiếu đáng chú ý ngày 24/12: MWG, STB, FRT  thuonghieucongluan.com.vn","Wed, 24 Dec 2025 08:00:00 GMT",https://news.google.com/rss/articles/CBMinAFBVV95cUxNTkdyYlEwekFCcElFUG9HZVVFYUd1T1gxb3BxWnV0UkZ0S0txa0ZVVnlpQ3RNRTA0aFhOSEx2SmMwTHZCalJ0WWVRazJsSEpnVUVBZDJEX1lMSmJYQktOSU5BQW9DSUx3Tmt1X3lPTGdWMVFCZElQR1dQYWJ1dXpCSG1xWlJfempFUmNxWnBwWmlPd1dPRFhfdTFOVWU?oc=5&hl=en-US&gl=US&ceid=US:en,thuonghieucongluan.com.vn
STB,Tâm điểm chú ý đổ dồn vào cổ phiếu Sacombank - CafeF,Tâm điểm chú ý đổ dồn vào cổ phiếu Sacombank  CafeF,"Wed, 25 Feb 2026 08:00:00 GMT",https://news.google.com/rss/articles/CBMijAFBVV95cUxOLVV4M0VibF9uTmxxbTdWUm12d042bktNamFjMWkxRFBiYlEwaWRQaTdJYzNtMWZDUW1WenNKcDZ3ZHFXS3c3QW9mVWZ2T19faHNwaE04MHJESUsta3NyaFFrVVBtS01XcGxnM2ZjbHdIcEhsRDZHcVYxTnRwQ2xxcGpfQUk1Mlc3dENhdg?oc=5&hl=en-US&gl=US&ceid=US:en,CafeF
STB,Cú trượt quý IV/2025 của Sacombank: Cổ phiếu giảm sâu vì áp lực rủi ro - 24HMoney,Cú trượt quý IV/2025 của Sacombank: Cổ phiếu giảm sâu vì áp lực rủi ro  24HMoney,"Wed, 07 Jan 2026 08:00:00 GMT",https://news.google.com/rss/articles/CBMirwFBVV95cUxPdWsxTXpkZUFZaW5IeWlHS0E1WG1VTFhXNWdEZGNjVTFIRTRhTXRGV3pva2xnNnF2anVYaDl0YzNwa1k4eHE5bjM5aHFqZTd1ZGhrTG1mNWlJT25iMkd5M2JuYlZpWDdOUnFmWm8xTWphcnpKRjVuTzNobl9CMFYzN0ZnLXBmMWlWT3Y2S21SYTJ1bXY0d1RKRFhxOTlTTkxGY3gtVFc2UWR6MjRaem9V?oc=5&hl=en-US&gl=US&ceid=US:en,24HMoney
STB,"[VIDEO] Cổ phiếu STB, tiềm năng lớn? - 24HMoney","[VIDEO] Cổ phiếu STB, tiềm năng lớn?  24HMoney","Thu, 22 Jan 2026 08:00:00 GMT",https://news.google.com/rss/articles/CBMif0FVX3lxTE1sQ29UbEhMX1NJWGs2el9vNjU0ZFJoUjBTcXhxd1RjbDJTZV9QcUxwblhyRmgtZ1U2QUdOU19wN3lLUmVEWUpDb1paTjFsN3JQZTNDT29fQ3Zkd3M0TEJwY0dTSE1Xa0pqSXN6cmNUaU1vWlNOTEUyazhjbDZRVVU?oc=5&hl=en-US&gl=US&ceid=US:en,24HMoney
STB,Dấu ấn tái cấu trúc của Sacombank năm 2025 - Mekong ASEAN,Dấu ấn tái cấu trúc của Sacombank năm 2025  Mekong ASEAN,"Fri, 17 Oct 2025 07:00:00 GMT",https://news.google.com/rss/articles/CBMiggFBVV95cUxPWkkyUEFmWHBKWElCWDV5ZnR0MHhMSU5aNWdMV2xqS2ZYOEdpSWo5bTh5Vmt3czBMcC16RW10Y2FqRXcxUWJqRkZKcGtGcDFwT2RCb2lnbzNHVjVEV2d4X0xJamFpaWJRUUFxbFhoY1lJY3c0a01XR3pSWnZUTk0tMjl3?oc=5&hl=en-US&gl=US&ceid=US:en,Mekong ASEAN
STB,"Chứng khoán tuần qua: Một cổ phiếu bluechips bị khối ngoại bán tháo hơn 5.400 tỷ đồng, cổ phiếu Sacombank vượt đỉnh lịch sử - CafeF","Chứng khoán tuần qua: Một cổ phiếu bluechips bị khối ngoại bán tháo hơn 5.400 tỷ đồng, cổ phiếu Sacombank vượt đỉnh lịch sử  CafeF","Sun, 01 Mar 2026 08:00:00 GMT",https://news.google.com/rss/articles/CBMi8gFBVV95cUxQa0UzdkNYb2NtTWNqZ1RFQUc1R0JRVy1nSk0yb2cwaVJxYUZUMllpTzZmQzAzM2lBYlFJZ3Z1aUZoZy1JSG8yT3F3UDRlWmpnSmU4bXpwbDdxSXBOWDVfMGRiQWprTWN2SkJNanlwd3pRLW1Sb1oxZDV6TDVoRGpKT1Rodnl0QjlDdzlUREVXQTlYV1BaLXJuamdLREU2SzRRcXFXWUl6S0gxWTV6ekN2ejdFNUM3bDJFb3BzbllXN3dWbDlHMjBPRElrOWxQMzhuWHhJbWZINjd2ajdQM1VVdmt0V3B1SUVYcXRaekJpVHFCQQ?oc=5&hl=en-US&gl=US&ceid=US:en,CafeF
STB,Cổ phiếu ngân hàng hút vốn trở lại: Đâu là lực đẩy? - Tạp chí Kinh tế Sài Gòn,Cổ phiếu ngân hàng hút vốn trở lại: Đâu là lực đẩy?  Tạp chí Kinh tế Sài Gòn,"Mon, 26 May 2025 07:00:00 GMT",https://news.google.com/rss/articles/CBMiggFBVV95cUxNZXY2c05XemtLdWVaVDA5bGc0QmxFeERYWEFLYl9tck5lc0J1UWRMY0lqbXVBdnUtRDdCOTdXS3Q1ZldHNEV1TUMxNjF1ZkQxWklqUjFzT2RiOV9PaVJaeHRkQmlTRERDbnpXZ3l2WkRQZWVZeGp4SkdfQXpyVnp0Tmx3?oc=5&hl=en-US&gl=US&ceid=US:en,Tạp chí Kinh tế Sài Gòn
STB,"Ông Nguyễn Đức Thụy bất ngờ rời “ghế nóng” LPBank, cổ phiếu STB tiếp tục tăng trần sau tin đổi chủ - baodautu","Ông Nguyễn Đức Thụy bất ngờ rời “ghế nóng” LPBank, cổ phiếu STB tiếp tục tăng trần sau tin đổi chủ  baodautu","Tue, 23 Dec 2025 08:00:00 GMT",https://news.google.com/rss/articles/CBMixwFBVV95cUxOTXQwVjVWQkZEUXpKZHU2NzRmMFl1T0ZOd3R4UFU1QjR2aVJoSU9DZXQ0VFdZQjRDS1h3WmE2VjRkOUpPb3RKZ2paM25rQ1NGeVpOUk0wWi0tU0dJZ1R6UXNGR0tMUUhBU1Byc1B6THlTS2hNQ18tM25hUWlVZ1BKb01hXzhuSnotNElkUUhzUzdFanZrWHFnRWVBMnVhdDU1MGw5U1RMRUhuTmhxRHN6WU44dUtRdk5ScEZNZm1VZFVfdXExcFFR?oc=5&hl=en-US&gl=US&ceid=US:en,baodautu
STB,"Sacombank bất ngờ trình cổ đông kế hoạch chia cổ tức, mua lại công ty chứng khoán - CafeF","Sacombank bất ngờ trình cổ đông kế hoạch chia cổ tức, mua lại công ty chứng khoán  CafeF","Mon, 21 Apr 2025 07:00:00 GMT",https://news.google.com/rss/articles/CBMivAFBVV95cUxNbWJKTjF0dF9VTFZpNVluYS1yRi00dXlSdTlLbHRGYTgyYU51UmFpSUt2LU04UXpMcHZoM2d1dkJiMkZ2Q2NmZ09LZWk1LWhoY3ItSUNzRkdoV2Z0VUNtS1B1dnVmOHVoWVgycmtHVFVNbXpGZVdqNU0xamk3TWZWOGhxZzJUS1RQTVlrZnNaUzhzalpkOU5lc2wxSDgzY0xlam9NUjNmMldPSThqUTB5dGVIQ3R5MXBFMDNISg?oc=5&hl=en-US&gl=US&ceid=US:en,CafeF
STB,"""Ghế nóng"" có chủ mới, thị giá cổ phiếu Sacombank vượt Vietcombank trong chớp mắt sáng 24/12 - CafeF","""Ghế nóng"" có chủ mới, thị giá cổ phiếu Sacombank vượt Vietcombank trong chớp mắt sáng 24/12  CafeF","Wed, 24 Dec 2025 08:00:00 GMT",https://news.google.com/rss/articles/CBMiyAFBVV95cUxQQy1CbHAza1ZfVW1wNmxXeGZoV1JXZEcwdThIZnF0U1Z5c3pkdXpYUDdORG1qLVVDcTRvMjdyNEM1bmx3Q2JJYXZSQU1OdUpyckRpQ09hWlNqVTNOUTNldEFzbUZXc0F2Uk9aS0ptTVJzaUFyamVOejR2VnVCc3NDQlg2bXNnQWI0Z2gyV2xOcjdod3FGQ1IzU2JSMlQ1S0JRTE5oRW1HUEpIdmlXVE9lV21NQVkyY0w5b0lHem9lVy1PQ05DLUNlYQ?oc=5&hl=en-US&gl=US&ceid=US:en,CafeF
STB,Sacombank có thể không chia cổ tức trong năm nay - CafeF,Sacombank có thể không chia cổ tức trong năm nay  CafeF,"Fri, 04 Apr 2025 07:00:00 GMT",https://news.google.com/rss/articles/CBMikgFBVV95cUxNX2I3TDhobWhSUUNicWFSUXVTLUoyYzI2ZlFCQk4ycUJOcnRrMmFzZVdTZmJrVllTbzNPSWhWb0NiNmgyazR3VVJRTnhrLTFYLVFjZkVXTWQ0QS1Ic0ZqOUNzOWFsM21GajlNV19NZGFqQTJNSlBVTGg4ZlY0WFhFYzVvYnJUODRxazZVRTJPMXF4UQ?oc=5&hl=en-US&gl=US&ceid=US:en,CafeF
