ticker,title,desc,date_raw,url,source
VHM,Cổ phiếu Vinhomes nối dài đà tăng bất chấp áp lực bán lớn từ khối ngoại - Thời báo Tài chính Việt Nam,Cổ phiếu Vinhomes nối dài đà tăng bất chấp áp lực bán lớn từ khối ngoại  Thời báo Tài chính Việt Nam,"Fri, 03 Apr 2026 07:00:00 GMT",https://news.google.com/rss/articles/CBMiuAFBVV95cUxQX2dtYnlEWV9Rd2NPZjZSU18tc2hYM1pVSHVkZDRiTGtUZ3p0eHdTSE9OMllKb2ZTeXNQM2JlTlI1LUNQWldOV25ON3pQMkU0U0I2N0c3SGUtbjRNVWFrYmtGNC1uejdLNFJLbDU5cVVwcVowOEd5VHM3bnJ5eHZKWjlnTUQ3Tk45VktzSGpYVllJQ0dqdWg5dVlMRVpPaWRnTEtmbXN2d2NleWh0UmJRcUdiTi1ubkZx?oc=5&hl=en-US&gl=US&ceid=US:en,Thời báo Tài chính Việt Nam
VHM,"Nhà đầu tư ngoại đua mua cổ phiếu VHM, vẫn bán ròng gần 500 tỷ đồng trong phiên 3/3 - Tin nhanh chứng khoán","Nhà đầu tư ngoại đua mua cổ phiếu VHM, vẫn bán ròng gần 500 tỷ đồng trong phiên 3/3  Tin nhanh chứng khoán","Mon, 03 Mar 2025 08:00:00 GMT",https://news.google.com/rss/articles/CBMiywFBVV95cUxNQlhnU0EtZ0daLUNCUEJ6djdJX1Z5VHZTVUFTQjl0cmNKdjRzWUV4NGV1WHk0SG1QaUllRjRzVHJaTjFfclpWOTg2RzJ6Mmk3RHFoeVBQMEVINEpZNUM3a0hhLTlHNU92bVhuemxRb09DSFByNWdlYldFQVBWZy11SnVWenJzSjY5LWVsT0ZyaDhDbmZUXzRIVVgyZ1k5S3JoZ1hCM29XZFVyUlprZUlVdVdNSkctOUtIYThvQjh6aEZBX3FQRnpNY0d1QdIBxwFBVV95cUxQTW51R21kcEFldDI3Ty1rM2VMX0pyMHBqY1hJd0w0dlphS1d0eFhoMEFRNWFMRlQwenlzSkVoUXhCX1RaRGlrLXNKVkhiVWkwSlZHVmR0ZUFTcXRja0p1TGJUUUlsOVBEMWdKVEs4ZWdueVI1MFZCQ1V0WC1VVmhDamdFbmx0YTVRandIeTVqODM2ZjlhZmo5Q1RiQUlQZ3E0ckoydkRRc3dCaVdRWHJ4ZXV5VHFCRHJzOUd6YUNoeDJxMUwtNHNr?oc=5&hl=en-US&gl=US&ceid=US:en,Tin nhanh chứng khoán
VHM,"Một số cổ phiếu đáng chú ý ngày 12/3: VHM, HDG, GEX - thuonghieucongluan.com.vn","Một số cổ phiếu đáng chú ý ngày 12/3: VHM, HDG, GEX  thuonghieucongluan.com.vn","Thu, 12 Mar 2026 07:00:00 GMT",https://news.google.com/rss/articles/CBMimwFBVV95cUxPSU5uQzg2UGc4YlAxTVN0M29xMFljME9aMWxIajA2TzhzX2trd2h5R055aWRaYXdrQ3czX2o3TkVZb1NIUWszSW5DZVVkYnNJMVdVZ0Y1NHpYMWVQVWVpUk5TRTZFVmMyZHpYT2lWRmhRbnZ0VHU3eGlpT0piSVhiRVJEa1d4TERDVlRMblV1S1RNNmNQRjc0U0RzYw?oc=5&hl=en-US&gl=US&ceid=US:en,thuonghieucongluan.com.vn
VHM,"Cổ phiếu VIC, VHM tiếp tục bứt phá, tài sản ông Phạm Nhật Vượng tiến lên gần 14 tỷ USD - Chứng khoán DNSE","Cổ phiếu VIC, VHM tiếp tục bứt phá, tài sản ông Phạm Nhật Vượng tiến lên gần 14 tỷ USD  Chứng khoán DNSE","Tue, 26 Aug 2025 07:00:00 GMT",https://news.google.com/rss/articles/CBMizAFBVV95cUxPaU5tT3NCdG11dkZUUUpHZXFBb3Z3ZGlpa0p4RUhXbmJRRThMVEd1ZlpVVDNLdV9zVmhZbEJkVzd1ZWhySGlOTmhYWnZ0ZzJOTzlzVWFueXphMDQwTWVXZVBVY1Zna2RXQmx3ZGZrOWRuWGF4N0tZZklFR1RmZE4xYU5MMTZENWFzLU9KSldMSzNqTEdzTDhaTFZPcHJ4TkFLallxbDEzU2hvclNQa1BNdm53MERiR254cGcwTTBEXzByaDFyTkp2ZGU3aTk?oc=5&hl=en-US&gl=US&ceid=US:en,Chứng khoán DNSE
VHM,"VHM: Nắm giữ hàng trăm triệu cổ phiếu VHM trước khi niêm yết, cổ đông ngoại lớn nhất đứng sau Vinhomes là ai? - Chi tiết bài viết - Vietcap Trading","VHM: Nắm giữ hàng trăm triệu cổ phiếu VHM trước khi niêm yết, cổ đông ngoại lớn nhất đứng sau Vinhomes là ai? - Chi tiết bài viết  Vietcap Trading","Mon, 21 Oct 2024 07:00:00 GMT",https://news.google.com/rss/articles/CBMi7gFBVV95cUxNQWpMZ2RtV3dZeDdjcHQ4OHc2OThScnQxLWtXSU1zT2loU19TeG1XR3RTeVpFa3FfbFp6U181MzZWWktfYTdfLV9vNVc2b01vVWhROVZ0ZFNhZDNVa3VBbmpOdTh6TzVuQlVjX1lkbHdHNW9iWnhDX0ZiR28zY1BtN1NPczNiS0NMWlpXSTVrT0hOdWFsZ3B6RXZQNGpnTjZFWTZaUkV1VEFkc1FuQUJxR3M2V3JPemRURzJpalZNNlFJb3BHRkxFeXlROE1rU2JCLW93TWtVYUtqR0NQUXJvdDVoekN2LUJTd2RycWJR?oc=5&hl=en-US&gl=US&ceid=US:en,Vietcap Trading
VHM,"Cổ phiếu Vingroup hết giảm sàn, tài sản của tỷ phú Phạm Nhật Vượng ra sao? - Báo VietNamNet","Cổ phiếu Vingroup hết giảm sàn, tài sản của tỷ phú Phạm Nhật Vượng ra sao?  Báo VietNamNet","Fri, 26 Dec 2025 08:00:00 GMT",https://news.google.com/rss/articles/CBMiqwFBVV95cUxQTHI0UHJtaVkwYjBIVkNGTlVZc1p1dHpTb19MUUtEbWlLRUVXVk1uNzJoNFNoUFl5UkhUcjZpYTJ6ZENFS19KTlJFdWZnQVdkbDVoczJLcG5BVTFEOHRyNmdmckNuMkNLWU5tR2RBR2NDc0hBX01BenZKQi1vMnpyNm5UMllQRlA4Qjl1Q0NBbnYwTjF6NWNYc1dtOVRvREdkWGdsaUpJOXZkZFU?oc=5&hl=en-US&gl=US&ceid=US:en,Báo VietNamNet
VHM,Cổ phiếu cần quan tâm ngày 21/5 - Tin nhanh chứng khoán,Cổ phiếu cần quan tâm ngày 21/5  Tin nhanh chứng khoán,"Tue, 20 May 2025 07:00:00 GMT",https://news.google.com/rss/articles/CBMihwFBVV95cUxNUGw4cDhsdG14ZTRpVFlSUUZYQ1F5aXN2cEZkU3F5N0tfTFNSR2hRY3ZrQlBVZVhQT0FNQlVLT205bnk2d0NCSE5MSml1RkJLdWJwS0VESTVXRkZ0WlR2dnNyV2pLNE5DcG5TWW92NHZLSy00M1JZQ3lEaFNjcUlDWTdKQm0tT2vSAYMBQVVfeXFMTjJtUEFkdFpwVWxyQWxZUEt0ODd5WjVib0xDcFo0b0lvY3BUcmRPeDR6UUJxVXR0T09aZFhCczJZLVJ2MnBuRVQ3WlJib3JDRjhyX1YwWmtURVZJNjBwd2g4aEF5QmlxMExSYmxiNlQ0c2J6a2I3UFhoZzR6ZWdJU3VOVlE?oc=5&hl=en-US&gl=US&ceid=US:en,Tin nhanh chứng khoán
VHM,"Cổ phiếu VIC, VHM tăng kịch trần kéo VN-Index nhẹ nhàng vượt 1.240 điểm - Báo Văn Hóa","Cổ phiếu VIC, VHM tăng kịch trần kéo VN-Index nhẹ nhàng vượt 1.240 điểm  Báo Văn Hóa","Mon, 14 Apr 2025 07:00:00 GMT",https://news.google.com/rss/articles/CBMirgFBVV95cUxPN3hVbzVpZmJVTGthQXdobXZpaHBic1NhaklzdUUxdzRkZUdvdmtmMHpBUjhkUjNFMW56TDFKSDA4NEVVSkdhaWZsQjlhS0VhdGVyNENaNUktdFljbU9tcTJjcE5mYkF4UXhWLTctQzExc0xNOGJQU0xwaC1tVDZHd1VZSV9sLUVKYU1ORTFoRW9SUkdjWlhGbmJvQ2tXOTFCZWN6OS1YTmpkZ3E4U3c?oc=5&hl=en-US&gl=US&ceid=US:en,Báo Văn Hóa
VHM,Vinhomes (VHM) được dự báo lãi 35.200 tỷ nhờ có 8 dự án dự kiến mở bán trong năm 2025 - Chứng khoán DNSE,Vinhomes (VHM) được dự báo lãi 35.200 tỷ nhờ có 8 dự án dự kiến mở bán trong năm 2025  Chứng khoán DNSE,"Fri, 23 May 2025 07:00:00 GMT",https://news.google.com/rss/articles/CBMixAFBVV95cUxPb1JDdjdodE9yM0FGSXJNYjFsQXNFdFNobjBkQm5tdXA4bXcxSm9ER0ZRdkpxRnRYWVVTUXE1UGF4MW1kMjRCcnFuNnc4czdtamxvbFV0WGl1ZExPd2FJUXN1NDZZemdVRzRpOGFxSHA5bnl4TnluWWtJcG9za3hVRHIxSDIxWHhnZWRXSUJNRUNQQ0tKTEplVTNVaGZVeWVta0dsVmZVOXpTa2J6RnN2M2FnY1VKWTE0QzRxc0dZUlVtbzBl?oc=5&hl=en-US&gl=US&ceid=US:en,Chứng khoán DNSE
VHM,"Cổ phiếu VHM, VRE, VPL đồng loạt giảm mạnh, điều gì đang diễn ra? - nguoiquansat.vn","Cổ phiếu VHM, VRE, VPL đồng loạt giảm mạnh, điều gì đang diễn ra?  nguoiquansat.vn","Thu, 08 Jan 2026 08:00:00 GMT",https://news.google.com/rss/articles/CBMingFBVV95cUxPVDF0MnZ6WW9UTHdGaEkyaGhpVVBYNmozemFSbHQtZzcwTF9tWEU5Y19QNFdpMGFpSWZBNkxlWWZpRmlHQ3VUVjZrbExEYnlyMXREM0w0emgyS1dUVUVBM2R4NEN3dlZaT1gwektkVGJ5WVd5WVI4RDNpQlZtZ2V6YXZDRDBRWGNjQUZLMHdSeGVCSkNCTW5XTTRaSE92QQ?oc=5&hl=en-US&gl=US&ceid=US:en,nguoiquansat.vn
VHM,Chứng khoán MayBank: VHM hiện là lựa chọn hấp dẫn trong hệ sinh thái Vingroup - Nhadautu.vn,Chứng khoán MayBank: VHM hiện là lựa chọn hấp dẫn trong hệ sinh thái Vingroup  Nhadautu.vn,"Tue, 30 Dec 2025 08:00:00 GMT",https://news.google.com/rss/articles/CBMirgFBVV95cUxNbzlDcmVHTHdtRU5Cc0tjUGJTREhTUjJyV2hKVURYVk9oMWF6NjExMTFOZHNyUllZOFFBM2JaSC0wcnYyUzJ4VHQ1SnAtdnlRSjBqX0FQaTZqNWk2VURSODVtTlhSUUpid2daN1dDX3FvczdXRkdMUUo0N2pZWGZEbGMzeWZLQmd3SC14S3c1NkpxLS1scm80NUVYSWpvdHFYRDdiQWxfQ0dlMWxfWXc?oc=5&hl=en-US&gl=US&ceid=US:en,Nhadautu.vn
VHM,Cập nhật cổ phiếu VHM – Q3/2025: Lợi nhuận từ HĐKD cốt lõi kém do bàn giao thấp - dautucophieu.net,Cập nhật cổ phiếu VHM – Q3/2025: Lợi nhuận từ HĐKD cốt lõi kém do bàn giao thấp  dautucophieu.net,"Tue, 18 Nov 2025 08:00:00 GMT",https://news.google.com/rss/articles/CBMipAFBVV95cUxPWm8zMDhpVFJ5Qm9ucUQ4aVJ6RVptV2UtT1JuWUNGV01Sb2pBRjVoajRvQTkzQ19QdTl0Uk1kWFpsVE51OUFsWkhSUUIxaWxZTXVuX2FjYzd0cmx5dmJETG9BX1RYdHBRVnJINnpxR25tQVNEUWgyNXF1UVZHWmlLbGVPekVNd1BJS1lfUGdZa1RvcEJmWS1JUWhlQWlKSUNhbFFjNw?oc=5&hl=en-US&gl=US&ceid=US:en,dautucophieu.net
VHM,Vinhomes (VHM) cập nhật vốn điều lệ mới sau thương vụ mua lại cổ phiếu quỹ - nguoiquansat.vn,Vinhomes (VHM) cập nhật vốn điều lệ mới sau thương vụ mua lại cổ phiếu quỹ  nguoiquansat.vn,"Wed, 27 Nov 2024 08:00:00 GMT",https://news.google.com/rss/articles/CBMirAFBVV95cUxPb0NBZkVjOXpIUWl2dlNReklObzdHMzVnQnNIRFdrVWlmd1hZemo5NlBXemIyRFVGRzJqODJGVFBnSURUamxNYnpkXy1nNEdUUll3YTJYUjRlRV92TDlWaEdNQm1QSlN0akRac04tbmtKamlneW1fVnZhTC1LUC1XdHZEMTk3dXZvWWxMMUN5cDBQUzZLaXRRSmhkS1J0eFpsU2JkSlI5Ym9jcHVY?oc=5&hl=en-US&gl=US&ceid=US:en,nguoiquansat.vn
VHM,"Cổ phiếu đáng chú ý ngày 20/3: REE, PDR, VHM - nguoiquansat.vn","Cổ phiếu đáng chú ý ngày 20/3: REE, PDR, VHM  nguoiquansat.vn","Thu, 19 Mar 2026 07:00:00 GMT",https://news.google.com/rss/articles/CBMigwFBVV95cUxPOXdFWjJCbkdEbUdvN3lxYkFVbjRwaFdEUWlOYW5xdlA3cnhqcEZmSXhYR3lmVnhDM2pidnBLdXNlYlNOVmtMUUNPQ0ZLUjVtbnI0U3N4Wms5X3ZDcDU0OEtyM3lnai1fdzktQk1kNGRVNTdhU3JQT0Q3QVp6OWJKUW5LQQ?oc=5&hl=en-US&gl=US&ceid=US:en,nguoiquansat.vn
VHM,"Vinhomes muốn chia cổ tức 'khủng', cổ phiếu VHM tăng kịch trần - VietnamFinance","Vinhomes muốn chia cổ tức 'khủng', cổ phiếu VHM tăng kịch trần  VietnamFinance","Wed, 01 Apr 2026 07:00:00 GMT",https://news.google.com/rss/articles/CBMinwFBVV95cUxQV2ZjeHZhdTNBeHhGVGV2UUpRYjRxX0YxQWVHWk90Y0tZX1VlWnJ2R2l1aUhPMTlLTUpLN2VOeUhUbFR6X0sydmJOZS1ybTBhRGs4ZVdEQzZrbXlhMGxtRjBlWGF4UmNnUXNjbno1a1pFTGVKMVI5dzZLWjhjR0QxQ250REtiMmtfZTdMY05ESU5GRDVIUk5icEpzYzlZd2M?oc=5&hl=en-US&gl=US&ceid=US:en,VietnamFinance
VHM,Một số cổ phiếu cần quan tâm ngày 11/3 - VOV,Một số cổ phiếu cần quan tâm ngày 11/3  VOV,"Wed, 11 Mar 2026 07:00:00 GMT",https://news.google.com/rss/articles/CBMihgFBVV95cUxPRGtmNVZaSHlMU3hnejhyYVlOcmdsMnJ0R3JQZW1HbnNJelFvWU1iNEJoN0JUaEdmNUpJZlUwQnUxSmg3TFpTWXBOd1ZsUjZaVVFCOUg1WW1ET2tvN2N2dm9WNmlPczVnZlBCQ0FhY3NVQUV4aUcya0V0VzZuN2JIZTJpSm5UUQ?oc=5&hl=en-US&gl=US&ceid=US:en,VOV
VHM,Giải mã cú hồi của cổ phiếu bất động sản - Tin nhanh chứng khoán,Giải mã cú hồi của cổ phiếu bất động sản  Tin nhanh chứng khoán,"Wed, 01 Apr 2026 05:52:04 GMT",https://news.google.com/rss/articles/CBMilAFBVV95cUxNZGtJR2prX1psYVMxME13QWVsajlJODY0VE1vZW95blJydEFSRnludkFKZVhCY0VHSGU3LTNOOTdGb1RuakREZ2xZeDBqNFRWVXAyV0pfVGxKS1c5WkRZN0h4Z3N0b3VqTXQyQmF4T3Z6RkUtZHJLTzJFaUhEOU9sSGptV0ZOMHVhYlFzS1A4MDgwbTZo0gGQAUFVX3lxTE5wY2FvbFYtWW5Pc21PZklwenJrMW1mblZOOVVKcWVvLURMTmpaeXpsODZmVVZaLTZjRWRIamhucnZmdU4zOTM3MHYyQVA3enR2TmpYUVBvUUVUNWNfeTMxUHRlRDJTRkIwQnNGeTFiV0Y3a1NXQ1I4Y2lsU2lYemd0UThpdS1zWnhkS25pMXVuVw?oc=5&hl=en-US&gl=US&ceid=US:en,Tin nhanh chứng khoán
VHM,"Bộ ba cổ phiếu VIC, VHM, VRE hút dòng tiền từ khối ngoại - diendandoanhnghiep.vn","Bộ ba cổ phiếu VIC, VHM, VRE hút dòng tiền từ khối ngoại  diendandoanhnghiep.vn","Tue, 14 Apr 2026 22:36:41 GMT",https://news.google.com/rss/articles/CBMinwFBVV95cUxPM1BfcnYtd3MyVVRpNUNzcjFxVHZWOGFjaFBWN3JJNmZQYjNIcG5sazFGY0NsTlFYNk9XaERMaEZNZ2cyRWVNVTF3Z0liR0dmcXdxNXAzdkJNSVdpSHp4U3l4amdnZkM3ak5Sb3ZISWRRVGxBV3BWUzRaSWVYeVZBcURjeWkyVXBUaHA3YmM1V24tdS04dTNxZWFpc0ZVRTg?oc=5&hl=en-US&gl=US&ceid=US:en,diendandoanhnghiep.vn
VHM,"Vingroup phát hành hơn 29,3 triệu cổ phiếu phổ thông cho một doanh nghiệp BĐS, Vinhomes được công ty mẹ bảo đảm phát hành 15.000 tỷ đồng trái phiếu - CafeF","Vingroup phát hành hơn 29,3 triệu cổ phiếu phổ thông cho một doanh nghiệp BĐS, Vinhomes được công ty mẹ bảo đảm phát hành 15.000 tỷ đồng trái phiếu  CafeF","Sat, 16 Aug 2025 07:00:00 GMT",https://news.google.com/rss/articles/CBMikgJBVV95cUxQOFVldHVONmFoWGpXNkVtWXk1UzVYdVdLNWRWLURsUURmeU44U3VtZ0lZcTZwT2cyUWhNTTc1V0JaTU5oRFZ6enZUQWJvb1VkeU1jUVF6Mko4QVN6Q2hVVWxWRHhqQUw5Qk5BMDRQTldtVTkwX3JPNm85N1RBY21KblQ1dC1YQnZoV0FreWZaNDk1SzdjSEk2WmE1SGM3YWk4Rl9XNnNRaW54X1N1cm5UeXNlczV2TjFzSGtkVk9MM0RkcmphOHdxWnpjZHYtNkxqVXhiX3NUTnVEaERTMmdhdGhyOEZVMWo3cGZxVDJyRGRoRERBUWdJd2x5MHJ0dDBSZW90ZEx6UVN4aGNtUjQ5Yld3?oc=5&hl=en-US&gl=US&ceid=US:en,CafeF
VHM,"VIC, VHM cùng loạt cổ phiếu sẽ hưởng lợi từ nâng hạng thị trường - Znews","VIC, VHM cùng loạt cổ phiếu sẽ hưởng lợi từ nâng hạng thị trường  Znews","Thu, 09 Oct 2025 07:00:00 GMT",https://news.google.com/rss/articles/CBMingFBVV95cUxQb1VuS1N5YWdBQ1lyaFhRUHMzS1hKbG5qQ0Q4R01XV3hvMjl3RE12empCaGhQa1kzU1Nqa001Zlh4MFQ3ejhScXRXcjRKVm13OFNMNkdZQVlMUzZMT2dhOUt4SzVLNnc1elY4eGJhbVNLNTRRUlRaM3h1c3hiODVEWGtCcFhxaFNaXzRfaVlwUzd6bVRhdHhIelpsaV9lZw?oc=5&hl=en-US&gl=US&ceid=US:en,Znews
VHM,"Một số cổ phiếu đáng chú ý ngày 20/3: PDR, VHM, REE - thuonghieucongluan.com.vn","Một số cổ phiếu đáng chú ý ngày 20/3: PDR, VHM, REE  thuonghieucongluan.com.vn","Fri, 20 Mar 2026 07:00:00 GMT",https://news.google.com/rss/articles/CBMimwFBVV95cUxNdThwSzZZMGtUS2I3VUswNFM3M3hRejZ4aWpWamJpNC1GTXFJUmdSYjd0TG5PRF9iX3hmMktvVWNxN0YwZGcyNE42UUMtdno5bkRNLWdpaFpfajQzdy1oLWNhUTBaLUNYckdvWE9SaTNnMW1GaXVpbmlPOWNEVlNtbkh0Tmx5S0tqa3JSUmNoOGhJSTR4cmh2U3VxRQ?oc=5&hl=en-US&gl=US&ceid=US:en,thuonghieucongluan.com.vn
VHM,"Doanh số bán hàng của Vinhomes (VHM) năm nay có thể lập kỷ lục, vượt 100.000 tỷ đồng - Tạp chí Công Thương","Doanh số bán hàng của Vinhomes (VHM) năm nay có thể lập kỷ lục, vượt 100.000 tỷ đồng  Tạp chí Công Thương","Fri, 20 Dec 2024 08:00:00 GMT",https://news.google.com/rss/articles/CBMiwAFBVV95cUxPVndWSEJnWFBYN3lnX3lCZi03REFkekZ2bXFEV08wNzdlUjFVaEYxOWJ5bkZkMm40dXdwTE8zMUVFNU9iRmJYdlo2OGFhRlBWTGRSQjdvR1NFeC11OXNQRS05LWNCcjZsMGZzOHRtdEprbzUyc25mTFBYN0s0c244QnRTUHphT0ZTcmVnOXlEdi1YYVFkb1QwdVdab1MzZ0FLRVVEYlJ6TTBSSkRqdVBVWTBRRjJ1bUtCN09QOWxXQmU?oc=5&hl=en-US&gl=US&ceid=US:en,Tạp chí Công Thương
VHM,Vinhomes chính thức giảm vốn điều lệ sau thương vụ mua cổ phiếu quỹ lớn nhất lịch sử - CafeF,Vinhomes chính thức giảm vốn điều lệ sau thương vụ mua cổ phiếu quỹ lớn nhất lịch sử  CafeF,"Thu, 05 Dec 2024 08:00:00 GMT",https://news.google.com/rss/articles/CBMiwgFBVV95cUxOUS15OUlWN1pIYzI4b0VoN1lXb2NrVmRWQVdZUFJTR3lvSXhSVU1aSTZvUm84TUhBRmhpMFhWM3l0SmdEM3V1RVBKcGVqcU9CLWVXOFJpcS1aQ19ySzN1elozQVhWZWNneTF6S1NqUlFuX1d4bF9reHQ1U19yTnpOWnZ1ZlRPQkluNG9DcUhOblAwTEtBR3M4OXpnSlZWNUNsUkRCMGphYlhyMTFiUXRvN1ZTWFBrdTk1V2wwTnFhLWNVdw?oc=5&hl=en-US&gl=US&ceid=US:en,CafeF
VHM,"Chứng khoán giảm hơn 30 điểm, bất ngờ ở nhóm cổ phiếu lớn - Báo Dân trí","Chứng khoán giảm hơn 30 điểm, bất ngờ ở nhóm cổ phiếu lớn  Báo Dân trí","Mon, 27 Oct 2025 07:00:00 GMT",https://news.google.com/rss/articles/CBMisAFBVV95cUxPa19WN1BoeGJKdWJsNXNUdkt0TTZWNmQ2M2JEMVV0dTg1Zk5RWXdzUDEtU0R3YVZRTzYtMUdzc2FXVjI4OC04Y1hobVV6cm9sSnRJOWw5MUdEWjAwVDd3eVVSVU5uZVdxN2ZNU1ZGQVpYWGR4UXZGVTJMM2c5TzhSQWZ5ZUdQRnBhWGFvZl9uMUdaQklLYl83SWFHVkk4T0tUMnBJSDR2NWU4eUZSZU1rNQ?oc=5&hl=en-US&gl=US&ceid=US:en,Báo Dân trí
VHM,"Cổ phiếu ""họ"" Vingroup dậy sóng, tài sản tỷ phú Vượng biến động mạnh - Báo Dân trí","Cổ phiếu ""họ"" Vingroup dậy sóng, tài sản tỷ phú Vượng biến động mạnh  Báo Dân trí","Wed, 11 Jun 2025 07:00:00 GMT",https://news.google.com/rss/articles/CBMivAFBVV95cUxOZUpzM3ZLVTdrdmhFV3BxUklKYjR5a3VuVlFfZ0Zud1BHbXlMbEFib0xwZ3puN3lQN0JtMUItTUlFaHZORnlORHhtZmxwdnVLNkFGXzdfR2ZfU2xEUmpuc1loRTl6aTQ4YWlINVA0bDlwaXVOX2VvRWNHVkplZVpDNFhfdGQzS3RiZkJUVU1DRC1zS1pZOXpPNmxkZ09aRUNtUXNvQ0JoN2lZSUNDR1EtSjR6eG10ZzZxcVJfZw?oc=5&hl=en-US&gl=US&ceid=US:en,Báo Dân trí
VHM,Vinhomes hé lộ giá trị thương vụ mua lại cổ phiếu lớn nhất lịch sử - Chứng khoán DNSE,Vinhomes hé lộ giá trị thương vụ mua lại cổ phiếu lớn nhất lịch sử  Chứng khoán DNSE,"Tue, 26 Nov 2024 08:00:00 GMT",https://news.google.com/rss/articles/CBMitAFBVV95cUxPZGQtdHRSRWx0OEdmOUpsOFJXSURBdVNsUngwV1FWSzBKQ1JTelEwSVRUd003UGNUdDdzeUwzUWYtZDgwcTNnZENTMFV0YlhYV29oT3BwZS1OUEI1REc3Q2txSzg4UGUxeEtaU19mdEUyUkpTREs4ZVpZU3M4QjNRWEplb1lTaHZNTXpIZ3NoOGFBZDZlNFlaRlhmVXhsb0hRYUJNYjdrMU1GM1p1MWxFY3JqRjQ?oc=5&hl=en-US&gl=US&ceid=US:en,Chứng khoán DNSE
VHM,Vinhomes phát hành 2.000 tỷ đồng trái phiếu giữa lúc thực hiện thương vụ mua lại cổ phiếu 'lịch sử' - CafeF,Vinhomes phát hành 2.000 tỷ đồng trái phiếu giữa lúc thực hiện thương vụ mua lại cổ phiếu 'lịch sử'  CafeF,"Fri, 22 Nov 2024 08:00:00 GMT",https://news.google.com/rss/articles/CBMi0gFBVV95cUxON05mNVAtR0ljeXRkOVJnUm9pSUF4T19FM2VWR3JVQUZNejFSa3hPbG1aSUpMSkRJVmJZRGtVellnWExXenFzQV9nZ3d2ODk0UFBNX1NvblJ4dXZla1ItX3pqVWNjQnBTaDkyZV9UaTR1aHlyRHpILVMwUlZLRVRKQkV6VGNSRldwZU9HRHEwMUJURGhhdDJjZ0ZUbkNrNGRneGpPOExSb01aU3ZDM0ZKQ2hVM0c1VTR5QnNwczhuSklaTVN3MGVMdEZCV1pvQUU2NXc?oc=5&hl=en-US&gl=US&ceid=US:en,CafeF
VHM,Cổ phiếu VHM giảm sàn vẫn được khối ngoại mua ròng mạnh nhất - nguoiquansat.vn,Cổ phiếu VHM giảm sàn vẫn được khối ngoại mua ròng mạnh nhất  nguoiquansat.vn,"Thu, 25 Dec 2025 08:00:00 GMT",https://news.google.com/rss/articles/CBMinAFBVV95cUxQRFFtUGI5eEk3YjFGTGlaQWVTQ0QtZkdsUTE5Q3lIMGdWam9kWDNkR0d1aU9VYi1fNGM0THJ6Wmo2S1ctYjlYR19OVXlKbVNOY1VNT3lyRmlVWHpMejlRZjZMMmotOG1hQUFjRi1QUUF4TGdLVGxPdTVCQVE2eHRyWHFBRkNyeVNwbTN4alBxM0tNZVNLa0ozbF9ZS1c?oc=5&hl=en-US&gl=US&ceid=US:en,nguoiquansat.vn
VHM,Chứng khoán hôm nay 15/5: Bộ đôi cổ phiếu 'họ Vin' diễn biến trái chiều - VnExpress,Chứng khoán hôm nay 15/5: Bộ đôi cổ phiếu 'họ Vin' diễn biến trái chiều  VnExpress,"Thu, 15 May 2025 07:00:00 GMT",https://news.google.com/rss/articles/CBMipgFBVV95cUxOMG4tOXVwbVZGVC1FNHZUak53Sm9YWWtma2JfYU9obUJYdEViZngzN2xxdTRvdkwzTkczM3ZndE9fYWJrYng5XzNFd0pxZXpPd3NoSFdWOFNOSE5RWExybk9WRml1T1V6c1p3V1RCWVJZdE9VMjV1OWdoVHBMWTluWmRNYzgySEt1RnZHemVENUVoVGx1WUpjX0VhX1oxV2IyMEhzOV9B?oc=5&hl=en-US&gl=US&ceid=US:en,VnExpress
VHM,"Bộ tứ cổ phiếu ‘họ’ Vingroup giảm sàn, VN-Index mất mốc 1.700 - Mekong ASEAN","Bộ tứ cổ phiếu ‘họ’ Vingroup giảm sàn, VN-Index mất mốc 1.700  Mekong ASEAN","Fri, 26 Dec 2025 08:00:00 GMT",https://news.google.com/rss/articles/CBMimAFBVV95cUxNYnFxc1VOeVExR0R0dEdYUUtveERsRzE4aE5HSE5pTVFFWWZOTDlxUDN1bjB3SW9qcHI4WGQzWi1FRjAyYldlRDVXOXNCZElVd3JwU0RYNmNPSjllRUpUdjdPdmlRWW1TUjVZWmNhQWRWVzRSeEF3aGcta0IwYWNBSkhCYVA4N0paVnhIQ0tySkRNbnI2X1pDQw?oc=5&hl=en-US&gl=US&ceid=US:en,Mekong ASEAN
VHM,"Vinhomes đã phát hành 20.500 tỷ đồng trái phiếu trong năm 2024, tất cả đều có lãi suất 12%/năm - CafeF","Vinhomes đã phát hành 20.500 tỷ đồng trái phiếu trong năm 2024, tất cả đều có lãi suất 12%/năm  CafeF","Fri, 20 Dec 2024 08:00:00 GMT",https://news.google.com/rss/articles/CBMiywFBVV95cUxNSVNyUkdNanZRb05PMVI0R1ZEQy1heVF2Q1pDWHB3ZlFIOHRCdVdKRjVqQ0xnNy1pUDl4WWhVRzZ5QWV6ZlRYNlRPaXE0SmRWVmQyZU5MSm9VOHplNlJkQVdnbkNndElYS0NJT1JRNDdEdHFsdUJyTFVwckJGc3JQRmVXRnRlTkJhN1V5ak5qMFo0a3RkTmpmX19uVUJ2bFBTMU9IdXN1RWJKSmdiLUZPcWVmcktYUjI4X2pZQkt1TmtGQ3I3UXM5Q0FJRQ?oc=5&hl=en-US&gl=US&ceid=US:en,CafeF
VHM,"Cổ phiếu VHM kéo thị trường, VnIndex lập đỉnh lịch sử - 24HMoney","Cổ phiếu VHM kéo thị trường, VnIndex lập đỉnh lịch sử  24HMoney","Thu, 25 Dec 2025 08:00:00 GMT",https://news.google.com/rss/articles/CBMimAFBVV95cUxOMDBHN0czRXp1a01oN3BKQ0FBTnR1ZHN5SGZxYmpVTE1UdFdnWW5FYUtLd2hhako5NDFpWk12ZnoxSmlscm1ReFhlUml2ME1BYWk1MlBCOEZLb3hWQUVWUXExaFk5M0k4dndSUGJKdjJJQzJhdXhkS0dZMTlZazJKNmg5aDVkYW00dF9OYzhZX2xoeGZGNHN6OQ?oc=5&hl=en-US&gl=US&ceid=US:en,24HMoney
VHM,"Loạt cổ phiếu bất động sản lao dốc, VN-Index về sát mốc 1800 điểm, khối ngoại rút ròng 1300 tỷ - VnEconomy","Loạt cổ phiếu bất động sản lao dốc, VN-Index về sát mốc 1800 điểm, khối ngoại rút ròng 1300 tỷ  VnEconomy","Wed, 28 Jan 2026 08:00:00 GMT",https://news.google.com/rss/articles/CBMiuAFBVV95cUxPVXhZNElkLW90Q3VydGVSZDl0NXpvQmJiV3RETmR3Sl9NQ0N3SlB5Zy02TEtuVDlfamhXNHBxUjBiMTV1SzFsa2pZNnk1Z01fVGxSR2h2ckRKTEFPS2NDYkk1eGluYmJaVEgzNUpQTXFKV0xMUWU2OWZnQVpCamE5SEMzTTJHVWtpWVJNTXhIZk9ZX1RZajRQZ2s5QXZVU1QwUF90RzVFNnU5WnpTaWlzWXI2eHhJbmRh?oc=5&hl=en-US&gl=US&ceid=US:en,VnEconomy
VHM,Vinhomes đã chi hơn 10.000 tỷ đồng mua lại cổ phiếu quỹ - Mekong ASEAN,Vinhomes đã chi hơn 10.000 tỷ đồng mua lại cổ phiếu quỹ  Mekong ASEAN,"Wed, 27 Nov 2024 08:00:00 GMT",https://news.google.com/rss/articles/CBMikgFBVV95cUxQX2JrMUQzSC1HYlR0TF85VmpRb1RicVNnbGo5TUJ3TGVRMTk3RDR1eFVVNW9HQnhFZE9oT19lcTRCd3gxeURQSXgzdXNBdVBBUDZoaFZoa081WDNMSFNnY2o3U3M4YWd3RFMydE1hRGJTeDVfQS1IYmNZdk13OXRiQUFfOFd2ckRvaFdWa0dhM1VFQQ?oc=5&hl=en-US&gl=US&ceid=US:en,Mekong ASEAN
VHM,Vinhomes trở lại top 10 danh mục quỹ tỷ USD của Dragon Capital sau nhiều tháng - CafeF,Vinhomes trở lại top 10 danh mục quỹ tỷ USD của Dragon Capital sau nhiều tháng  CafeF,"Thu, 08 May 2025 07:00:00 GMT",https://news.google.com/rss/articles/CBMiugFBVV95cUxNMUF2cnFrNThSY3E3SGp6YUJEMFpaZENNRzZUWnBKc1RLc1Vzcy12YXZnSlJyWGdRVkhTN0hjLWhFV3RhWnZ1c0lRRkNDVDdZeE8zQWRINDBPblNyVHA1QkVTV2Y4SHFFTE1Jb05kODM4a1h0MjI1dDBULVpXb0ZpdGZEdVRHRjBMU21iNklOenVkZm9VcUJjX1FOdlFDZDdQdnRjOFBxblhfb2VqUDl1ZVYycWJkVzZKNGc?oc=5&hl=en-US&gl=US&ceid=US:en,CafeF
VHM,"Vinhomes và Vingroup giảm sàn, VN-Index tiến bước nhờ ngân hàng và chứng khoán - Mekong ASEAN","Vinhomes và Vingroup giảm sàn, VN-Index tiến bước nhờ ngân hàng và chứng khoán  Mekong ASEAN","Mon, 12 Jan 2026 08:00:00 GMT",https://news.google.com/rss/articles/CBMisAFBVV95cUxQTWFneTlyREFrTHJ4Y3lnZTBMQk4yeGdhMlljZUQ3OXRCaGJoaGJXLWtjWWZ0WVJyaWtiQVdBMjFwZ2E1NkVPM3FYaWVoNzdnR3U1VHRjRXhUVXhIek81bkd0NGxFSDhMelcwVmRpY0pyNlBheU5WNVl6TEp0LWVlaGFpTzBBVDJSbjBjR2dsbkJaMk00OUZ4cXpuQjRxQ1hCcWZxMXVkQ0Y3R1RqWW1Xcg?oc=5&hl=en-US&gl=US&ceid=US:en,Mekong ASEAN
VHM,Cổ phiếu Vingroup khiến chứng khoán biến động mạnh - VnExpress,Cổ phiếu Vingroup khiến chứng khoán biến động mạnh  VnExpress,"Fri, 26 Dec 2025 08:00:00 GMT",https://news.google.com/rss/articles/CBMiigFBVV95cUxOd3l1V2pRX2J2eVpfY25abXdUQ0ZYM2lDbzExQjVaTXhtWXhIaFVLZkthVnBidXBFeVczWU5qZGRLaXRaZDBuU1NFZkt3ODUzY2RyWlpsOEdmaUlqd2JjQ1R0MVJ6UGFvQ2RuQkZqN1BZTVNSQTkzOUFyVEY1eEVjQTJzeVlacTNHZlE?oc=5&hl=en-US&gl=US&ceid=US:en,VnExpress
VHM,Điều gì đang xảy ra với cổ phiếu Vingroup? - Znews,Điều gì đang xảy ra với cổ phiếu Vingroup?  Znews,"Sat, 15 Mar 2025 07:00:00 GMT",https://news.google.com/rss/articles/CBMigAFBVV95cUxPdkdjc1VKQXNOdmJNdTJSck15cXFuU3V2aTcwdl9Ea3FCc0xReEMxTzJBRUhvNmZaUjNFYl82WTZhTWE4LWdpekxkZGl6RkVONDFGOE9VVUZKa3Mxd29jQ3YzU19NcFotNm1JRlRFMnBqc0k1VHB2LV9VX0l6b3RhOA?oc=5&hl=en-US&gl=US&ceid=US:en,Znews
VHM,Cổ phiếu bất động sản không dễ sớm phục hồi - Tin nhanh chứng khoán,Cổ phiếu bất động sản không dễ sớm phục hồi  Tin nhanh chứng khoán,"Tue, 17 Mar 2026 07:00:00 GMT",https://news.google.com/rss/articles/CBMimAFBVV95cUxNV0xQekFWZ0d2OU51NnphMzh2Z3ZFbFVuUXdNbk9FRXJFWTM2cmRyeUd6WU1zaDNZeEQ5ZTUwcER2alc2dV9KWERTS3lDRi1VckNxeUk2VVRNWkFBZERYUnFRWnV1bEN5ckRnNEZBZFFrTG5CVHVoeUtGUzQ2V1RyWUZOTlZPVnRsSHluLXhheUEybjRxQS1fc9IBlAFBVV95cUxQQU5tdHlnRExDT2VyREdMOXlqbUtrZXQzVXBDZjkyR2dUeldiT3BXektReU5BbUhFMmNmZUdXeXFhNDlDM1o4QVRna0FXaDVEb19URmhtN1pSN3FJanRGbW9uWWFhMFJjOWl6eE1ERFZWdEJXV0R3Tnd3SHl6UE5PcVNZQmNPUzZVR0t0em50QjRzN1pO?oc=5&hl=en-US&gl=US&ceid=US:en,Tin nhanh chứng khoán
VHM,Cổ phiếu VIC và VHM hỗ trợ mạnh thị trường - hanoimoi.vn,Cổ phiếu VIC và VHM hỗ trợ mạnh thị trường  hanoimoi.vn,"Wed, 07 May 2025 08:42:49 GMT",https://news.google.com/rss/articles/CBMif0FVX3lxTE9UQjBsWVV1RWtQelk2RzlOdEl4OU5haGZ0SU5QUDVpcGpZaGNPQ0Z6cGs1U2VoZ05aTWpOMmxyUDI5cU1UZ2FOeGY5Y3JuY3VfS2NFdndkaTJqN2Q1VjRWM3lESTZqX3NKLXE2NkpEOUk0Vi1mSkZTY0RHN3F5UVE?oc=5&hl=en-US&gl=US&ceid=US:en,hanoimoi.vn
VHM,Quỹ đầu tư nào đang nắm giữ nhiều cổ phiếu VIC nhất? - Chứng khoán DNSE,Quỹ đầu tư nào đang nắm giữ nhiều cổ phiếu VIC nhất?  Chứng khoán DNSE,"Fri, 26 Dec 2025 08:00:00 GMT",https://news.google.com/rss/articles/CBMingFBVV95cUxQU1h2cW9IMlJ3THlNUk1Za0MzSk5zUThxNXpVQW1SUEd1SXpjZXdXWmdRLUl6bkR4YWc3VEtXVTczb2M3NS1jbWg5d29fRTBRS2FfcWpRSzk4MVgtcnljNlhsZHNvSUVObDh2Z05SbWlHa2g0dWxNTU5nMWIzVUdQbi1sZE8xd25SNGJsVWdWcFppSFplT01hbHNyQTc4Zw?oc=5&hl=en-US&gl=US&ceid=US:en,Chứng khoán DNSE
VHM,"Vinhomes xác lập đỉnh lợi nhuận mới, tiền mặt dồi dào - Mekong ASEAN","Vinhomes xác lập đỉnh lợi nhuận mới, tiền mặt dồi dào  Mekong ASEAN","Fri, 30 Jan 2026 08:00:00 GMT",https://news.google.com/rss/articles/CBMikgFBVV95cUxPWHV6YzhURlF2bTAwMUZuTjlwMzcwbDBBWTFaN3hfbTNpd21mY3FIdGJKRVB2dkZhTWtadlhZRUc0VTc3UUU0RHl5M0J1dmhlNWRMdDZOSUpjNkdFOUJBQ0ZmblM5aEQzSlphU2VXVy1XUE9lbkFTXzloUGx0Q1l5elRnTjhMS29tOW5Lak9KMW00QQ?oc=5&hl=en-US&gl=US&ceid=US:en,Mekong ASEAN
VHM,"Hơn 22.000 người, một nửa số cổ đông của Vinhomes đã rời đi trong năm cổ phiếu VHM tăng 200% - Chứng khoán DNSE","Hơn 22.000 người, một nửa số cổ đông của Vinhomes đã rời đi trong năm cổ phiếu VHM tăng 200%  Chứng khoán DNSE","Mon, 13 Apr 2026 12:42:00 GMT",https://news.google.com/rss/articles/CBMi0wFBVV95cUxQQ2NsZV9HeFY4STVmY0RXdWF6OG1SODV5NzJwa0owUEQ1bkRBTERCOXBvSUludVRUcWxfVUlKVEw0WUJtdWh2TTdEU3JweUxCdHppR2plT2tCUy14MVMxMFFyb2pYVWZ0RU5YUnpKTF9iNWZxX1hvSHlWcHFoS29vV1dmcHJGb3BtanlOS0RIQ1BiLVp4UWRIV0ozUE1DSW1zU1U3eDEzTEN4Rmd5NkN2RHljVlk0ZzA4c2I3cGswWmdITm5DN1l2RE1UeFFqSVFOMnUw?oc=5&hl=en-US&gl=US&ceid=US:en,Chứng khoán DNSE
