ticker,title,desc,date_raw,url,source
VHM,"Bán cổ phiếu VHM, TCB, một doanh nghiệp bất động sản vượt kế hoạch lợi nhuận - Nhadautu.vn","Bán cổ phiếu VHM, TCB, một doanh nghiệp bất động sản vượt kế hoạch lợi nhuận  Nhadautu.vn","Tue, 28 Oct 2025 07:00:00 GMT",https://news.google.com/rss/articles/CBMiqwFBVV95cUxNZEVzX19BdjBDaVBpRm5YUE5PWmxPRFdzTEZRZDNxU2c1SDl0Tnd0Vk9YcnJpdmstd29rWFFiU1N1Z3lGR1NvWnkyTnlFaktHaU04QXIwdnVhcjdkdmhVZlZINlU4Nkd4XzBkSXlwRkxUYW94RE9mcjBlLUpzODYybmh4SENRUTVkYV9lc2o4bEdVRTctSWtHckg3ZEs2Rm9ueHNqUi1YZzZvUm8?oc=5&hl=en-US&gl=US&ceid=US:en,Nhadautu.vn
VHM,"“Gãy trụ”, cổ phiếu lao dốc, thanh khoản giảm mạnh - VnEconomy","“Gãy trụ”, cổ phiếu lao dốc, thanh khoản giảm mạnh  VnEconomy","Wed, 15 Oct 2025 07:00:00 GMT",https://news.google.com/rss/articles/CBMie0FVX3lxTFBtUVNPUGxvSVpJS2pKY2NfLVZ0V1F5dEZhTkxoMC11bnJrNlEtWFBnOG5XangyRmItRHB4RnljOVZENW40Wi02MWtldGVheHNwVWFfTFhjSkFCUXVsU0Y2QlYtT3lrcnBJMXJhNlpUNHZRczZOWWh1MktPYw?oc=5&hl=en-US&gl=US&ceid=US:en,VnEconomy
VHM,Cổ phiếu VHM và DGC tăng hết biên độ trong ngày thị trường chứng khoán rực lửa - Tạp chí Nhịp sống thị trường,Cổ phiếu VHM và DGC tăng hết biên độ trong ngày thị trường chứng khoán rực lửa  Tạp chí Nhịp sống thị trường,"Thu, 02 Apr 2026 07:00:00 GMT",https://news.google.com/rss/articles/CBMiswFBVV95cUxQQVREaUE0VTJpSVhnRnlfQ29MaTktQ1VTUVRHaDRTZUk4SW9ZWEV0OFdkd3BWb2lmQnIyN2NhUUI4ajF2OXJNX2RFMmxCM1RQRkRjYzN0SGtqRWxqV2dlU2pDOE1ORmdIbXBpLXhlcVBIRHZxQnppYXdjUDlsRGlUNlVRN0dqT2RzNDhVdEJhMFdnSEtWTFV6QXNLR1M4RWVaY1NYaTREaGhZZmJyUkJiRF9Ibw?oc=5&hl=en-US&gl=US&ceid=US:en,Tạp chí Nhịp sống thị trường
VHM,VHM: MBS khuyến nghị mua cổ phiếu Vinhomes (VHM) với tiềm năng tăng giá gần 40% - Chi tiết bài viết - Vietcap Trading,VHM: MBS khuyến nghị mua cổ phiếu Vinhomes (VHM) với tiềm năng tăng giá gần 40% - Chi tiết bài viết  Vietcap Trading,"Thu, 14 Nov 2024 08:00:00 GMT",https://news.google.com/rss/articles/CBMixAFBVV95cUxNeFE0X1NqelMtZVVHVlItWWdybThrWUdRNW9ic21Ja1pIMHFwX09xWjRNb21Ga0hYdUQxRG9jbDhFSUJkdWRUcVhJeG5fODdGRkRmZW5ralAwQnMxVXU1aFUzZUxhR0RPWmlHTXpVU05ZN3Q4ZVpPeHNGb2hVYldITG1pUTJCNmY0QUlFbzJPczhZdElpZmhmb29rYjRXMno1UGwySHl6VE8wMG9hSFdpVWExaXpwOFN6UzNaRFgzWE1RdGF5?oc=5&hl=en-US&gl=US&ceid=US:en,Vietcap Trading
VHM,"Cổ phiếu VHM tăng trần, dòng tiền đang quay lại? - 24HMoney","Cổ phiếu VHM tăng trần, dòng tiền đang quay lại?  24HMoney","Wed, 01 Apr 2026 02:47:08 GMT",https://news.google.com/rss/articles/CBMikAFBVV95cUxOQ0RrTjFJS2dPU2l0TmxwV1pCcC1tdlBzZnREVFFzR3JGTzJodXloNlhqZTFZMUJOWEFZcml4ZTNnMTVGeV9lZkNfekx1ZkNNN1JEaU1hTlR3OUpTUHdBOWNvZEtHMDR5LXJoNkM2NXZaWF8xVWsxUkNCQktka3hDTDVZSlZWUTZUd2dlc3JNVTI?oc=5&hl=en-US&gl=US&ceid=US:en,24HMoney
VHM,Cổ phiếu Vingroup tăng trần - VnExpress,Cổ phiếu Vingroup tăng trần  VnExpress,"Fri, 07 Mar 2025 08:00:00 GMT",https://news.google.com/rss/articles/CBMib0FVX3lxTE14aWxQdE5NRm15UGIwRjlCdFR0T3JUOXhwNDN4b05Fa0MyRUFpU1lFeFNVYlh1eUxIVERMMXltY2YyMFhNelRXREJoNHVvT2hsdmh2Z2xKOUYzR0RWdTBCZUlGajlZcXI2RHhMLVpQcw?oc=5&hl=en-US&gl=US&ceid=US:en,VnExpress
VHM,"Cổ phiếu VIC, VHM bất ngờ tăng trần trong ngày thị trường “chìm” trong sắc đỏ - Chứng khoán DNSE","Cổ phiếu VIC, VHM bất ngờ tăng trần trong ngày thị trường “chìm” trong sắc đỏ  Chứng khoán DNSE","Thu, 05 Feb 2026 08:00:00 GMT",https://news.google.com/rss/articles/CBMivwFBVV95cUxQM3pZMHh2RUhySUVCZ0M1N3FvR25GQXZfQVZZTVFQTFI1SDRlcUx1dzd5THFYczB1REZrWDB3cmdWb3NucXJKaEhKU0N2QmhYc3c2eG50SGNiZGVZcEluVlhLNXI4cjVDVnZLemhtdXkwOGpyRlZocFE0Zlc0TWFTRVd5ZGh4TXBMNkxNdWUtYnA3ZDY1ZHJ2dHhyZG1jYnNWQWVNNUF2ZjJFVE5VclUtbTNBN1BhODFSTlJfWkdDWQ?oc=5&hl=en-US&gl=US&ceid=US:en,Chứng khoán DNSE
VHM,Ai đang thực sự nắm cổ phần Vingroup? - Báo Dân trí,Ai đang thực sự nắm cổ phần Vingroup?  Báo Dân trí,"Mon, 29 Dec 2025 08:00:00 GMT",https://news.google.com/rss/articles/CBMilgFBVV95cUxPWVl3VGlZdXdrNEVMVnRoNzlFV1NzUlBvcURNVUprbWJWT3RQeU9nTTJSYk54Qkp5UFJOYlltbVBiTkVNc0paczVCcWV0VDdfa0k5dWZycWw2SkVfMlFTNEFjdGJEUU9wdDBlcURVOWZwX1RiVTFzQjViT2hObkR3clk4bGxfMTUtT2I5amdWMnJuYWdLaEE?oc=5&hl=en-US&gl=US&ceid=US:en,Báo Dân trí
VHM,Nhà đầu tư sang tay gần 1.400 tỷ đồng cổ phiếu Vinhomes sáng nay - Znews,Nhà đầu tư sang tay gần 1.400 tỷ đồng cổ phiếu Vinhomes sáng nay  Znews,"Thu, 02 Apr 2026 07:00:00 GMT",https://news.google.com/rss/articles/CBMingFBVV95cUxPSTVBQlkwcjYtNkw0UlFOYk01YjJuNTkydEJzd08taExUbVFsbWcyTlBCb0pxZzcwdGktUkdPS21wTHNGUTRlX0s5TWhqNkVqREQ0U09aeEhISzlrMnNGSHEtVXQ0X1I3TlJpdWJISXU2OWpMbWhkYnY0Yl9RRWNXampISHNTV0tiejNzVTFjZEdyenA4cUVHZ0l1Z0h4Zw?oc=5&hl=en-US&gl=US&ceid=US:en,Znews
VHM,CTCP Vinhomes báo lãi 4.435 tỷ đồng trong quý 3/2025 - Mekong ASEAN,CTCP Vinhomes báo lãi 4.435 tỷ đồng trong quý 3/2025  Mekong ASEAN,"Thu, 30 Oct 2025 07:00:00 GMT",https://news.google.com/rss/articles/CBMijgFBVV95cUxPN291azdKYjZmRHpqY2lwcDBPYUxqSkptZFNBdXptcEMwbVo4SHNiSUN0aEJGVUZJS2MzazBoZmhfNG11Q3RESUVDWnBiUEFDWGZpdU1xeElxNUU1aFF5TzFSVmRiTXVJU2xreEdaZlB1NnZFbE1sVEloQUhXbzZXMFllYllPY2xwbVdOdi1R?oc=5&hl=en-US&gl=US&ceid=US:en,Mekong ASEAN
VHM,"Cổ phiếu bất động sản Vinhomes bứt tốc, tài sản ông Phạm Nhật Vượng vượt tỷ phú Jack Ma - Báo Dân Việt","Cổ phiếu bất động sản Vinhomes bứt tốc, tài sản ông Phạm Nhật Vượng vượt tỷ phú Jack Ma  Báo Dân Việt","Mon, 05 Jan 2026 08:00:00 GMT",https://news.google.com/rss/articles/CBMiuwFBVV95cUxQdVNZbnZtcFVtVVhETGZrMllLN245dkVubmVkakROTUFEcGc0dzFQSzkzNWVsOEdBcG9rTnBYZVNYTVktZFdHbGcweWR2ZU9wV3RqVUZBZFRKOEJFQUJXcFN0bk11OXVocFJrSG5vdVpySEVNWjFscnZqd194RzdrOWl2QWRaUHN0aVk5MDUtSllfTXlCT0F0SDg4bERPUTdXT3BzM21SeC1kZ09mZjRnaXJzZ1N6TThQQ0lN?oc=5&hl=en-US&gl=US&ceid=US:en,Báo Dân Việt
VHM,Chứng khoán hôm nay 5/1: Cổ phiếu nhóm Vingroup đỡ thị trường phiên đầu năm - VnExpress,Chứng khoán hôm nay 5/1: Cổ phiếu nhóm Vingroup đỡ thị trường phiên đầu năm  VnExpress,"Mon, 05 Jan 2026 08:00:00 GMT",https://news.google.com/rss/articles/CBMie0FVX3lxTE5VNmczdHNEd3hOT2ZkM0FSNFRQZFF6RlRTY2pPN1ZsUG9xb0paOXNCWlMxdS1PTTNZRjI3TEdGcWhCLTlxc2lObnMyV1RCcEN3RDhJS0F3SE1vZ3J0VmtpWl9CajhhVmhiTHg3YW9udmcwQVhHTm1MR0xKQQ?oc=5&hl=en-US&gl=US&ceid=US:en,VnExpress
VHM,Khối ngoại bán ròng kỷ lục VIC - VHM: Nhịp xả trụ hay tín hiệu thận trọng của dòng tiền lớn? - BÁO PHỤ NỮ VIỆT NAM ĐIỆN TỬ,Khối ngoại bán ròng kỷ lục VIC - VHM: Nhịp xả trụ hay tín hiệu thận trọng của dòng tiền lớn?  BÁO PHỤ NỮ VIỆT NAM ĐIỆN TỬ,"Mon, 02 Feb 2026 08:00:00 GMT",https://news.google.com/rss/articles/CBMi0AFBVV95cUxPbFQ0RVBaY3VLaHFsZE1IN05oS2xyYTc3M1ZfN0dOSVJCcXZGVzR3bndrM3dZSFExSmxYUTFMc2xVYkNkMmpjdFJ2d0NKbW9LdFkzb0pheVVvREhBOUpORjd0cFByd21lYlZDWDc5Y3R6VzBCLVVhZXV1QllwRVl4emdGeDFkRmNFMTdOOWpVSjR5MndKOVhoa1RhZE56UFhReHYzSVhjVTBwOEdKNzhzSzJ5UG9sR0pLeEpjNkRsTUdDcTBaaU1HeG1yR3JadmFV?oc=5&hl=en-US&gl=US&ceid=US:en,BÁO PHỤ NỮ VIỆT NAM ĐIỆN TỬ
VHM,Diễn biến bất ngờ của nhóm cổ phiếu nhà tỷ phú Phạm Nhật Vượng - Báo Dân trí,Diễn biến bất ngờ của nhóm cổ phiếu nhà tỷ phú Phạm Nhật Vượng  Báo Dân trí,"Mon, 02 Feb 2026 08:00:00 GMT",https://news.google.com/rss/articles/CBMiuAFBVV95cUxOOTVDbHRTMHJSTDdLeVphVENtLXBOcmRSNmg2SG94azNzX1ZQVDRQRkFwcmVDaFpQc3BmMl94Y3FsTTJMYTByQklFdUNzYWY5Rm5FUlJDNi10R3dLU1JJbzVuZWJZS2w3ZGJqV1l2QzFmWGxZOVUybGVFNW9BdFZYZEhFeDBIWjhCVDBKenNleFdFN01OQ3o5QkZBRFhPM0N0Y1lwaXZydVFoczRUejd5S2U3TG9Sc2lp?oc=5&hl=en-US&gl=US&ceid=US:en,Báo Dân trí
