ticker,title,desc,date_raw,url,source
VPB,VPBank chính thức chốt chia cổ tức và cổ phiếu thưởng tỷ lệ 80% - VnEconomy,VPBank chính thức chốt chia cổ tức và cổ phiếu thưởng tỷ lệ 80%  VnEconomy,"Fri, 10 Sep 2021 07:00:00 GMT",https://news.google.com/rss/articles/CBMikAFBVV95cUxQeG51el9mckY3b2U5Y1lUcHdic0kwTUJFV2RFT0xTdUVuWWNXUWYtY0poR0FNalY5NFBwZ0pYLTNXbVZ6U0pieDNwS0FIQ2FIaWhVYVkxQTUtdUJiM2RQQ0lwQ1h0TVIxQ1NqQlptaDdzcVZ0aUtVTnpiQVF3dEJ3SDlPS0Z2T0prNGsyMGVrRjA?oc=5&hl=en-US&gl=US&ceid=US:en,VnEconomy
VPB,Cổ phiếu cần quan tâm ngày 25/7 - Tin nhanh chứng khoán,Cổ phiếu cần quan tâm ngày 25/7  Tin nhanh chứng khoán,"Thu, 24 Jul 2025 07:00:00 GMT",https://news.google.com/rss/articles/CBMihwFBVV95cUxPYTN5U2JMaTh1THBkMV92bHc5bzVvS2E1YmlwNGtUWGRQYlYySXJaQzhTZUdsN2dBOV9ZU2V3MjJZRW5xZ2ExZlNkWVdUM2JDZnBoYk96anFvWWcyRVRpTDVpWE9BTmdQY2lfVEhyY1lWdUlKR3dSV0Vpc0RQaGR4OE13Y2REVG_SAYMBQVVfeXFMUE95TVJocVh1ekFUOGQ0Y1d0RDVyZzJIb0w1R1RhVDNUV1FNWFVYMkZ3Uk0tR1g5TlhDczBXX0RFYzQtNHpTY1dxY2ZpZGh6VDNYRF8yMWQ3ZlBhNGdhdEk2OEpNNHVNVTlfMlk5UjFuOFp5cXdkTEdJemk4VmRTaUx1SWM?oc=5&hl=en-US&gl=US&ceid=US:en,Tin nhanh chứng khoán
VPB,Sếp nữ VPBank 'bạo chi' hơn 570 tỷ đồng gom cổ phiếu - Znews,Sếp nữ VPBank 'bạo chi' hơn 570 tỷ đồng gom cổ phiếu  Znews,"Mon, 10 Mar 2025 07:00:00 GMT",https://news.google.com/rss/articles/CBMijAFBVV95cUxOWEx6T3B2YkFFeXVTNFRxNG1FZC12WThkbExIXzVEcWxZUS1yMWF0RjdkUjMyQ1VXU2JSQ09MMzRSYjNIeUMwbVc2QTJhRVNqRUdqbWZMSHpDOXE2d2o4ejNXam1sYXpocVJjXzVsUkhWUE8zUzdKLXJhOG0yWEQwUjhlZUlXcnM3aWF3NA?oc=5&hl=en-US&gl=US&ceid=US:en,Znews
VPB,Một cổ phiếu ngân hàng được đánh giá còn dư địa tăng 14% nhờ chiến lược mới và dự án tài sản số - Chứng khoán DNSE,Một cổ phiếu ngân hàng được đánh giá còn dư địa tăng 14% nhờ chiến lược mới và dự án tài sản số  Chứng khoán DNSE,"Fri, 19 Sep 2025 07:00:00 GMT",https://news.google.com/rss/articles/CBMi1gFBVV95cUxQOEpnTFdxVUVDbkJaVXJkQUdudTRhM2dnZkNIVVptY0RZTDBmdVpFUTJSVi1YaVdIaU1CMjU1N3B0a0NqUzFQUmMyRFNKSHNZbGtWVW9RaXp4RE1TMkpvdGlLWWRzazJPaHFteXZ0VFRmSFpmZHdZMmdPV3RTQUNzVjR2V2t2VUFqTXkyOUYzM1BLWE44Y3NkWmtxWEd5eldObWhwWG05ZExGeTUxdkJobXVQSjhJak5JNjdJX0dyNDFDcU93Uld6bVJfdElTSFZuWWNISEJ3?oc=5&hl=en-US&gl=US&ceid=US:en,Chứng khoán DNSE
VPB,Cổ phiếu VPBank tăng trần sau tin tổ chức nhạc hội có G-Dragon - Báo Dân trí,Cổ phiếu VPBank tăng trần sau tin tổ chức nhạc hội có G-Dragon  Báo Dân trí,"Wed, 14 May 2025 07:00:00 GMT",https://news.google.com/rss/articles/CBMiuAFBVV95cUxPWEIxdXBEc1pBWnlQTkUyMUJFaC1BdEhpQTJGRWVDMlhZYUR4Z3k5U1BDMnNTcVpSVjliMGFZRGpja3FiaHlkUjk2UGNKdUNLbHdWbjdNcDZTcHB2WXo4Q3NEQ2lzUDM3YVEwb2dVNjBQZFNmbG9hV0g0U2dzS3JyNGNveWZqRkxDNXRVY1drRjF5c1E3WGRzYmhaUlV1ZEtIdlVwM3A5VWhYejhyQ3VDSmJPaGlMMTUx?oc=5&hl=en-US&gl=US&ceid=US:en,Báo Dân trí
VPB,Lịch sử giá cổ phiếu VPB và những thông tin cần biết - VietnamFinance,Lịch sử giá cổ phiếu VPB và những thông tin cần biết  VietnamFinance,"Tue, 23 Nov 2021 08:00:00 GMT",https://news.google.com/rss/articles/CBMilAFBVV95cUxNY1d4TFFvRXF4VXRQWmpfNGZkeUNkSzNEc0gwU2lNYk9DTXRRS1ZJN3FSVkkwS0dkVmFOQlY0QjlCRFdIM1ZaVHhFTnlUUFpMaGlNYkhEQ20tMGcwNjhURGV1XzUyT25OVUNxRm40dE1KYlpocUlNVWg4c2syV2Q4aFpfOXM1ZGFsaWdPMFJueklXNkhN?oc=5&hl=en-US&gl=US&ceid=US:en,VietnamFinance
VPB,Ngân hàng VPBank (VPB) đặt mục tiêu tài sản vượt mốc 1 triệu tỷ đồng - Tạp chí Công Thương,Ngân hàng VPBank (VPB) đặt mục tiêu tài sản vượt mốc 1 triệu tỷ đồng  Tạp chí Công Thương,"Tue, 15 Apr 2025 07:00:00 GMT",https://news.google.com/rss/articles/CBMiqwFBVV95cUxNcEZnMDJiUEJxak1YalJVdWNyektndmpPSllUSTladmJhSlZjMUNBVWhIWk5PUGNYT3JSSG1PNkNERm9aVHFXSGhnWk4yenN6Rkk1WmJkOW84cXI4ck1XSlZ1T1phUFdJZmdLVDI5dmt3dllWeUd1UkNUS01IQnNsbjJnSmlkazRTd21DdzlqT093a0NyRGdBY3p5SFA3ampSS0hvZGVSb0dzWWs?oc=5&hl=en-US&gl=US&ceid=US:en,Tạp chí Công Thương
VPB,Tin IPO giúp 2 cổ phiếu ngân hàng lập đỉnh mới - Nhadautu.vn,Tin IPO giúp 2 cổ phiếu ngân hàng lập đỉnh mới  Nhadautu.vn,"Wed, 20 Aug 2025 07:00:00 GMT",https://news.google.com/rss/articles/CBMihAFBVV95cUxQWVZBaXRIanRaV2Y2eVVIWERHbGdzYlE4dlczOVlDNkhpYkJUQlVnejAwRnY3a0VmSTFEc0Q0RVlrS0NXWEQ3Y0lMSk45VmJFdXlmaGF6ejhIQ2xQYXk2MFl4LXNCVnBsc3Vwa3BkMW0zSVhibGYzZzNVR3VJS2VSX2Z2X1g?oc=5&hl=en-US&gl=US&ceid=US:en,Nhadautu.vn
VPB,"Từng “all in” cổ phiếu VPB và ""lỗ đau"" trăm tỷ, CEO Passion Investment chia sẻ kinh nghiệm vượt qua và từng bước lấy lại tự tin trong đầu tư - CafeF","Từng “all in” cổ phiếu VPB và ""lỗ đau"" trăm tỷ, CEO Passion Investment chia sẻ kinh nghiệm vượt qua và từng bước lấy lại tự tin trong đầu tư  CafeF","Wed, 19 Jan 2022 08:00:00 GMT",https://news.google.com/rss/articles/CBMihAJBVV95cUxPRDhrdmVGSHRlaUt0SkR1UU1Cdy1qOVYtN3MtdUIzZ3VpMEduZTVBU0tsSkZyMmtDT2lEUXJ0RGxJV0Z3OVkteXNYQ2RnaHVxLVhsYTlxVVpoa1hXMl9odm1YSmdNS05SdUZwN20wYkdCYjdSdDFRQUR1aktHQi15NlpOWE5XQUFJZUp4S3pCbWZOZVZ0ckktZ3hvSkluSGMwR2p4VmV4Qmh4SFpHLU5TVjVKSkJhenhjVWUwU1lHUWFYNEtoOFRPOTJpSjUzbnByWjU2aFByVzE0d2k4VTd4ZW94WGxBcXFLV3RkWlFPbEZnVkhzaTZCSTdkRUJ1N3pFVWhkdQ?oc=5&hl=en-US&gl=US&ceid=US:en,CafeF
VPB,VPBankS lên sàn HoSE sau thương vụ IPO lớn nhất ngành chứng khoán - baochinhphu.vn,VPBankS lên sàn HoSE sau thương vụ IPO lớn nhất ngành chứng khoán  baochinhphu.vn,"Fri, 05 Dec 2025 08:00:00 GMT",https://news.google.com/rss/articles/CBMisAFBVV95cUxQYlRvZ283bmlaLWQ3THMwMkZEZWdYWW5qN2VIeEhONG5kQjRRUU5JQjRMQmhaMHo5TkRnQ1VqdDBBTnBpRkYyOGpHeEhyZGFHNjRqT3V4SXFOaVUtV0dDaTRwc0V2VzVkZHVaM3A4X0N0Rm5TNjIxZnRITlYtNUJVb2xPczc1TjdWYUtVNmxFNnNYU0lTNU94YXBOY3hrT0F6WGt0U3FucHVZR09LS3BCUA?oc=5&hl=en-US&gl=US&ceid=US:en,baochinhphu.vn
VPB,"VPBank dự chia cổ phiếu thưởng tỷ lệ 26%, cổ tức 5% bằng tiền - Chứng khoán DNSE","VPBank dự chia cổ phiếu thưởng tỷ lệ 26%, cổ tức 5% bằng tiền  Chứng khoán DNSE","Fri, 27 Mar 2026 07:00:00 GMT",https://news.google.com/rss/articles/CBMiqgFBVV95cUxNeW8zYVFWbFQ1bGZZZy1aalczQXFPaHZaTjR1aXVUWGV1NkxaQWZmdVlaOFhiajNmYlRUUHBnZk9vblM4UzI3dk52bjlNek1fd01LLVpQUi1JTWlRTVpHUGI0MGxTblR4aVBRQjZ3bTlYZXdzNjdaZWc1YklMZ1oxcldLbXNRWUpnN25XeWs2YlktU1lPRmp6OHVBdWpsRVhqQUZoWTdwQmVWQQ?oc=5&hl=en-US&gl=US&ceid=US:en,Chứng khoán DNSE
VPB,"Tăng trưởng CASA bứt phá, cổ phiếu VPB liên tiếp phá đỉnh - CafeF","Tăng trưởng CASA bứt phá, cổ phiếu VPB liên tiếp phá đỉnh  CafeF","Thu, 14 Aug 2025 07:00:00 GMT",https://news.google.com/rss/articles/CBMinAFBVV95cUxPRHlYUEk1MGhHWlIxcGZLcEVMcXZTNlZVNXhKR1BPakpYVFd0c3N2aEdNbGkwSzhYbkxqYWZabG82MHFwbkw2T094Q2tRQXFJR3hYdWpEcEFRWjlVSkNKZ0lvNE5idDY3MnZGWkItNXIzczFFOGdoTHdyMkVMY0lCTk1McldrZW1acDdzNTRMTmNxX2w4bWFFR0dUTUs?oc=5&hl=en-US&gl=US&ceid=US:en,CafeF
VPB,"VPBank chuẩn bị phát hành cổ phiếu tỷ lệ 80% để tăng vốn, trong đó 62,17% là cổ tức - CafeF","VPBank chuẩn bị phát hành cổ phiếu tỷ lệ 80% để tăng vốn, trong đó 62,17% là cổ tức  CafeF","Wed, 28 Jul 2021 07:00:00 GMT",https://news.google.com/rss/articles/CBMikwFBVV95cUxNYksxUmRoR1BZMTN0WVk1WmhDY2dQM19yYkFGaHdOQUZiWlNaWnhJNUhvY2xxZkRkekptQ0Z6bmlIUjFJVU12RzJub1RoVEtZejBKcThyNTBqLWNoRmNicldmUnVHRVFnTW9uZmhUcVZUdDZoUGJPemp4bjY4eEwyeWFyZTlzbjV6UWxENlVKZEJpRUU?oc=5&hl=en-US&gl=US&ceid=US:en,CafeF
VPB,Kế toán trưởng VPBank bán thành công 40.000 cổ phiếu VPB - Mekong ASEAN,Kế toán trưởng VPBank bán thành công 40.000 cổ phiếu VPB  Mekong ASEAN,"Thu, 11 Sep 2025 07:00:00 GMT",https://news.google.com/rss/articles/CBMikwFBVV95cUxPZnVmRTRqWVl1aGdDajhYc2ZOVzNodW1ueWx5VkZWSmFCQ0FlTjl0Tm9VZVd1a0JabnU1c2V2d0ZvcUlUWFBCcGpYcWJSdU9jWEdKUmRuYXB0ZU54c0hPWFhuQ2JtVkNxcFA0MjE3bG0xb09BMUw5a0JSS2Z5R285aDctd1gzTFJTeklMSzgycDM1M0U?oc=5&hl=en-US&gl=US&ceid=US:en,Mekong ASEAN
VPB,VPBank chuẩn bị chi gần 4.000 tỷ đồng trả cổ tức trong tháng 5 - Mekong ASEAN,VPBank chuẩn bị chi gần 4.000 tỷ đồng trả cổ tức trong tháng 5  Mekong ASEAN,"Wed, 07 May 2025 07:00:00 GMT",https://news.google.com/rss/articles/CBMinwFBVV95cUxPc3pjNFUzZ3YtYnJrZFE0dkFpZ3k2NlJ1cWFJWEh5QlpfOFN3YUxQN0NldWlWTTIyNEJjZ2d4ZkhQUGt5LWhVQVR5ZEJDZmNrUE40bjRqQUt0cGZEbC1NRnZZaXphS1kyUmxfclBxU0ZtdXYyMFMxMHpJUHVkaDRybWd4bWNSTWdhbW9BeHRhcGtuMzBvRmd1dWxrVjd4bDQ?oc=5&hl=en-US&gl=US&ceid=US:en,Mekong ASEAN
VPB,"Cổ phiếu nổi bật tuần qua: VPB hết 'ì ạch', HPG hút tiền khối ngoại - Mekong ASEAN","Cổ phiếu nổi bật tuần qua: VPB hết 'ì ạch', HPG hút tiền khối ngoại  Mekong ASEAN","Sat, 09 Aug 2025 07:00:00 GMT",https://news.google.com/rss/articles/CBMingFBVV95cUxNc3p6V0dTeVZfcW5aeUotSnlwdjBBV0JxMkhxWkZqU0UxWkdaTWpaakZkSGtjZDR5VnIxWmZUOFJCTVpkUWpHSkxQUXJuNy1kTV94RkZFR3VfNlNqbk9BY3BfcUJVN3I5Zk5hOExDbmxweUhKZmdGVjd2VWJwMThVam5rdzBaNGN3Wm1wc1Z1Z1RCd0xaWTZzUDA5UGhHQQ?oc=5&hl=en-US&gl=US&ceid=US:en,Mekong ASEAN
VPB,"VPB tăng giá gấp đôi, hai ái nữ nhà phó chủ tịch chi nghìn tỷ gom 40 triệu cổ phiếu - Chứng khoán DNSE","VPB tăng giá gấp đôi, hai ái nữ nhà phó chủ tịch chi nghìn tỷ gom 40 triệu cổ phiếu  Chứng khoán DNSE","Wed, 20 Aug 2025 07:00:00 GMT",https://news.google.com/rss/articles/CBMiyAFBVV95cUxNZm1ybUIxZzZrOENXR0s2eDQ0ZWUtVlpUeGdvTjRQRTZIRTdTenFzSWtFVkVXWGM4Rm5mWXlRNXpCcWFtTnVWWkV6eDZYeFI1cXJyT3dMUjN4TW1TMDR0ZEZOS3JxeTk3OVN5aEp3WVYxNExwUHF2Y0p6ZEtWUFZUaXRpS2FDNEp6eDRJUUpBSnpNb2FGUXZndVRXQWx5bTVCUWNEaVphMGdsaXg2c2RScHQxZzhwejJLNXcwTERlYzVHSmxFSkJqTg?oc=5&hl=en-US&gl=US&ceid=US:en,Chứng khoán DNSE
VPB,Cổ phiếu VPB - Có nên mua? Kỳ vọng gì vào LỢI NHUẬN và PHÁT HÀNH RIÊNG LẺ năm 2026? - 24HMoney,Cổ phiếu VPB - Có nên mua? Kỳ vọng gì vào LỢI NHUẬN và PHÁT HÀNH RIÊNG LẺ năm 2026?  24HMoney,"Tue, 27 Jan 2026 08:00:00 GMT",https://news.google.com/rss/articles/CBMivgFBVV95cUxOd0luaU93MHFYanBrZnc3UC1WMm0tUnBMdlVOQ3d3Vk9HWDZXOC1lWE1Jek1pYmhZRGRTQ0ZIdWh3dFp5OVI5WWlGQ2tqanZNMWlSVUdVUWw3cjZOSE9wRFJFS3JnWnd2ZFV6Xy1QNllxU1dZUDU4X3hHMjdKb0lnMFVyb0UwM0lyZVN3VktuLW1sT2prYkNrUG8zYkdfa0tpVnZKRHF1RllYVk1lVG9TbkQ5SjBSOW95eTNUWXZR?oc=5&hl=en-US&gl=US&ceid=US:en,24HMoney
VPB,KBSV khuyến nghị mua cổ phiếu VPB với giá mục tiêu 38 . 000 Đồng / CP năm 2026 - Báo Sức khỏe & Đời sống,KBSV khuyến nghị mua cổ phiếu VPB với giá mục tiêu 38 . 000 Đồng / CP năm 2026  Báo Sức khỏe & Đời sống,"Thu, 26 Feb 2026 08:00:00 GMT",https://news.google.com/rss/articles/CBMiigFBVV95cUxPaDRfY21GN0RkYmRELV96bURuVVhUbXhGYlY1bUFjR0ZrU0FlekpZcTFjT2lHeURXamZpaVM4UEhjWmVrVzBSRWhXUlUtT3U1aGJELTYyb2hyaU9pYnZPQ3lxWGlReVlYWmlBS01rMVVadHR4SVdWTDJZWnRnekRXZTVEaHdaQkpfSlE?oc=5&hl=en-US&gl=US&ceid=US:en,Báo Sức khỏe & Đời sống
VPB,"Con trai Chủ tịch VPBank mua xong 70 triệu cổ phiếu VPB, Dragon Capital bán MWG, gom FRT - thitruongtaichinhtiente.vn","Con trai Chủ tịch VPBank mua xong 70 triệu cổ phiếu VPB, Dragon Capital bán MWG, gom FRT  thitruongtaichinhtiente.vn","Sat, 04 Nov 2023 07:00:00 GMT",https://news.google.com/rss/articles/CBMizAFBVV95cUxQSjRwR0JNVEJtZWxGZWtuZVFxeEFTNkVjT3hIb1J2cGd1dFlINnl4MkFld2xmV3EzR0Jrd1lOVWEydnhOaEFSOGF1NkVmYTdKV3IzUmJDNWwwanl1T1NDMENTQ2dNcFpsdkFESG83aXdrMk1WZ1RTZUM2ejdaZTQ2VW5oVkwyWW9Odm4zb19xMTdOREdyRndDTDliMGRTd0lUa0Y0MW1WU0ZBVE9fX3RVYTdvRURmeHVDaFYwYzBNbVNzQktJeU5HUVJGcDk?oc=5&hl=en-US&gl=US&ceid=US:en,thitruongtaichinhtiente.vn
VPB,"Cập nhật cổ phiếu VPB – Lợi nhuận thuần Q4 tăng 72%, vượt dự báo - dautucophieu.net","Cập nhật cổ phiếu VPB – Lợi nhuận thuần Q4 tăng 72%, vượt dự báo  dautucophieu.net","Mon, 26 Jan 2026 08:00:00 GMT",https://news.google.com/rss/articles/CBMijwFBVV95cUxNVzJrUnA1TmRNTGJUM0R6NkZnRGJONmZuUk9oUmtNSVAwZlNoSlNlaW92aE5VcU55UVp6b3E3NTlhazV3VE1hazY2bGlVV2NwbkdQelE1NlhTNGVNTTZBQjNrYndOc2pSSVJsVmVEYUtZcEZNRHlmS1dPRTVVNkc0MjZ1YmpzckpHMkd4UUNsNA?oc=5&hl=en-US&gl=US&ceid=US:en,dautucophieu.net
VPB,Báo cáo Phân tích Toàn diện Cổ phiếu VPB: Tái định vị Thương hiệu và Động lực Tăng trưởng từ Hệ sinh thái - 24HMoney,Báo cáo Phân tích Toàn diện Cổ phiếu VPB: Tái định vị Thương hiệu và Động lực Tăng trưởng từ Hệ sinh thái  24HMoney,"Mon, 24 Nov 2025 08:00:00 GMT",https://news.google.com/rss/articles/CBMi3wFBVV95cUxPcnB3NzF1OGYzb0FpLXZmOUtjX3NseG14bDMwNks5enJ2QTg4akZmbUprbmpJNXBfSGxIb2RXWXBDcDJXZ1NfSkREZlI3WkpSY2dMRzBzeFJEMThGU0hjdElIR3pXYlRKdG1SVHNtb2UxM3dydTNXaXJCaHR1UVdnNllERWJyR3ZpcHV3OTduNWJOLTFvV3pXV01uN0V3TGc1bTNjd1R2cFJZOXJzZ1YwM0lZd3ZzSVFURnAwSjI1QkdPdzBSMXg1VTlvMnNVREdod0ZDY25xRml2LUtiU0Rv?oc=5&hl=en-US&gl=US&ceid=US:en,24HMoney
VPB,Gần 2 tỷ cổ phiếu VPB chuẩn bị lên sàn - Nhadautu.vn,Gần 2 tỷ cổ phiếu VPB chuẩn bị lên sàn  Nhadautu.vn,"Wed, 10 Nov 2021 08:00:00 GMT",https://news.google.com/rss/articles/CBMiekFVX3lxTE9odnlETllEdDgwNzFPWW5CaGlCc21ySEQwQ1JHOHRZeTltSlRUSHpzRk1UcVg4ZWZnbjBhSmNwMUNxaFZ2WWl5N0l0cmtMeGl0cUhBZG5lTFEyQ294TXdpbkdaWER3SllhRUlXOXlWS25GR05HeWR3bUhn?oc=5&hl=en-US&gl=US&ceid=US:en,Nhadautu.vn
VPB,2 con gái phó chủ tịch VPBank dự chi 1.400 tỷ mua 40 triệu cổ phiếu VPB - Báo Dân trí,2 con gái phó chủ tịch VPBank dự chi 1.400 tỷ mua 40 triệu cổ phiếu VPB  Báo Dân trí,"Wed, 20 Aug 2025 07:00:00 GMT",https://news.google.com/rss/articles/CBMiwwFBVV95cUxOaVhCTTZrUVRLbzlSOGYxNWN1WnRDVmZBcnljYXVFRDlpVmYwenNPVWxaaE5sWEh0ZUJ2UDNVbjhGWDJkRVdhbjFsamhrNFY2bjdxOGhTQ1RoWHkxU0NldHB5bElHYm9rWlRtTXhTTmJyT2ZPMGVsS25SVDBaUkx6SFprMWQwVk5OaEJLSmdIYzFXQm1WMEJ0WE5wZlRYNTh2TU5FOHBmX01qYURaTmc5a1dyZ24wQlZVbmhaM0hPS2x1RE0?oc=5&hl=en-US&gl=US&ceid=US:en,Báo Dân trí
VPB,Một lãnh đạo VPBank vừa mua xong lượng lớn cổ phiếu VPB - CafeF,Một lãnh đạo VPBank vừa mua xong lượng lớn cổ phiếu VPB  CafeF,"Thu, 29 Aug 2024 07:00:00 GMT",https://news.google.com/rss/articles/CBMimwFBVV95cUxNNVhvUTZ5NFJQNjJHWkdTbFlaVVU3TkNZZFQ3VnN2NWRGejBtUU1TQXZXYUlhNFJQMC1uRDVHMEQ0dHVPMEx0djBIc3JtSm1Pd25BNTNtMVVEOE1rb0dDMmlkUWwzWkptMDJlOUN1UWRvRzFFNTBSdmdBV3ZJWTNYZW9YTmt0NkEtemM3TVpfU3E3NUU2X3JQR3hYMA?oc=5&hl=en-US&gl=US&ceid=US:en,CafeF
VPB,"Mở tài khoản chứng khoán, nhận ưu đãi cực xịn - VPBank","Mở tài khoản chứng khoán, nhận ưu đãi cực xịn  VPBank","Mon, 01 Aug 2022 07:00:00 GMT",https://news.google.com/rss/articles/CBMirgFBVV95cUxPVS1fa0Y1eUNGaGRxOHBYZnhKRU5kTWFSc2ZiVkd3eDl2N1hvNHlXaV9CYmRGRzFQY3Nrd0RWZkM0MVZPWk9xVEpnZU00aUlZb08zZ0hBUmJUaUhINVZNaDMwUnRtOEtTT1FXZG1aZ1dmRXhNb296SkJQaFFodVlWbENMMWdNUDBVSG1JWUk0Vi16NXZmQTV6Tl9tdmFLUmFwZENVb1l5SDlxcDdzZ3c?oc=5&hl=en-US&gl=US&ceid=US:en,VPBank
VPB,Một cổ phiếu ngân hàng được đánh giá còn dư địa tăng 14% nhờ chiến lược mới và dự án tài sản số - Chi tiết bài viết - Vietcap Trading,Một cổ phiếu ngân hàng được đánh giá còn dư địa tăng 14% nhờ chiến lược mới và dự án tài sản số - Chi tiết bài viết  Vietcap Trading,"Fri, 19 Sep 2025 07:00:00 GMT",https://news.google.com/rss/articles/CBMi3gFBVV95cUxNOTFxbl9BNEJ6UklGN0hrb2hnenFCT2tRd2RVVGpNYUhSOFhreFRsekgyX2k0YnUxZnBHVGlEelZqUThyVVN5VXZSV2NmNnZpeHU4dHYyRzIwYkI1LTc3WU9QZWJabWFrVnM1UlNyXzNDendYVGEzTktHUWVKRThrbk1sMmRGUlZ1VF9XdjBDbXdpNGZ0VlF2RF9pNEpIaWZuWnhydXU2TWZEYUhmMDNNYU1zUVpQUUNMSlFPeWxqRkdwS3BROWRHckROc09Ud2I0aVZXdkpDVVFjMHBkRWc?oc=5&hl=en-US&gl=US&ceid=US:en,Vietcap Trading
VPB,Chứng khoán VPBank chuẩn bị IPO - VnExpress,Chứng khoán VPBank chuẩn bị IPO  VnExpress,"Tue, 19 Aug 2025 07:00:00 GMT",https://news.google.com/rss/articles/CBMidEFVX3lxTE8xNmZZdGkyX0Z6dzJMZWJTUk96SmpfcUFXRm5xYXFmM0FMUUZrYk9UUnlDckpXMnE3S0IyTnRWQmJOM2FNc1gwYWZ4LWpfTmZQMlUtQkxaRnltczZXMmFvaGlYVXRhMlV3czFYRUF3RG9xSE9f?oc=5&hl=en-US&gl=US&ceid=US:en,VnExpress
VPB,Lãnh đạo cấp cao dự chi hàng trăm tỷ mua cổ phiếu VPBank - CafeF,Lãnh đạo cấp cao dự chi hàng trăm tỷ mua cổ phiếu VPBank  CafeF,"Mon, 03 Feb 2025 08:00:00 GMT",https://news.google.com/rss/articles/CBMinAFBVV95cUxQNlBhZHRsMVkwSEgyb3h3RHptMk10czVjZmtLSXJXamY5SEk0UjZqdVlKSU1DTk1GVTFORThPcHAtSUIyWFRtcThfY1RudVFaa1JkQ2diTG9jcTNIQnFfUHpyVDNObnE2TFFuVTVpaTdMVFdTbkh5R2FsdjBFQ1ZHbnlNQ00zeUN5bUhvelNBaDZnWkVvUklqYk9SU0c?oc=5&hl=en-US&gl=US&ceid=US:en,CafeF
VPB,Gần 500 nhân viên VPBank được phân phối hơn 30 triệu cổ phiếu ESOP “giá hời” - CafeF,Gần 500 nhân viên VPBank được phân phối hơn 30 triệu cổ phiếu ESOP “giá hời”  CafeF,"Wed, 04 Oct 2023 07:00:00 GMT",https://news.google.com/rss/articles/CBMitAFBVV95cUxPUEtHaTFsRzNDV2FHQXQ3N1hEeE5ncE5nakRSOEplZ1dHLWhfVFg4UE9fRkFNY3RObE1JQ2ttd2JrS1FGb3hUVjZqQzkydGFQbjFXZUdyYkJib1NTRmJZa1kyLUJWM2ZWaU1fTDI4MFF3TUxDei03T2c2aTJ0dU9zMk90YTV3ODk1emF5cng3SXlianRYT3FjWGNCMVBySm5fblVfM0Eyc3RXM043ejlUbjJaMEs?oc=5&hl=en-US&gl=US&ceid=US:en,CafeF
VPB,Con trai Chủ tịch VPBank đã hoàn tất mua vào 70 triệu cổ phiếu - VnEconomy,Con trai Chủ tịch VPBank đã hoàn tất mua vào 70 triệu cổ phiếu  VnEconomy,"Sun, 05 Nov 2023 07:00:00 GMT",https://news.google.com/rss/articles/CBMikAFBVV95cUxOSi0yWHdWc1lYdjhSdTZBbUl4SnlRTGRER3VrZEdHb1doNy1VTldmdzRTa0dKRzVaQ3pXQkgyM3BwSU0zOEs1Vk1ldnZXWWVTOWdBbEdjQjhJSGRMUGNPTk90WTN1UzlqQVlodzAwLWNnYzEtTUlqa2liVVp3bTZUSHNVQWZsZkg3YkJraUd5Vk8?oc=5&hl=en-US&gl=US&ceid=US:en,VnEconomy
VPB,Một lãnh đạo VPBank tính chi hàng trăm tỷ đồng mua khớp lệnh 30 triệu cổ phiếu VPB - baodautu,Một lãnh đạo VPBank tính chi hàng trăm tỷ đồng mua khớp lệnh 30 triệu cổ phiếu VPB  baodautu,"Tue, 04 Feb 2025 08:00:00 GMT",https://news.google.com/rss/articles/CBMitgFBVV95cUxNRVNMNV9lZ2g1OEhKTjdmdkQxQ25nY3Y5OURMRDlJZU15YWJSRTRQeUJsWnZVakZZZmpOclhESDVleU56aURKa3cycThZOURjWTdaWDBmRFk3N2xybXpEZVdVWjZRcTB0TVJ2bjhLTENCUzMyWTBiRkE5REdwR1dkM2kzOFhSOE1SazBVeXBSdVctS1NWdEFLbUh4TkFiWFBjaUZZOGg0ekZ3YmtlT0F2THFlaHZ6UQ?oc=5&hl=en-US&gl=US&ceid=US:en,baodautu
VPB,Ngân hàng lớn của châu Âu trở thành cổ đông VPBank - CafeF,Ngân hàng lớn của châu Âu trở thành cổ đông VPBank  CafeF,"Mon, 19 Jan 2026 08:00:00 GMT",https://news.google.com/rss/articles/CBMikwFBVV95cUxQQVZjSXdkSzA4Q2h6RHg1cFZNeDlUSXVYdGZBTm0xdGlpWkQwY0p2YUFhcjZvNlpHSGl5NkFXOEd2alhSMzJGRGZ3SXFCYTZVM0tzcl80SHNWalNPaHdrc2dhbGpWeEVTa1YwU2ZqZF91bllxbjlPVzllLVAtczd0c2VzTHNESHFfMWgybUpzYjRjM0U?oc=5&hl=en-US&gl=US&ceid=US:en,CafeF
VPB,VPBank 'kiếm' được gần 10.000 tỷ sau tin mời G-Dragon về Việt Nam - Znews,VPBank 'kiếm' được gần 10.000 tỷ sau tin mời G-Dragon về Việt Nam  Znews,"Wed, 14 May 2025 07:00:00 GMT",https://news.google.com/rss/articles/CBMinAFBVV95cUxPME9ROHhKQXJnQnBlbC1WSi1UcmM3WE94ZmxTcmZ1cXFoclFpLWIwaDVvU3BEb1JSQjBRLVRKNUE1Z282NzBCRW0waHVIZU1zRV8yY2lQUkdjTDZvQjZmWlFzY3BnVUhkRzdwWk5aUHY2S0c5V1VqR0FVZTJfOEhmT3FDeDZ6VVM2a1NDR1RKX2Q1M0VFeTBxaGY3dTI?oc=5&hl=en-US&gl=US&ceid=US:en,Znews
VPB,"Một số cổ phiếu đáng chú ý ngày 10/2: HDB, VRE, VPB - thuonghieucongluan.com.vn","Một số cổ phiếu đáng chú ý ngày 10/2: HDB, VRE, VPB  thuonghieucongluan.com.vn","Tue, 10 Feb 2026 08:00:00 GMT",https://news.google.com/rss/articles/CBMimwFBVV95cUxQaGxhSEdmdzdlY1k2STdlM3dIclF5Y2d1YXZjSUVHVy1oRS0tOFc2cFM1dUxqMUxsR0RfOF95blBENFkzT1ItZTdtUGU1T2pNV2lGVnJKdDBiU0dvYnd5aHB5a3VKcHFwZEIzYVFEZXBwWkhIYkU3b3ZJT1NFNmpxLWxDZ3VlbkJVVkNHbGd1Zl90YU5JWUYtZVZYSQ?oc=5&hl=en-US&gl=US&ceid=US:en,thuonghieucongluan.com.vn
VPB,"Con trai chủ tịch VPBank muốn mua 70 triệu cổ phiếu VPB, giá trị gần 1.500 tỷ - CafeF","Con trai chủ tịch VPBank muốn mua 70 triệu cổ phiếu VPB, giá trị gần 1.500 tỷ  CafeF","Thu, 28 Sep 2023 07:00:00 GMT",https://news.google.com/rss/articles/CBMitAFBVV95cUxPOGRCZnQ3bWFIOTNuOXlDQm9vUkt3MVJmdlV0SlVZMFA2b3VQclVnS1B5TFNDOGpzaW56VXFnNHlVUkJsX2Znam5aenlOWUQ1REhkX2RiNEViTGw3TjdFd0RQeHZUWS1DZm9NclJQeEFrQnZTNHhEUE11dDFSQTJTLWdMdmpvNlh3dzZ1OTZjSXpxdU9XXzdJNVFLT0VPT3FmcThsYlVqZ2s3RlB6VVFNeUVTY0g?oc=5&hl=en-US&gl=US&ceid=US:en,CafeF
VPB,Cổ phiếu VPB - Có nên mua? Nợ xấu tăng mạnh có khiến giá CP giảm? - 24HMoney,Cổ phiếu VPB - Có nên mua? Nợ xấu tăng mạnh có khiến giá CP giảm?  24HMoney,"Fri, 30 May 2025 07:00:00 GMT",https://news.google.com/rss/articles/CBMipgFBVV95cUxQY1JHYTF0NDNrek1ILURHa0djaHBRbGZMaHZuVXhSNTd4Zm8wV01EcFVXZjRVRGF6cUJhc2RPdHo0NEtmMG04Z0h2bTNXd2hTQUY3MmM3RHp0RzdEZFNZR2JZUmNocC1kaGZNWkVIdGFLaHRNdmhReUZ1dW43aVdzc0lxekx4NVJKVVl3OEVFU0ptakZxSmZTckZ1ZlFFZUZ5Qk9rd2lR?oc=5&hl=en-US&gl=US&ceid=US:en,24HMoney
VPB,Bùng nổ giao dịch cổ phiếu VPBank - baodautu,Bùng nổ giao dịch cổ phiếu VPBank  baodautu,"Thu, 29 Apr 2021 07:00:00 GMT",https://news.google.com/rss/articles/CBMidEFVX3lxTFBsNEVBX2pTUVFUWTJFMGJiY0RaSjlpTUVwMVBWMFNNenpRTHozUEhYLWVSRl9TVThQLXFkd2lTdHhKcUxXV2dOYmVIcUpqb3VsX050eTRMclF3b05nREoyb3QzbHI0VFI5QWhFTUY3czREanVa?oc=5&hl=en-US&gl=US&ceid=US:en,baodautu
VPB,Phó Tổng Giám đốc thường trực VPBank (VPB) đăng ký mua 30 triệu cổ phiếu - Báo Văn Hóa,Phó Tổng Giám đốc thường trực VPBank (VPB) đăng ký mua 30 triệu cổ phiếu  Báo Văn Hóa,"Thu, 06 Feb 2025 08:00:00 GMT",https://news.google.com/rss/articles/CBMisAFBVV95cUxNRWZ4MXdhb096SzBuTWNSWnlNN1BoVjctVW1MSi1fNWNoYzVUMVhNSGxaTkRTbkRGcmNyQ0F2RldhWDNhbmlRbnRra0JIRk9NM094YmRhMzBKQkNtNmE3SkNWUjhER2RBTlpRd2VCNmk2eURjU1AySXVsZnRyRmRfcnBkaFNwUFV1Ym1WMmdTOWpPQi1QN3VjVlZQckZYbV9PczA0WGxBV3NKRlRuNzBUWg?oc=5&hl=en-US&gl=US&ceid=US:en,Báo Văn Hóa
VPB,"Một sổ cổ phiếu đáng chú ý ngày 15/10: PDR, TAL, VPB - thuonghieucongluan.com.vn","Một sổ cổ phiếu đáng chú ý ngày 15/10: PDR, TAL, VPB  thuonghieucongluan.com.vn","Wed, 15 Oct 2025 07:00:00 GMT",https://news.google.com/rss/articles/CBMinAFBVV95cUxPcm1heU8tRHlZV2tTYkJMZTFJeHM4d1BRdUNIUnUxWll5aEFLUlEzMGI0V2V0X0U0Q1UwQWN2V2F5NVhTaDVFU2xhN0YxdEtnOEZEeWtuc3B5MVhBZmU0NDM4VHNFS2FjRHhuUWNnbjFwNWtkRjlNS0JaTDVQVC1QcWREUVpqOVNKS1k4OGRacHNBTk4xZFJOVkZGSGU?oc=5&hl=en-US&gl=US&ceid=US:en,thuonghieucongluan.com.vn
VPB,Lỗ năm 2023 của FE Credit - Ngân hàng VPBank (VPB) tăng đột biến - Tạp chí Công Thương,Lỗ năm 2023 của FE Credit - Ngân hàng VPBank (VPB) tăng đột biến  Tạp chí Công Thương,"Fri, 08 Mar 2024 08:00:00 GMT",https://news.google.com/rss/articles/CBMiowFBVV95cUxPYnpOYzNCeG1SeEl6XzJXNUFnd1RaeVRvYXA4cHBtU3YxenNibFA2clpIM3JHZWJtUWVXTTZzbTZOOXp6bDQ4NVlMWGo4ZFFBaEo5eFo5S1MzT3VoakN1WkhyMjZnWF9tcFV5RFB6bEk0YXB3OEUtMXRGellYRVBmc0lCcllUT3Awc3NERUdfXzVmQWwzZWtyUGNKXzJ4REFNS1BJ?oc=5&hl=en-US&gl=US&ceid=US:en,Tạp chí Công Thương
VPB,Xuất hiện cổ đông ngoại mới tại VPBank - Znews,Xuất hiện cổ đông ngoại mới tại VPBank  Znews,"Mon, 19 Jan 2026 08:00:00 GMT",https://news.google.com/rss/articles/CBMifEFVX3lxTE1oaGdtQjlXM0oyV0x1bExJQ19Sc2ZBVU1BeVRXN3pqc0hUVXptbXpaUmx5dndDbm9OU2JTbGxzVFV5cjFwZHNiaEQyNWgybV9zbkR0UnN1VkRHU0I3aDIwNzdGdTJXdXJ5RUdaMHFsVFVacGstUmtCMHkzNzE?oc=5&hl=en-US&gl=US&ceid=US:en,Znews
VPB,Nhìn lại biến động giá cổ phiếu ngân hàng năm 2021 - CafeF,Nhìn lại biến động giá cổ phiếu ngân hàng năm 2021  CafeF,"Mon, 03 Jan 2022 08:00:00 GMT",https://news.google.com/rss/articles/CBMikwFBVV95cUxPeTZQb2xZNHJ5SGVhUGM0c2lkbFJFb3pES0R5TE9xaktMVlZLNk9KZ0twY3d6VGE5Rm5KZjdPZTNMMXFtNWpaN25zQVVjNm5tMGdZV3VkZHBDV1RmakMxZ3dqdWp5MnRiNGRFNjdHTzc2dXFSSWN1ZF9GNV9nTnJ1azY3MThnbUI2U3Z2c0pZb3lJNW8?oc=5&hl=en-US&gl=US&ceid=US:en,CafeF
VPB,Ngân hàng VPBank (VPB) kỳ vọng mảng bán lẻ và SME tăng trưởng 30 - 40% trong năm nay - Tạp chí Công Thương,Ngân hàng VPBank (VPB) kỳ vọng mảng bán lẻ và SME tăng trưởng 30 - 40% trong năm nay  Tạp chí Công Thương,"Sun, 30 Mar 2025 07:00:00 GMT",https://news.google.com/rss/articles/CBMivgFBVV95cUxNUjkyYjB3NmRyN21ZQm83Sk9PRmZBeHNYYmlmSmN1YXB3azZmXzRia0NIUnRjSVVCRzJHa3pIVXBkdF9ZcmRVQXNoaWh5dWJvV3hnNFlFQlV4VUZneFJwU2QwdXRRY0hocG1SbDJOQ1k2bGlER1JESlFYbER1U0NBcXdkaVdkMWdhLTFHUlB1U0NIcHE3X2FId2NpQkhfZkRYWWdKcFB4UWpkTm93TEwzOC1jN054aDMyQ0dNWXlR?oc=5&hl=en-US&gl=US&ceid=US:en,Tạp chí Công Thương
VPB,"Tăng trưởng đồng bộ cả về lượng và chất, tổng tài sản Ngân hàng VPBank (VPB) vượt mốc 1,1 triệu tỷ đồng - Tạp chí Công Thương","Tăng trưởng đồng bộ cả về lượng và chất, tổng tài sản Ngân hàng VPBank (VPB) vượt mốc 1,1 triệu tỷ đồng  Tạp chí Công Thương","Sat, 26 Jul 2025 07:00:00 GMT",https://news.google.com/rss/articles/CBMi2gFBVV95cUxNTVQ2VDc2dG5INWJObHZjakhXNGFBZE9LWFFwWXRBVXpGM2tsS2c1ZFoya3E3dGRMTlBzUHB4UlV5WWJrYjcyTERwWWJMT1lrQVpPaG1Hd2RsZ3BaLWFLYzhiaE1CVjVCeWZVMGJRWXFDeHlncm56WHM4OGs3VjJ6UGRuSXBoTVV4Q1dhSk1iMmt6Tjlmd0NTOEVER2ZCYVFGWERMbnRTQUFuUjJNdElRdlBCRndDeXlGWk5SNExmNnM5b25HRm96R3ZnZk00NFBRWlVGcmVQY3pfZw?oc=5&hl=en-US&gl=US&ceid=US:en,Tạp chí Công Thương
VPB,Hai con gái Phó chủ tịch HĐQT VPBank chi hơn 1.330 tỷ đồng gom cổ phiếu VPB - Mekong ASEAN,Hai con gái Phó chủ tịch HĐQT VPBank chi hơn 1.330 tỷ đồng gom cổ phiếu VPB  Mekong ASEAN,"Sun, 31 Aug 2025 07:00:00 GMT",https://news.google.com/rss/articles/CBMirAFBVV95cUxNajJMenhTcGRQbG1rSkJZZFV2YmZWck1qaHl0RlFtblk3bEVBaE1mUmxhcVdMVlRId3RycWhIZFlRWEczemlaM0VtLS16Y2RrSG5ReUp5bkVHTkd4ZWFKOVFJbU0ycFZIZUhFYmRlX2N4NXFORm41bVZMd1czWUpna3FYcXFiN1F1bHBELWtibUtFRG41dGVjNzM2cDRUa1Bud25qWUVhVW5sa1pV?oc=5&hl=en-US&gl=US&ceid=US:en,Mekong ASEAN
