ticker,title,desc,date_raw,url,source
VPB,Cổ phiếu VPB tím lịm giữa sức nóng từ sự kiện âm nhạc quốc tế - Thời báo Tài chính Việt Nam,Cổ phiếu VPB tím lịm giữa sức nóng từ sự kiện âm nhạc quốc tế  Thời báo Tài chính Việt Nam,"Wed, 14 May 2025 07:00:00 GMT",https://news.google.com/rss/articles/CBMiqwFBVV95cUxOclJSR0x1QndmLXU2ZEdoNmFqc21xWFNYVzRNekM5NnNkX29kV2FEQnFYTDBIeV9td3puVXk4c1cybVk1TTNFcENZYkpmWnprdjRESlZNaUVIeGFqc2VZQWZVTnBzM29ZS0dIMG1BOWVaOGtkTmZKdmsxOS0yWUFiM2I1YXQ4bW5KT3F4d1doY0JXUkUxMGliRF80bzQ1QURlOUR2clpYTkJhaE0?oc=5&hl=en-US&gl=US&ceid=US:en,Thời báo Tài chính Việt Nam
VPB,Điều gì đang xảy ra với cổ phiếu VPBank? - Znews,Điều gì đang xảy ra với cổ phiếu VPBank?  Znews,"Mon, 28 Jul 2025 07:00:00 GMT",https://news.google.com/rss/articles/CBMifkFVX3lxTE9lcmZpeXZwZEdpQ3hDMzRoRzJfUEZoOXR0eUwwd2E3d2JCd1hGOWVjcUR5VnItc1ozUFRJOTNYQzc5V0JTSG1BQmpQaDlrVWlhaWpLSHUzdFlPblU5b1VnMi1wQThqUUNZMm0zdWxVTVpWNVRSUnEzRlNQUnVLUQ?oc=5&hl=en-US&gl=US&ceid=US:en,Znews
VPB,Cổ phiếu VPB trước thềm chia cổ tức - diendandoanhnghiep.vn,Cổ phiếu VPB trước thềm chia cổ tức  diendandoanhnghiep.vn,"Sat, 10 May 2025 07:00:00 GMT",https://news.google.com/rss/articles/CBMihgFBVV95cUxPd3l5T3phR0FOYUlBN0QwejFNcUlMY2tZOHdvZVBvYXdySDBqMWw1UkhjQkkzcEY0bGdxZnZDUnNENnlzTnc3ZC1TTklpOW16OUJITDVIdmdTOXlJZFlwNmlwTFBaako3QzIxNmc2R0ZvS0N0cFFtMjE1VGlDV1NFcHAzUkFydw?oc=5&hl=en-US&gl=US&ceid=US:en,diendandoanhnghiep.vn
VPB,"Giá cổ phiếu VPB lập đỉnh mới 72.100 đồng/cp, VPBank chào bán 17 triệu cp cho cán bộ nhân viên với giá 10.000 đồng/cp - CafeF","Giá cổ phiếu VPB lập đỉnh mới 72.100 đồng/cp, VPBank chào bán 17 triệu cp cho cán bộ nhân viên với giá 10.000 đồng/cp  CafeF","Fri, 02 Jul 2021 07:00:00 GMT",https://news.google.com/rss/articles/CBMi5wFBVV95cUxNODdpbmxhYmE4bnE0bDJYNFRZaDF1b2hwWm45TjJxNmR5NGp2SWE5NHliMzVHQmNpWE9fTEtLXzdwT283T0lsZF85UzJZSmpLcFN3S0ViWEVYREdYS3loNDFUUFNxekpzTHhVaUZnNDhXZk84dUp1eHRVRDJObUJvenJPVkpmaEhJcXpDTXVhbi03ckJEaVVhajBCTko2SUFmWnJPNDFvZHlWR3k0MDQySW1yQ3lYbWtzb19hS0laMk41RzJjN0UzZzIyb1kyeGhEVGdyU2VQTE5kU3ExOEZRcDhxLVM0NTQ?oc=5&hl=en-US&gl=US&ceid=US:en,CafeF
VPB,Tái định giá cổ phiếu VPB sau thương vụ IPO VPBankS - baochinhphu.vn,Tái định giá cổ phiếu VPB sau thương vụ IPO VPBankS  baochinhphu.vn,"Wed, 19 Nov 2025 08:00:00 GMT",https://news.google.com/rss/articles/CBMingFBVV95cUxQTWZHemRvekN6OEJldFQ4M3kwWXR2SFVnMHdyLUtWYUFoR1NSRjhiaXdjOGhjc0JFaUxUTGkzRUQ5dXRBWWlxa0tQZzctZ3dLVW9rTWFTTXdBUXIxWVFHamxaRHF4WWJ6RDY2ejlJMDJEX3NwQ2RSVVl1MXBvN0hzRksyaWNJbEMzT016czhkYmY4OVM3U1EyQ3M4aU9zQQ?oc=5&hl=en-US&gl=US&ceid=US:en,baochinhphu.vn
VPB,"Lãnh đạo VPB muốn nâng sở hữu tại VPB lên 0,58% - VnEconomy","Lãnh đạo VPB muốn nâng sở hữu tại VPB lên 0,58%  VnEconomy","Thu, 21 Aug 2025 07:00:00 GMT",https://news.google.com/rss/articles/CBMiekFVX3lxTE5kajE4clpQTnh3dWowZ3d0SXRPaG5pa2Y0ejRxSWI5QkhDWUN6anFwT1JjRlBteVk2MEp2Mjc5NHRGa1NfNDJkcU55ekhCZWJIMlNJOVpVWHRWWGZOQWc1bTBxVUpQQTZpaC1EcTRNV1ZSaElhZW5TUE9n?oc=5&hl=en-US&gl=US&ceid=US:en,VnEconomy
VPB,Hai con gái sếp VPBank đăng ký mua 40 triệu cổ phiếu VPB - VnExpress,Hai con gái sếp VPBank đăng ký mua 40 triệu cổ phiếu VPB  VnExpress,"Wed, 20 Aug 2025 07:00:00 GMT",https://news.google.com/rss/articles/CBMilgFBVV95cUxPc25vVi1sc1lSa0Zqc1dQQnN0YkwzeUdUZFo0MndzbS1NM3p0WHVTSjljNTI5RXhnbTVTZ3JxSlVBNGRMRGlvUUJLaG1aOElaSWRhckp5NC12MlVLY1lnaDdnalFvbEx6VHZHdXBoak5Ua0VQdzBMNVNfUVkyWmZDc1lFcmFrOXBFOS1sN3pNazFOcjg5RkE?oc=5&hl=en-US&gl=US&ceid=US:en,VnExpress
VPB,"Chi nghìn tỉ mua cổ phiếu vùng giá cao, ái nữ sếp VPBank đang lỗ bao nhiêu? - Tuổi Trẻ","Chi nghìn tỉ mua cổ phiếu vùng giá cao, ái nữ sếp VPBank đang lỗ bao nhiêu?  Tuổi Trẻ","Wed, 24 Sep 2025 07:00:00 GMT",https://news.google.com/rss/articles/CBMitAFBVV95cUxOQ0ZTRGoxdHlQY0pEMDdwQnlpRDFqdEJOLUhiYlJzV2RuWUlDMzNBMWkxVzFoYnQtVThnRllkZExNV0ZIVmtYWGllcUVOem53R2JyX01sTnhldF83bExqTFY5VGV3eDd5NG92V2NtenV5U2VSSTJ0NGdHMFNOazNvbkxGR2pDUGdyb2NpUzBWSE15YVd5aWgyVklkb2lSRXV5RXI4a0Z1NmJvRzN4c2RYaUFhc1c?oc=5&hl=en-US&gl=US&ceid=US:en,Tuổi Trẻ
VPB,"Gần 1,2 tỷ cổ phiếu VPB của Ngân hàng VPB vừa được niêm yết bổ sung - Tạp chí Công Thương","Gần 1,2 tỷ cổ phiếu VPB của Ngân hàng VPB vừa được niêm yết bổ sung  Tạp chí Công Thương","Wed, 01 May 2024 16:00:11 GMT",https://news.google.com/rss/articles/CBMiqgFBVV95cUxNdF9uekMzUjhPdE9jRGhEdWl0Ny0wT1Vlb2JkWWViV3ZQQVRQUjRzbm0zNWhnaEcwbXNrQ1Zub1V4LVNTQWlvcEx5YTltZW1VMmZTR1RRTUJwVGFzVUc4VWJFUjh5ZmVBMERycnVjRTJiSG1HYktzdDB6RTN3ODhydFltRWxjeDhRSXF5dlV4R0M4TzZ6Ym02OUllaG91eUx4a0lFRTdQaDUwUQ?oc=5&hl=en-US&gl=US&ceid=US:en,Tạp chí Công Thương
VPB,VPBanks khuyến nghị tích cực dành cho cổ phiếu VPB - Báo Sức khỏe & Đời sống,VPBanks khuyến nghị tích cực dành cho cổ phiếu VPB  Báo Sức khỏe & Đời sống,"Wed, 21 Jan 2026 08:00:00 GMT",https://news.google.com/rss/articles/CBMioAFBVV95cUxOUE05cm9wZ1ljSU1ZSDR1SjR1TEQ1eVdiVFZKdGZZZkhOQk93VWRzNkh3M3pTdHdvYlozTTJwak5rZUcweWd3SDR6WjNCWjhERHVyeGxIYmhyS2RVM05WdTltdVdjUkJHTzNMakhTVWR0RGRDOTc4YmJQM2V0c1JzSUpuVEFJMFVrZk9pYlQ3aXloMGs5SE5taUprOUZscmpV?oc=5&hl=en-US&gl=US&ceid=US:en,Báo Sức khỏe & Đời sống
VPB,Dòng tiền đột biến đẩy cổ phiếu của VPBank lên giá trần sau chuỗi tăng liền 7 phiên - Laodong.vn,Dòng tiền đột biến đẩy cổ phiếu của VPBank lên giá trần sau chuỗi tăng liền 7 phiên  Laodong.vn,"Wed, 14 May 2025 07:00:00 GMT",https://news.google.com/rss/articles/CBMiwwFBVV95cUxOdWxkU0ZkOGFwWTdfb29tMWh1TE1aRjRDSXB4WWhMc2VJenBGZ1JkSmdvZnRwLVI1dXliQlFLMVpnbVA4c0R3WVFmd25FQ2lfR2l5VDVhcktVVTJjRW1jOFY3V1VadnA5Y3l3MTRLQ0ZZQWxiN2pMSm0tdGltVVFmaHNIWXlLZmJlWDhjbHpqZk83Qkg4Q2d2WW0xaERoYTFGajZIeGZSc1dMak42dUJ5eDYzRjRDR0lwUXB6ZlZRcXkxZEk?oc=5&hl=en-US&gl=US&ceid=US:en,Laodong.vn
VPB,"Sáng 19/8, tiền đổ mạnh vào cổ phiếu ngân hàng: VPB 'tím lịm' sau thông tin IPO VPBankS, HDB chạm trần trong ngày đặc biệt - CafeF","Sáng 19/8, tiền đổ mạnh vào cổ phiếu ngân hàng: VPB 'tím lịm' sau thông tin IPO VPBankS, HDB chạm trần trong ngày đặc biệt  CafeF","Tue, 19 Aug 2025 07:00:00 GMT",https://news.google.com/rss/articles/CBMi7gFBVV95cUxPcnB2V3YtQ05PWjY4U0c2UHdNQk9KVmRzMmE0VFBIclE5X0FOWmRUQnhTSVVYRnlTVmtxRXJQZTd2OG9QaWw1bDUyUXRZRmFEWmFLUkV5NGZHWDZZbC1laTVvWmdBVlF5eTlFTWxWR2pXdV83ejJHbTFvQ1hWelBXclZBd0FiUk5jQlF0em1JYklhYklSRG9uRHVqbGVvTlJ4OHlwdmstNzd0Q0RUOVhEQVo4NmIyRHo5UnBlVU52N0JKSGRlenV3bXAtWWpNbkF3QlhiWHJfMmhmUU9xYWQySzJBUUJUYWhkYS1wU19R?oc=5&hl=en-US&gl=US&ceid=US:en,CafeF
VPB,Thành viên HĐQT VPBank đăng ký mua 10 triệu cổ phiếu VPB - CafeF,Thành viên HĐQT VPBank đăng ký mua 10 triệu cổ phiếu VPB  CafeF,"Thu, 21 Aug 2025 07:00:00 GMT",https://news.google.com/rss/articles/CBMinAFBVV95cUxOUmF3cE9NaHdpMmlGTno5eGtib3dJcTJnQ1l1NzlOQ3RoMjR6N3NmUWhsdXdmTV80Mkt0RFN3SVBKZTk0NGsxS1BsMlVrTzNBYmN2Z3R0d0RBTGViSXBXNXZrQzRHY25SVnJaaXNkMFUxNFg4bEMtM1I2eVowUWx2ZWhsSGk4VFRnTkRER3hhUlAzRHN6MURjSU5FRVQ?oc=5&hl=en-US&gl=US&ceid=US:en,CafeF
VPB,Hai con gái Phó Chủ tịch VPBank đăng ký mua 40 triệu cổ phiếu VPB - CafeF,Hai con gái Phó Chủ tịch VPBank đăng ký mua 40 triệu cổ phiếu VPB  CafeF,"Wed, 20 Aug 2025 07:00:00 GMT",https://news.google.com/rss/articles/CBMirgFBVV95cUxNR25CdmF2YW9hNFJ2amFXa1lUcktpbkhrODFzYXZ3RXRXekhCUEdPV1YzZDg3MmxpWHhUaGJKVzg5NWN5aUF3ZTR4Y2JUM0ZfWkEwWS16cUlMNHg3UDN1dnl1by10dWRXWExNR0dsQ1ZsSWg5RVJSOEZWQnQwUXFYVW9IeFZqZjRObkloLUExUGtfdjA0eWZqc3E5Y1hpcUVIM2xjRkpCMzFtQ0pad0E?oc=5&hl=en-US&gl=US&ceid=US:en,CafeF
VPB,Cổ phiếu VPBank tăng trần với thanh khoản cao kỷ lục trước thềm sự kiện quan trọng - CafeF,Cổ phiếu VPBank tăng trần với thanh khoản cao kỷ lục trước thềm sự kiện quan trọng  CafeF,"Wed, 14 May 2025 07:00:00 GMT",https://news.google.com/rss/articles/CBMivwFBVV95cUxOYTFWM3BBZTlBTmk1LTVoOWFNeUs5WDBoc2ZpM2lKakFUSzBNdlg2bHV0LVAweXhySGZ3cUVZeUd1UDRNQmNqMjRuWXNSY1MxSGxhQmh4SkJ4RW15SmdPakxzVGVYcUlzZlplSElJUmE0WHFzQ19LbGszemNucTdtVjBpcFk2ckx0Mng4WkdBbmM1ZUlzdzQ3ZGdISlRsWmtpM0tHQ1dzYzNNWkdQYmozNW5qVEw1ZHFsWWR1S3cxWQ?oc=5&hl=en-US&gl=US&ceid=US:en,CafeF
VPB,"Chi hơn 650 tỷ đồng, con gái Phó Chủ tịch VPBank ""khớp lệnh"" 20 triệu cổ phiếu ngân hàng trong ba ngày - CafeF","Chi hơn 650 tỷ đồng, con gái Phó Chủ tịch VPBank ""khớp lệnh"" 20 triệu cổ phiếu ngân hàng trong ba ngày  CafeF","Fri, 29 Aug 2025 07:00:00 GMT",https://news.google.com/rss/articles/CBMi1gFBVV95cUxNOV95REkzNU5LVmdPWmdCcXpPWEg0RlBEaDY0eGZtSURydDNFNFBnN1BIWU5PamlqV29qdXdpT2NlYjNCczhjWlZ0bnJtT2JiXzN2bUR5QzY3QlNxN3JkV2E4eGd0aGJkbGlBNGxlOW14eDF3UmdzSVNyUllzNnJpSm15NFBXX0xyMVFhYV96aUtHRmd3QXNqd0hzV2RKbDVuaVM0a0l3b3hCVnZDWTExYW9BYWZPNDZlUXVfX1R2dTg5OGVYVWV0ODZoRXhnUVg0TU1XSGtB?oc=5&hl=en-US&gl=US&ceid=US:en,CafeF
VPB,Thêm lãnh đạo cấp cao VPBank muốn bán bớt cổ phiếu VPB - CafeF,Thêm lãnh đạo cấp cao VPBank muốn bán bớt cổ phiếu VPB  CafeF,"Tue, 12 Aug 2025 07:00:00 GMT",https://news.google.com/rss/articles/CBMimgFBVV95cUxOOFNyNEFtMGgtWVRtd0ltUFo1aFZMbzRlQXhoRUtSZ1NpeElCZGY5T3dVRVByUllZZFdUMWNGU0ljbXd6WklLeHV6em0xOVJjY3l5UEVhSXhLWXZ5enVJeTB4ckprSDlYb2o5U3J1Z3BzRUdlSm9qckRrNUVZQk1HaHRPc3laMWVMS2dqWEJoWXFCRmJ1NGZsWGd3?oc=5&hl=en-US&gl=US&ceid=US:en,CafeF
VPB,Kế toán trưởng VPBank muốn bán phần lớn cổ phiếu nắm giữ - CafeF,Kế toán trưởng VPBank muốn bán phần lớn cổ phiếu nắm giữ  CafeF,"Tue, 05 Aug 2025 07:00:00 GMT",https://news.google.com/rss/articles/CBMimwFBVV95cUxPQ0x1a0s3QVlpVUNyby04aGlYZlMxaGdzbGY3bFhsSDBmSVZRbFkwbldUQ2pEX0k4anFlRGVUcTJpQmt5THBWdHVvZl9MQnpnYWZ4V1FaZW55Q3pKeGtaaHJvV1I4UEtmMkhwMDZvZWo0Y0FjRVNlaU9WaGtCR3I3TTJvRDlKemFiOV9WSnBnRXV6ZGlBZElPU2lIRQ?oc=5&hl=en-US&gl=US&ceid=US:en,CafeF
VPB,"Hai người con của Phó chủ tịch VPBank mua xong 40 triệu cổ phiếu, giá trị 1.400 tỷ đồng - CafeF","Hai người con của Phó chủ tịch VPBank mua xong 40 triệu cổ phiếu, giá trị 1.400 tỷ đồng  CafeF","Sun, 31 Aug 2025 07:00:00 GMT",https://news.google.com/rss/articles/CBMiwwFBVV95cUxNM1N2cFJwSHhMdXNNT3F3b3RWUFZjSnhhbmpQYWJrVTdlcUd3Y1ZlbnBLbG4yejVza1pxeWUtNkFnNjdVU01UZVdYU2k4SU5qbl9mQlBwaGd5NmdCU0lQa2NhMFpPbXZ2c0NfMmh0TVNPTnB6Y2JpcW54SVdZQV9Vd3hvZHQxYXlOM2NPcTQ4Tm1XNFdONTlnX0FSWWdKbnZsZ0ZsM20wVVlSQlRUZ3VjT1ozYXNhbHYxTTdQOWNCS0djZGM?oc=5&hl=en-US&gl=US&ceid=US:en,CafeF
VPB,Một 'bóng hồng' chi hơn 570 tỷ gom 30 triệu cổ phiếu VPB ngay trước thềm 8/3 - CafeF,Một 'bóng hồng' chi hơn 570 tỷ gom 30 triệu cổ phiếu VPB ngay trước thềm 8/3  CafeF,"Mon, 10 Mar 2025 07:00:00 GMT",https://news.google.com/rss/articles/CBMiswFBVV95cUxNMmt0SnZwbXFnWjM5X0lQWWtQay1XVDRtdGxzU1ctWEJNUDJnTGNnaFdXb2o3WHdhLXFtMHJvdlZtb2lnbXhqUTBMa3V3QTlEejRKVU5CQmE4MDdNbHNZa0ViQThhbWMtc0U4QzJlYk5yWkpZMWc4ejFuQzRFaTAzMlU0Nkk0NW1ldjZDdjFfdVdiMEZKLWNvUmZLeFpBemRwQ3BQeEpSODBUV0diNk9oT0J3QQ?oc=5&hl=en-US&gl=US&ceid=US:en,CafeF
VPB,"Nhà đầu tư ""nội bộ"" mua cổ phiếu VPB theo con của Phó Chủ tịch VPBank - nhipsongdoanhnghiep.laodongcongdoan.vn","Nhà đầu tư ""nội bộ"" mua cổ phiếu VPB theo con của Phó Chủ tịch VPBank  nhipsongdoanhnghiep.laodongcongdoan.vn","Wed, 03 Sep 2025 07:00:00 GMT",https://news.google.com/rss/articles/CBMixAFBVV95cUxOVUdmZWNfNkRKWlJvNVVVUnZ5ZlRKb3VrM2IxRGIzX1BON0FHSV9hMXk0VEVKakhpWnBSeG02dkVNa0RSOTQ2U0V4eUNSWGQ0Qjd0bjJ2TzZURWpBWTE2MkxjcVdOMmM0QzBfa2RMdTdTeTNUREJOMTRMVXNfa3VnbWtHaXVmaVJYMUloOEJCVzZfMTJnSWE1cUg3NnJPOF8tUHlReC1FWU90d2plYnVTT25sYzlld0gwTFVSdUotVUQ1UGtt?oc=5&hl=en-US&gl=US&ceid=US:en,nhipsongdoanhnghiep.laodongcongdoan.vn
VPB,"Kỳ vọng hạn mức tín dụng 35%, cổ phiếu VPB được định giá lại - diendandoanhnghiep.vn","Kỳ vọng hạn mức tín dụng 35%, cổ phiếu VPB được định giá lại  diendandoanhnghiep.vn","Thu, 02 Apr 2026 07:00:00 GMT",https://news.google.com/rss/articles/CBMipAFBVV95cUxQb21BWE5jaHA1S3B6bE5zUC1WVUJKUHd5Tk9ubkRqX1dlVkpKWG00amVTa3QtSThKYmZPcmRiWkl4TnlwaUFxbDY3Q2lmNzl2c19pb056N2dDcU14SWdVQWRocGR5ZUdzNFJwR1Q3RVRGZHZkak9zakVIWjhMOEVwM1ZkWmJIdHdYM3E0LW1YdVlQb3dHdEd1bERhbXFFcVVxbnE0Rw?oc=5&hl=en-US&gl=US&ceid=US:en,diendandoanhnghiep.vn
VPB,Lãnh đạo VPBank chi hơn 500 tỷ đồng mua cổ phiếu VPB - thitruongtaichinhtiente.vn,Lãnh đạo VPBank chi hơn 500 tỷ đồng mua cổ phiếu VPB  thitruongtaichinhtiente.vn,"Mon, 10 Mar 2025 07:00:00 GMT",https://news.google.com/rss/articles/CBMinwFBVV95cUxQRkxCc1JHRTU3YjQxbi1SMUFXZ283M2RlS1piYkNKaUVNT1hpMGNKNDlTNEp0bGZsbXhXdnRVRlByRnBRU2tKYWVJS1R5VUpsX1dxSXpxdTByRUg4OFJtSGVBandqYmFuSnhjbEdxRTNIamdiTTU4bDNtZm5ZV1o3ME04dzJmWjdHQUptS00telk1dDBwX1B4YjJRTGtGQ28?oc=5&hl=en-US&gl=US&ceid=US:en,thitruongtaichinhtiente.vn
VPB,Con gái Phó Chủ tịch VPB mua thành công 20 triệu cổ phiếu - VnEconomy,Con gái Phó Chủ tịch VPB mua thành công 20 triệu cổ phiếu  VnEconomy,"Sat, 30 Aug 2025 07:00:00 GMT",https://news.google.com/rss/articles/CBMiigFBVV95cUxQdHdSTTJOb0NFMUpHZDNtR2w3NndIT1QtX29uTlUtWFhTc1RteHdZYWI0VHVJQ3FuaDdKdHl1Q29OM2NnUmgzd2pRcnExWWdYYkpwWHZ6M3hjT01JWEdBOTZ5WHFudDRlME4yS3ZjeEVIXzBqWkhtZjJWVW1yUjdabmpiQjJENUw5aWc?oc=5&hl=en-US&gl=US&ceid=US:en,VnEconomy
VPB,"VPBank muốn nới room ngoại, khả năng bán 15% vốn ngân hàng mẹ vào quý I/2022 - baodautu","VPBank muốn nới room ngoại, khả năng bán 15% vốn ngân hàng mẹ vào quý I/2022  baodautu","Sun, 19 Dec 2021 08:00:00 GMT",https://news.google.com/rss/articles/CBMiqgFBVV95cUxPQTVMUkVEem8wb1EtdHdoUzRNMmRLaFd2dUl6NHB1aGpiV3I2VEZsUUtBVEhNMGdEX3hIdGFoXzhFbFBhR2k0dTlDakoxVVNYNG10aEFWaXA3N2FrNzExY09CWWJodnc5Rl9hYUsxb1BvdWhVSUM1dVExdWVDc2VmeFFZT05hVEhuWUdaWU9pV0tlYkNTWG9DcENIMEtfaFpFMkw4NmRNRGtXZw?oc=5&hl=en-US&gl=US&ceid=US:en,baodautu
VPB,2 con gái phó chủ tịch VPBank dự mua 40 triệu cổ phiếu VPB - Báo Văn Hóa,2 con gái phó chủ tịch VPBank dự mua 40 triệu cổ phiếu VPB  Báo Văn Hóa,"Sat, 06 Sep 2025 07:00:00 GMT",https://news.google.com/rss/articles/CBMioAFBVV95cUxQLWxTNVFlNkhYbmFlaXp2bjhvZ01BRnFMUjZxNW9PNmlNMWdlaF9ScWZWX3duUXEybE8zMjk2MnEtQ3h5QW9KdnFMUWYtMnZhZWdxTXhhWW5LUjA1R2ctYlNvSEs4WmxOQ24tSkU2RkxTNWtqLWlIcVdYcTNaMWtZclBBaVVjY2w0ZXhuVDMwYkp3MzhSNFl6R1NodjA3TGY3?oc=5&hl=en-US&gl=US&ceid=US:en,Báo Văn Hóa
VPB,VPBank (VPB) hoàn tất phát hành cổ phiếu riêng lẻ cho nhà đầu tư Nhật Bản SMBC - Tin nhanh chứng khoán,VPBank (VPB) hoàn tất phát hành cổ phiếu riêng lẻ cho nhà đầu tư Nhật Bản SMBC  Tin nhanh chứng khoán,"Fri, 20 Oct 2023 07:00:00 GMT",https://news.google.com/rss/articles/CBMixAFBVV95cUxPRXVZcDRsb1FVWTNuVTM0MjNSaGhXQzUzS1ZPOWphZnZjRlM5ZjEyWERvZk41T0YyZ3dJVk1reGQwVkdVWjBvS2hWX2lnUmt1TUl5N1hBMnZqOFFsdS15SDY1OVVZdUlyV1pnVTB3enpOUnlRbmI0QllPSFV4UzY1VER0dDM3MmtySHF6X3RpVjIxU3Y2a1gtdHdEbUVheUpWXzRFc05sa01ldVBCNkw0M1k2VXdVWEtKTVJiUGJLVUNsbkta0gHAAUFVX3lxTFB4bDA3ZzNEVkQyeFpQNFhmY0FvNkVJWFBvZEljVjJMUTdWM2hKTkJEWmpvd0ZkSWdad3M4YW1uUGxBMVg2YXVPYlJzZ2lGdjYzNHRjN1IzTGd4UUtkQ0tOYzMxc1RFeUl1UXhncEQ1TkZRU3hSUzA3ajNIay03aERUYWhXNThvUlI5WUZmOWJONFNDYm9YUTdkQkxzYXROemlJUTBOUGpRME9SLVFXMUF2bWhvS2JxX242LTIxRUYySg?oc=5&hl=en-US&gl=US&ceid=US:en,Tin nhanh chứng khoán
VPB,Khối ngoại chi hơn 430 tỷ đồng ''gom'' cổ phiếu VPB của VPBank phiên 6/9 - CafeF,Khối ngoại chi hơn 430 tỷ đồng ''gom'' cổ phiếu VPB của VPBank phiên 6/9  CafeF,"Wed, 06 Sep 2023 07:00:00 GMT",https://news.google.com/rss/articles/CBMirAFBVV95cUxQS0JqaS1qUkFXRzNyY25rZEJHZG4xaXRrQTZVaUFycXZaLXM1dTRvbHVEV3h6bHAzdHdTUnpPbGF5ZzcxNHctNVRNQ291MVBBNVE2dm9fZVd0NF9rWmZKQnBQUXhmNUZLeEUxUzhXNW5UN1N2YXpkenQzVnFlUXIxS3ZTaE9LcVZmNFFyZmduQjFRZEhJMUx0NG02a1dadEFDdXoxbGVLVVJRc2JB?oc=5&hl=en-US&gl=US&ceid=US:en,CafeF
VPB,"Cổ phiếu VPBank vượt đỉnh, con gái sếp lớn vẫn đăng ký mua thêm - Znews","Cổ phiếu VPBank vượt đỉnh, con gái sếp lớn vẫn đăng ký mua thêm  Znews","Wed, 20 Aug 2025 07:00:00 GMT",https://news.google.com/rss/articles/CBMinAFBVV95cUxPX0QtVU1lU05oTVM5ZXFPdTZULW4tckU3LUR3Z2hUTENHLWxjVDN6SC05UHhXUjllTUIwbDN2a0hSMzcxdjBXa1IwQ3dEcjRpWkRNYlJ4U19TVTlCbUxCa2VpM3A0aVlHZXIxTDl0SEM2c1BSTEU0R1JKcGVNZFJyNnh0d3JVVG42ckt2b2FLcmp5OGNoVEw0cWdpVXg?oc=5&hl=en-US&gl=US&ceid=US:en,Znews
VPB,Hai con gái Phó chủ tịch VPBank cũng đua gom cổ phiếu lúc giá tăng vùn vụt - Báo Thanh Niên,Hai con gái Phó chủ tịch VPBank cũng đua gom cổ phiếu lúc giá tăng vùn vụt  Báo Thanh Niên,"Thu, 21 Aug 2025 07:00:00 GMT",https://news.google.com/rss/articles/CBMiuAFBVV95cUxPd0tZRzRmU0IzQkhPZ1ZSV2lCSnNBTXphNHFSajN5UE9PN3NnTklzTXAyS1BuZUJjMUFzeWdKcVhkNm1tZW1LZ29xZ0pMY0puRnhBRS0ycml6M2RqTElGNjF1ZDc1U3JMQVkwcGNpaVFtREFhdzBuN3gxLWdvRWJHM0ZnQlJhcnQtV25MWnBUZ1c3RW8wSERueDBfY19uRmVkc3ZrSDJBUTVOQldBSmh2Y0JjY0xXNjdM?oc=5&hl=en-US&gl=US&ceid=US:en,Báo Thanh Niên
VPB,"Cổ phiếu ngân hàng dẫn sóng phục hồi, các công ty chứng khoán chỉ ra cái tên sáng giá - thitruongtaichinhtiente.vn","Cổ phiếu ngân hàng dẫn sóng phục hồi, các công ty chứng khoán chỉ ra cái tên sáng giá  thitruongtaichinhtiente.vn","Tue, 20 May 2025 07:00:00 GMT",https://news.google.com/rss/articles/CBMiygFBVV95cUxNLS1zZWZabm40Tzg1aXNNcFhySDJLU1kyVTI4T1JmTHhkWF8tY3psZHYwUUZqeWkteWtLdVZYeGMyMXlVMm1BU0FjNjhyWU5jaG5HVTluTVRyaEZTanctaDh6SmFxNzlKaVFEUnhrdjZ4dm5rMDBqRTd6cnRQWWVSR2M5VmhzXzFhc3FBRGcyS0VzU0VmSENwSFFBVnhCa2dNRVFSTmtsSll5aDN5dzZqYjhzRXhfQUtrUERHNHVzX1lNZEZXNGhzWGpn?oc=5&hl=en-US&gl=US&ceid=US:en,thitruongtaichinhtiente.vn
VPB,"Cổ phiếu trong xu hướng giảm, Kế toán trưởng VPBank không muốn bán hết số lượng đăng ký - Chứng khoán DNSE","Cổ phiếu trong xu hướng giảm, Kế toán trưởng VPBank không muốn bán hết số lượng đăng ký  Chứng khoán DNSE","Thu, 11 Sep 2025 07:00:00 GMT",https://news.google.com/rss/articles/CBMizgFBVV95cUxPN0dBbFMxcFJlVjhnV05WVS15ejZlODFmbjE1cFJjLXhVQm5Va0hOWl9uYkhCM0pKS3FDUEx0Rk5aenNZcXdhaDN1R3BJdkt4VTUyazBIcTVwNF9GQlJNUlJCZ3BaQmJIWjRuYjFuUGhXTC1vWnhJdHdvaVEtNEVBdEJvU2EtY1FWeFl1eEVzZDY4VXlMT1FjMy0xZXRqT1NZSVdMNlkxWVBBYXZGUEwwaTBmWEwyTjVDdVFyMUIyVHE5RG9SdC1xTk43WGFHQQ?oc=5&hl=en-US&gl=US&ceid=US:en,Chứng khoán DNSE
VPB,"Giữa lúc VPB tăng 109% sau gần 2 tháng, thành viên HĐQT VPBank đăng ký mua 10 triệu cp - Báo Dân Việt","Giữa lúc VPB tăng 109% sau gần 2 tháng, thành viên HĐQT VPBank đăng ký mua 10 triệu cp  Báo Dân Việt","Thu, 21 Aug 2025 07:00:00 GMT",https://news.google.com/rss/articles/CBMiwAFBVV95cUxPUGhmenp0YkFtWE5XeTFHcF8tN1F4c3Nmb3FqYWlVY0FIS1czbmJ2Um9meFROVlhvdlkwV290Q0Vac2FaQlZrc2lVdkpNRnRURWNHU1FwSGlUNVpxOVpRdXllbkF0Rkt2dC1mRnl1MUJJQkZsdDhDRjEyV0p6TFdReFVOOFg1ZlpvekdJN1M4QjBJRnRpd3p4LTZYbHkzZTBQSGN5N2w2N3NPRzFzTmlGLXBkZUVFQVpERlhxcTNXa1Q?oc=5&hl=en-US&gl=US&ceid=US:en,Báo Dân Việt
VPB,Tái định giá cổ phiếu VPB sau thương vụ IPO VPBankS - Vietstock,Tái định giá cổ phiếu VPB sau thương vụ IPO VPBankS  Vietstock,"Wed, 19 Nov 2025 08:00:00 GMT",https://news.google.com/rss/articles/CBMinAFBVV95cUxNc0dkSlV2M0NxZi02dkR2NlR4Z0RLT1ZZSUh3aXJvTDZTcmN0NWdxOGVKT2hsdm91Tzl1bmllbk5rNURnVk5ubzU1WW9xZExTOHBkbjBGNmFoM252OFF0V2tXNDBabF9aSWdiWjR4Z080RVlSQTRiSm9LeXpTbEZJeDdSYkF4VGc4REJ5U0QzaUV3V2NkMEQydjlDYTE?oc=5&hl=en-US&gl=US&ceid=US:en,Vietstock
VPB,Cổ phiếu cần quan tâm ngày 29/1 - Tin nhanh chứng khoán,Cổ phiếu cần quan tâm ngày 29/1  Tin nhanh chứng khoán,"Wed, 28 Jan 2026 08:00:00 GMT",https://news.google.com/rss/articles/CBMihwFBVV95cUxPT3hKZVd3d0ZnZXVISXZFTjNmdHg1MEN4eGd1WjY0N29xVGJYLWNpQWs2M01qRC1sR1dzU0dKWTJxLWs3bU9sRGVZQ2xlVTJxbzJrb3FZdHNwNGVLOHlKUTIzVVk1NnJaWmFtcHBoQXVqMHJnOVV3bm9TbnZGY0FXYTcxc01FNDDSAYMBQVVfeXFMTkZoR0tCb1ktY29wbnJPYkJ5ZjZYcjBxYjV4dEkwMUZHU3RnQWM4aDdHa3ZFWE9KUWdtX2tPSTQxSW9RclJIMGJSM1FJUk9jX1A0dnNXUUVZSlZ4bFRTT1dyMWlWbV9pMTBNNm1NUW91WFpmZmxtQk9uTm9HTDRvZ0ZnV28?oc=5&hl=en-US&gl=US&ceid=US:en,Tin nhanh chứng khoán
VPB,"Cổ phiếu VPB, SHB và GVR nằm sàn, chứng khoán giảm hơn 42 điểm - Báo Dân trí","Cổ phiếu VPB, SHB và GVR nằm sàn, chứng khoán giảm hơn 42 điểm  Báo Dân trí","Fri, 22 Aug 2025 07:00:00 GMT",https://news.google.com/rss/articles/CBMitgFBVV95cUxQV1JfcDhvSkdxMkFrWlZ6TmpQSTBJVDZ5SXYxbE9uOXgzaElQRlBrVzlOX3U5Z0JtZnFpdkk0SWg0bTZVR1ZTWTFtblNXSUNxbWpSYjdoZkhfRTVtREtlNzM0VHpoeXZoVEl5U3huY1lZZ0ZLVHBaMWVTMkhvdnpFeExHQ0xiM3c3cEV6OHRhMXMzZTZ1MWlEVnBLdDdCVW1JeVlVVmg4SmNHY09LV3JNX183VW91Zw?oc=5&hl=en-US&gl=US&ceid=US:en,Báo Dân trí
VPB,"Cổ phiếu ngân hàng tăng giá gấp đôi, con gái phó chủ tịch HĐQT vẫn chi ngàn tỉ mua vào - CafeF","Cổ phiếu ngân hàng tăng giá gấp đôi, con gái phó chủ tịch HĐQT vẫn chi ngàn tỉ mua vào  CafeF","Thu, 21 Aug 2025 07:00:00 GMT",https://news.google.com/rss/articles/CBMiwwFBVV95cUxQZnN0NFRHaHlsNzJ3alZvNENsSFl3aEdOcnEzT0RRdk5RZzVXRjFSeFk2WV9SYkRqNThYVEliTjFVSUpvamNoYkhuaF9oQkNRcjE0X2E5cFd1bHU5c1RNbUdqal9zZ2lXZWE4Vk5wX2JTSnktUk80RmlBVEZJNXp4Ri1hOTRXaU9ZT3llbkZwTmotSTI0STdBU0RxYVlkbDc5V29saU9xVERUUGNJcnJlUHJ4aDRlVlllTWJpY0pPV2NVYVE?oc=5&hl=en-US&gl=US&ceid=US:en,CafeF
VPB,"Xuất hiện thông tin VPBankS IPO trong quý IV/2025, cổ phiếu VPB lập tức tăng trần - Laodong.vn","Xuất hiện thông tin VPBankS IPO trong quý IV/2025, cổ phiếu VPB lập tức tăng trần  Laodong.vn","Tue, 19 Aug 2025 07:00:00 GMT",https://news.google.com/rss/articles/CBMivgFBVV95cUxQaXpUVU5UenhyZjFudm5ncXpXUTNta2dsOUxxUU9EZ2tsODdLVHAzaVJhUmdnWThWR3ZaelQ5TlhmZ0hmU0h3V0hSLUwxcVdKY3FvdXc3WXZlaVVVcUc3MnNuTklOWWdtWDRPYkI0dThrdWFOQTZvTVpDTjllSkxtUFRLXzBfMS1yMlJtdGN0cWVhbEE1MTdkWkxBYjFmZkdjSUk5M0tpOUpCc2tKUjZORl84NzVwZ3ZMNVpQSHFR?oc=5&hl=en-US&gl=US&ceid=US:en,Laodong.vn
VPB,"4 cổ phiếu ngân hàng được khuyến nghị MUA, tiềm năng tăng mạnh - thuonghieucongluan.com.vn","4 cổ phiếu ngân hàng được khuyến nghị MUA, tiềm năng tăng mạnh  thuonghieucongluan.com.vn","Wed, 11 Mar 2026 07:00:00 GMT",https://news.google.com/rss/articles/CBMirAFBVV95cUxOc0hibm5CYks0YUhXZXJnTG04WHk0SDM4eFZmRlZjNmNYX0Q3SUtpV2s1VkVFSXlSZHhLeUlqR0Z2dlhZUk5wc00zR2JFYV9neHJ0QWpoTUhBSjFWcWlWWDAzbnJYYmo3TnhsSTM5WmhCZlBHTlhZd2QweUpaNnNmcG9iZm1NQUtCZVJTUXp4QVh1eHNDc3oxb0s2SEhxMXdrVHVwMVV6WnQwdHdN?oc=5&hl=en-US&gl=US&ceid=US:en,thuonghieucongluan.com.vn
VPB,"Tín dụng tăng vượt trội, Ngân hàng VPBank (VPB) huy động 7.500 tỷ đồng trái phiếu - Tạp chí Công Thương","Tín dụng tăng vượt trội, Ngân hàng VPBank (VPB) huy động 7.500 tỷ đồng trái phiếu  Tạp chí Công Thương","Sun, 06 Jul 2025 07:00:00 GMT",https://news.google.com/rss/articles/CBMivAFBVV95cUxOZGtkcXozR3FHbHZwTXVkRVdDSkFKc2pKX0NjWmtjMG5NdDRPU0xQUlRqLVBqdVFTNFIyYWE4UUFnV1pHTG94SFo4aWtGeDNhRjlIbUhWRjFDd3djcDU2NUxiR0tBcFNWMTRkVnMxdDJJYVg1NTVQNm5UTU1FZ2REZG9pc1lWWGk3UEo0N2VPQzkwVGhoN3k0YUpCN0dUU21jSk0zdnd6MjI4V2FHS3RRLXFVX3lqQm5aUF9XSQ?oc=5&hl=en-US&gl=US&ceid=US:en,Tạp chí Công Thương
VPB,VPBank (VPB): Phó tổng giám đốc thường trực đăng ký mua 30 triệu cổ phiếu - Tin nhanh chứng khoán,VPBank (VPB): Phó tổng giám đốc thường trực đăng ký mua 30 triệu cổ phiếu  Tin nhanh chứng khoán,"Tue, 04 Feb 2025 08:00:00 GMT",https://news.google.com/rss/articles/CBMivAFBVV95cUxONWRSNGxNM2lXNXh2RFpWUTlzSUo1OXNhcEpkeElGRU91LWtTUm1vMUlMVjJBWG5Jd3VkbFFicm85ZU12QzgzYkVFVFFWRXlWUk9QUlZYYjJuRnd2VERteGxyWVEzS2RkWmlHZUdMdzV2SmREb3Zrb2EtcVFqLXRZcldnWnZKUDlPdXd0WVh6LV9xQ1FOdlNBZGRYS2c0TF9NUXpGWWRJUmZzNGc1ekYzZDZfNDdIaVJhb0N4WNIBuAFBVV95cUxNdldxck1qdmJ1cnJ6aHd3aHM1Z3pmSVM3bXNmU0dHeW1Cb3ZENEdIOXd2bm9xVEJKNnQ3NTZCMy0xVkRyOEE5bzMtdjlZSkFPMWJLWXBCbng5emFHX2VpSkZrbkJCRk1TeVNCMjg1bndhVXhFeHlfN3h5elFsVkZUaUo5Q1A4SzM2bkNILXZNQ2pWMzg5YW9pUnRhMzhnUUlpbXpKUlF5YmhkVnBuLTUyNEtSa2pqVDBF?oc=5&hl=en-US&gl=US&ceid=US:en,Tin nhanh chứng khoán
VPB,Cổ phiếu VPB - Có nên mua? - 24HMoney,Cổ phiếu VPB - Có nên mua?  24HMoney,"Tue, 13 Jan 2026 08:00:00 GMT",https://news.google.com/rss/articles/CBMic0FVX3lxTFBYU1Z4TUxNZGFLdnQtZWNPSDdKQUtTek5pd2doblZZZ0hnWmE2cmlPRTlvY1g3dkNBWU1XMWVwOUVDQkE2M2NHOHdUcDlEZkxPS0UzRUpkZ1lJbFN4R29MTW9XRjFBbU0tdUkxRzJQdXNOUW8?oc=5&hl=en-US&gl=US&ceid=US:en,24HMoney
VPB,Cổ phiếu ngân hàng hút vốn trở lại: Đâu là lực đẩy? - Tạp chí Kinh tế Sài Gòn,Cổ phiếu ngân hàng hút vốn trở lại: Đâu là lực đẩy?  Tạp chí Kinh tế Sài Gòn,"Mon, 26 May 2025 07:00:00 GMT",https://news.google.com/rss/articles/CBMiggFBVV95cUxNZXY2c05XemtLdWVaVDA5bGc0QmxFeERYWEFLYl9tck5lc0J1UWRMY0lqbXVBdnUtRDdCOTdXS3Q1ZldHNEV1TUMxNjF1ZkQxWklqUjFzT2RiOV9PaVJaeHRkQmlTRERDbnpXZ3l2WkRQZWVZeGp4SkdfQXpyVnp0Tmx3?oc=5&hl=en-US&gl=US&ceid=US:en,Tạp chí Kinh tế Sài Gòn
VPB,Ngân hàng lớn nhất Thụy Sĩ trở thành cổ đông của VPBank - VnExpress,Ngân hàng lớn nhất Thụy Sĩ trở thành cổ đông của VPBank  VnExpress,"Mon, 19 Jan 2026 08:00:00 GMT",https://news.google.com/rss/articles/CBMilAFBVV95cUxQMWx2MENBZnNpbTlKNWJqTUdtSkExSWJ0Rm9Ud0Q1c09tTHB0cVRJMkEyRl9TZHltblpvRHhfbVVBTlZRdlJYa1BtcXpiVmRGRkhlUEd2MnNZRERWSDJfM2owTkQyR1dDMmlucXN5dGdDQmRaZmhYY0s0NTd1cW1pbEVIdC05YlotM05WZER5d05Oazky?oc=5&hl=en-US&gl=US&ceid=US:en,VnExpress
