ticker,title,desc,date_raw,url,source
VPB,VPBank thực hiện chia cổ tức tiền mặt 10% trong tháng 5 - baochinhphu.vn,VPBank thực hiện chia cổ tức tiền mặt 10% trong tháng 5  baochinhphu.vn,"Wed, 15 May 2024 07:00:00 GMT",https://news.google.com/rss/articles/CBMiogFBVV95cUxOWWhfZFhDSUhQTTVEQlVLRVhMSmhCcVdyVkl2aHQtSEg2d0NHQjVUZWZwUWdZNGgzUnIxTlNTVW9vSFhzRkkzWXlOVDhETmEtY2s0VTBkSWQ3WGpXc2RURGhJVkp3VjZpZllfTjY5amM0ZlF1aVBia0hEUWx4c283eXRTS0I4ZDZoRnVRX2h1LXRqb3NlcGExUjNmZ19tODFoVmc?oc=5&hl=en-US&gl=US&ceid=US:en,baochinhphu.vn
VPB,"Phiên 21/8, cổ phiếu ngân hàng tăng ồ ạt: 6 mã tím trần, VPB và TCB tiếp tục hút tiền, nhiều cổ phiếu tăng hơn 10% từ đầu tuần - CafeF","Phiên 21/8, cổ phiếu ngân hàng tăng ồ ạt: 6 mã tím trần, VPB và TCB tiếp tục hút tiền, nhiều cổ phiếu tăng hơn 10% từ đầu tuần  CafeF","Thu, 21 Aug 2025 07:00:00 GMT",https://news.google.com/rss/articles/CBMi8wFBVV95cUxNTUxMeGhWRm5mS0FkdmN0eG40S3Vick1TUFB1eGt3N0Vxdk8wX0pZVGVqQ3ZneUdvMlhXaHIyNWNHeXBwRHN4cXkyQjlzckwtT0FuUzhhUzBJOTVfR2pYS2tReERWUm5vaXZOcVktaXB5SVkzSUJwdXlXMEc1dThCeUFZQ0JnYlFhOXNXc25mbTJfS1JVSXotM2gwRnhULVV4ZnRiYmx5SXhJUktHRnRiREF4YlJaR2RwbEM1M041d1VXWkhuUnhZV0xSOHFnelppeXFPVmpIeFA0clVkdVA2c1JGRHBaa3FIeW5USmFFT3JuZUE?oc=5&hl=en-US&gl=US&ceid=US:en,CafeF
VPB,"Một số cổ phiếu đáng chú ý ngày 30/1: MCH, VPB, VRE - thuonghieucongluan.com.vn","Một số cổ phiếu đáng chú ý ngày 30/1: MCH, VPB, VRE  thuonghieucongluan.com.vn","Fri, 30 Jan 2026 08:00:00 GMT",https://news.google.com/rss/articles/CBMimwFBVV95cUxNNU95WEVYemJpZzhlVTRTc2JtRHNoZi05YXpZZGJXVnJ0Zmw4LVJXRVZHSVIzdzM4aFd2d2tHdXpvYml5SmlSVVRqQWZxNDc1Uk9sbnYtMVA1aHZqS1BxS3hFYTZhc1BTNE5xajlwNWFBN1FnOG5yR2xDYWlNX3dmMDNkQnFVS0ZZWmphUEc5M1B0MU1rOTZLYkdVQQ?oc=5&hl=en-US&gl=US&ceid=US:en,thuonghieucongluan.com.vn
VPB,"Một mã cổ phiếu ngân hàng 'lọt tầm ngắm' CTCK, tiềm năng tăng giá 38% - nguoiquansat.vn","Một mã cổ phiếu ngân hàng 'lọt tầm ngắm' CTCK, tiềm năng tăng giá 38%  nguoiquansat.vn","Mon, 02 Mar 2026 08:00:00 GMT",https://news.google.com/rss/articles/CBMiowFBVV95cUxNbnZSUllXbFh5TU4wUHJPX3hWUU9HNEk2OHlFckJ4Y0pCc2psTHc3M3gtMEhZSWJXTWpkbE1RUW5MWEUtTHRxR1diblM2N3ZZeWRFTk45QTZfRy1lbGpMSTVPSFJoZEtfdWVWZENubFFoMDlIRVpBOEwwcHFEdEczVTNES3lKdDRyZVZXYmZxdjFnQUVPdUxENHJkZ3Fla1VONkZj?oc=5&hl=en-US&gl=US&ceid=US:en,nguoiquansat.vn
VPB,Phân tích đầy đủ nhất báo cáo tài chính quý 3/2025 cổ phiếu VPB và định giá 2025 - 24HMoney,Phân tích đầy đủ nhất báo cáo tài chính quý 3/2025 cổ phiếu VPB và định giá 2025  24HMoney,"Fri, 17 Oct 2025 07:00:00 GMT",https://news.google.com/rss/articles/CBMivwFBVV95cUxNOXhpdUFUc3BsY3NvLWRnMWdxOU02TV91NWZaSndrZGtFUEx0WktCdEdMRXRsM0drQUh0RDFEYVk5UkFsNTQ2cHRGdlBYWEU1NjdFT01UdWFQb1BYNkVoTGZYYmg3NGNLYXpyMnpzUmRsNW9iNVdBdVVwNnpQQTc2NzZkeHdwcGxUTTR0LVRLRV9jUUN0TGIyR3dEYWF0ZnZmR3dvYkNlLWFZREVQUUJNT3YxamwzZHJIVVRGOTBfQQ?oc=5&hl=en-US&gl=US&ceid=US:en,24HMoney
VPB,Ngân hàng VPBank (VPB) lần đầu công bố Báo cáo Phát triển Bền vững - Tạp chí Công Thương,Ngân hàng VPBank (VPB) lần đầu công bố Báo cáo Phát triển Bền vững  Tạp chí Công Thương,"Tue, 27 May 2025 07:00:00 GMT",https://news.google.com/rss/articles/CBMiqAFBVV95cUxQZWVQV1NzZkU4WjdmZXdrOExjdWlrdzJMR3E0c3BianNzSHdESFR3ak9mdVo0X2hCMV84R0Q4SDY0bnhmM2l2WS1uVVRvWnUwT1l6Q0RvclN5QnVXTXZEWEVwaWJMaEhpbHVwVFNDVldBMWJVZkl3OFQwQmFIVVFMcHZvTUp3UVgtaWZ1VmJBeUVFY1ZpTmEwWGxKeDFTSDhOb2tSNURjR3c?oc=5&hl=en-US&gl=US&ceid=US:en,Tạp chí Công Thương
VPB,"Ngân hàng VPBank (VPB) và SMBC vừa hoàn tất thương vụ bán vốn trị giá 1,5 tỷ USD - Tạp chí Công Thương","Ngân hàng VPBank (VPB) và SMBC vừa hoàn tất thương vụ bán vốn trị giá 1,5 tỷ USD  Tạp chí Công Thương","Sat, 21 Oct 2023 07:00:00 GMT",https://news.google.com/rss/articles/CBMiuwFBVV95cUxOcDY3YllRQmxoM1RqemtIWnBWRVVaNVJBcW9vUmM3eEs2NmNHMGVVSzdTcTh6NXRfSmNmN25EdExqZTZFMFNIVmtzaGRHLWo3YWhVYy1ZWk1QZF81SFpTMnowZlBaRE9tNXZpTWUtemQ3ajQtTmVxZ1RNNUpuVEl4N0U1bUJqTHBUMFkzbXRiQWRMS0VYeHFPZThGS2JsSEFHMkU3TFNKTGxrcVZIYWg2QmNVUGdINVR1WEFz?oc=5&hl=en-US&gl=US&ceid=US:en,Tạp chí Công Thương
VPB,Cổ phiếu ngân hàng nào đang được khối ngoại gom mạnh nhất? - CafeF,Cổ phiếu ngân hàng nào đang được khối ngoại gom mạnh nhất?  CafeF,"Sun, 18 May 2025 07:00:00 GMT",https://news.google.com/rss/articles/CBMingFBVV95cUxPQ2FlQ29xNFdDb0xqQUJIVWEzNXc0WUVjTjNucXZKM2ZtUW84NUIyVkc3Q1dNcXU5NWhDNVhodDR1OHVBVW52RHRzNVNMbjVyQ2lWM3NyZGh6YUlKRFJHMVc0dFJHOHZ2aEJMU0M3YTFHS3JJZG1rOEVOcFRabnhsM1dDdDZobEZSWEdqSzlRY1gxTkM5WEkzSGtKRWNyQQ?oc=5&hl=en-US&gl=US&ceid=US:en,CafeF
VPB,Hàng loạt cổ phiếu ngân hàng nằm sàn chiều 25/8 - CafeF,Hàng loạt cổ phiếu ngân hàng nằm sàn chiều 25/8  CafeF,"Mon, 25 Aug 2025 07:00:00 GMT",https://news.google.com/rss/articles/CBMikAFBVV95cUxNeEVUWXF4VWdqUGdLblU1NVBfSVVpOXFtYU0tcTJKeDhQR21QXzg2WjlWSUw2d0dVRGpmVXdIbm9FLVRDcnJkQnZOREw3S3hGdlRzQ1c1N2h4N1BYemt2Nkkyb3Y0Wk41cFZXZHdldllQYW1JclRoRFRFbkU1ejljRXNqSXNFZGQ0OUYxX3MtUTE?oc=5&hl=en-US&gl=US&ceid=US:en,CafeF
VPB,Lãnh đạo VPBank hủy bán cổ phiếu vì lý do cá nhân - Báo Sức khỏe & Đời sống,Lãnh đạo VPBank hủy bán cổ phiếu vì lý do cá nhân  Báo Sức khỏe & Đời sống,"Sat, 13 Sep 2025 07:00:00 GMT",https://news.google.com/rss/articles/CBMinwFBVV95cUxQUmd2dThiQW94c1FZdVlKbjhqNEc0SlIxa1MwaFBZa1lSdHBab21TbzBacXFzT1ZiUGVYUGI3QjAyUDMxZHUtV2pmeXpsM2wtaW11U09sRmRNVndnMDM1ZHpuUlpxUnFST2c4YXBDWE5DNnFzUk1lcmFjTWhZZTdYUkZFbHFrZlVOT01IZF9zSDB6NnhiNWpsZWNXbGVYT28?oc=5&hl=en-US&gl=US&ceid=US:en,Báo Sức khỏe & Đời sống
